Sheet: Hoja 3
A2: DOCENTES | B2: CARRERAS | C2: ASIGNATURA
A3: ANA ROCIO CARDENAS MAITA | B3: AGRONOMIA | C3: ABSTRACCION DE DATOS Y OBJETOS
A4: AVELUZ RODRÍGUEZ AYLLONE | B4: ANTROPOLOGIA | C4: ADMINISTRACION DE TECNOLOGIAS DE LA INFORMACION
A5: BORIS CHULLO LLAVE | B5: ANTROPOLOGIA / EDUCACION | C5: ALGORITMOS AVANZADOS
A6: CARLOS FERNANDO MONTOYA CUBAS | B6: ARQUEOLOGIA | C6: ALGORITMOS PARALELOS Y DISTRIBUIDOS
A7: CARLOS RAMÓN QUISPE ONOFRE | B7: ARQUEOLOGIA / CS DE LA COMUNICACION / EDUCACION | C7: ALGORITMOS Y ESTRUCTURA DE DATOS
A8: CLAUDIO ISAIAS HUANCAHUIRE BRAVO | B8: ARQUEOLOGIA / EDUCACION | C8: ANALISIS DE DATOS EMPRESARIALES
A9: DARIO FRANCISCO DUEÑAS BUSTINZA | B9: ARQUITECTURA | C9: ANALISIS NUMERICO
A10: DENNIS IVÁN CANDIA OVIEDO | B10: ARQUITECTURA / ING. ELECTRICA / ING. ELECTRONICA | C10: ANALISIS Y DISEÑO DE ALGORITMOS
A11: DORIS SABINA AGUIRRE CARBAJAL | B11: ARQUITECTURA / INGENIERIA CIVIL | C11: ANALISIS Y DISEÑO DE SISTEMAS DE INFORMACION
A12: EDWIN ÁLVAREZ MAMANI | B12: BIOLOGIA | C12: APRENDIZAJE AUTOMATICO
A13: EDWIN CARRASCO POBLETE | B13: BIOLOGIA / FISICA / QUIMICA | C13: BIOINFORMATICA
A14: EFRAINA GLADYS CUTIPA ARAPA | B14: CIENCIAS ADMINISTRATIVAS | C14: COMPILADORES
A15: ÉLIDA FALCÓN HUALLPA | B15: CIENCIAS ADMINISTRATIVAS / ECONOMIA | C15: COMPUTACION GRAFICA I
A16: EMILIO PALOMINO OLIVERA | B16: CIENCIAS DE LA COMUNICACION | C16: COMPUTACION GRAFICA II
A17: ENRIQUE GAMARRA SALDIVAR | B17: CONTABILIDAD | C17: CONSTRUCCION DE COMPILADORES
A18: ESTHER CRISTINA PACHECO VÁSQUEZ | B18: CONTABILIDAD / TURISMO | C18: DANZA MODERNA
A19: GABRIELA ZÚÑIGA ROJAS | B19: CS. DE LA COMUNICACION / EDUCACION | C19: DEEP LEARNING
A20: GERAR FRANCIS QUISPE TORRES | B20: DERECHO | C20: DESARROLLO DE SOFTWARE I
A21: GERMAIN GARCIA ZANABRIA | B21: DERECHO / EDUCACION | C21: DESARROLLO DE SOFTWARE II
A22: GUZMÁN TICONA PARI | B22: ECONOMIA | C22: EMPRENDIMIENTO E INNOVACION
A23: HARLEY VERA OLIVERA | B23: EDUCACION | C23: FORMULACION DE PROYECTOS DE TECNOLOGIAS DE LA INFORMACION
A24: HÉCTOR EDUARDO UGARTE ROJAS | B24: EDUCACION / INGENIERIA FORESTAL | C24: FUNDAMENTOS DE LA PROGRAMACION
A25: HENRY SAMUEL DUEÑAS DE LA CRUZ | B25: ENFERMERIA | C25: FUNDAMENTOS Y DISEÑO DE BASE DE DATOS
A26: IVÁN CESAR MEDRANO VALENCIA | B26: FARMACIA Y BIOQUIMICA / ODONTOLOGIA | C26: INGENIERIA DE SOFTWARE
A27: JAVIER ARTURO ROZAS HUACHO | B27: FILOSOFIA / PSICOLOGIA | C27: INGENIERIA DE SOFTWARE I
A28: JAVIER DAVID CHÁVEZ CENTENO | B28: FISICA | C28: INGENIERIA DE SOFTWARE II
A29: JISBAJ GAMARRAS SALAS | B29: FISICA / MATEMATICA / QUIMICA | C29: INGENIERIA ECONOMICA
A30: JOSÉ LUIS SONCCO ÁLVAREZ | B30: FISICA / QUIMICA | C30: INTELIGENCIA ARTIFICIAL
A31: JOSÉ MAURO PILLCO QUISPE | B31: HISTORIA | C31: LENGUAJE DE PROGRAMACION
A32: JULIO CESAR CARBAJAL LUNA | B32: ING. AGROINDUSTRIAL (SIC) / ING. AGROPECUARIA (ANS - STO TOMAS) | C32: LENGUAJE ENSAMBLADOR
A33: JULIO VLADIMIR QUISPE SOTA | B33: ING. AGROINDUSTRIAL / ING. PETROQUIMICA / ING. QUIMICA | C33: METODOLOGIA DE DESARROLLO DE SOFTWARE
A34: KARELIA MEDINA MIRANDA | B34: ING. CIVIL / ING. PETROQUIMICA | C34: METODOS NUMERICOS
A35: LAURO ENCISO RODAS | B35: INGENIERIA CIVIL | C35: MINERIA DE DATOS
A36: LINO AQUILES BACA CARDENAS | B36: INGENIERIA DE MINAS | C36: MODELADO Y SIMULACION
A37: LINO PRISCILIANO FLORES PACHECO | B37: INGENIERIA DE MINAS / ZOOTECNIA | C37: MODELOS PROBABILISTICOS
A38: LISETH URPY SEGUNDO CARPIO | B38: INGENIERIA ELECTRICA | C38: MUSICA
A39: LISHA SABAH DIAZ CACERES | B39: INGENIERIA ELECTRONICA | C39: ORGANIZACION Y ARQUITECTURA DEL COMPUTADOR
A40: LUIS ALVARO MONZÓN CONDORI | B40: INGENIERIA GEOLOGICA | C40: PLANEAMIENTO ESTRATEGICO
A41: LUIS BELTRÁN PALMA TTITO | B41: INGENIERIA GEOLOGICA / ZOOTECNIA | C41: PLANEAMIENTO Y DIRECCION ESTRATEGICA DE TECNOLOGIAS DE LA INFORMACION
A42: MANUEL AURELIO PEÑALOZA FIGUEROA | B42: INGENIERIA INFORMATICA | C42: PROCESAMIENTO DE LENGUAJE NATURAL
A43: MARCIO FERNANDO MERMA QUISPE | B43: INGENIERIA MECANICA | C43: PROGRAMACION CIENTIFICA
A44: MARÍA DEL PILAR VENEGAS VERGARA | B44: INGENIERIA METALURGICA | C44: PROGRAMACION DIGITAL
A45: MARITZA IRPANOCA CUSIMAYTA | B45: INGENIERIA METALURGICA / INGENIERIA PETROQUIMICA | C45: PROGRAMACION DIGITAL I
A46: NILA ZONIA ACURIO USCA | B46: INGENIERIA QUIMICA | C46: PROGRAMACION DIGITAL II
A47: OLMER CLAUDIO VILLENA LEON | B47: MATEMATICA | C47: PROGRAMACION I
A48: RAIMAR ABARCA MORA | B48: MATEMATICA / QUIMICA | C48: PROGRAMACION II
A49: RAUL HUILLCA HUALLPARIMACHI | B49: MEDICINA HUMANA | C49: QUECHUA
A50: RAY DUEÑAS JIMENEZ | B50: MEDICINA HUMANA / ODONTOLOGIA | C50: REDES DE COMPUTADORAS I
A51: ROBERT WILBERT ALZAMORA PAREDES | B51: TURISMO | C51: REDES DE COMPUTADORAS II
A52: ROGER MARIO CUSIHUAMAN PHOCCO | B52: ZOOTECNIA | C52: REDES NEURONALES ARTIFICIALES
A53: RONY VILLAFUERTE SERNA | C53: REDES Y TELEPROCESO II
A54: ROXANA LISETTE QUINTANILLA PORTUGAL | C54: ROBOTICA
A55: TANY VILLALBA VILLALBA | C55: ROBOTICA Y PROCESAMIENTO DE SEÑAL
A56: VANESA LAVILLA ALVAREZ | C56: SEGURIDAD CONTROL Y AUDITORIA DE SISTEMAS
A57: VANESSA MARIBEL CHOQUE SOTO | C57: SEMINARIO
A58: VÍCTOR DARIO SOSA JAUREGUI | C58: SEMINARIO DE INVESTIGACION I
A59: VITTALI QUISPE SURCO | C59: SEMINARIO DE INVESTIGACION II
A60: WALDO ELIO IBARRA ZAMBRANO | C60: SISTEMA DE BASE DE DATOS
A61: WILLIAM ALBERTO CHÁVEZ ESPINOZA | C61: SISTEMAS EMBEBIDOS
A62: WILLIAN ZAMALLOA PARO | C62: SISTEMAS EXPERTOS
A63: WUILLIAN ALAGÓN MARTÍNEZ | C63: SISTEMAS OPERATIVOS
A64: YESHICA ISELA ORMEÑO AYALA | C64: TALLER DE DEBATE
C65: TECNOLOGIAS DE LA INFORMACION Y COMUNICACION
C66: TEORIA DE LA COMPUTACION
C67: TOPICOS AVANZADOS EN INGENIERIA DE SOFTWARE
C68: VISION COMPUTACIONAL

Sheet: Revision Portafolio 2022-II
A1: Calificación( No cumplió:0, Incompleto: 1 , Completo:2) | G1: REVISIÓN DE PORTAFOLIO
A3: NRO | B3: DOCENTE | C3: CÓDIGO | E3: CRED. | F3: TIPO | G3: 1. PRESENTACIÓN DE PORTAFOLIO | K3: 2. CONTENIDO POR ASIGNATURA | P3: 3. ACTIV. DE ENSEÑANZA | Q3: 4. EVALUACIONES | AJ3: 5. PROYECTOS INDIVIDUALES / GRUPALES | AO3: 6. CIERRE DE PORTAFOLIO | AP3: 7. ANEXOS | AT3: CALIFICACIÓN | AW3: CALIFICACIÓN EN PORCENTAJES
Q4: EVALUACION DE ENTRADA | S4: 4.3 ENUNCIADO Y RESOLUCIÓN DE EVALUACIÓN DE CONOCIMIENTO | W4: 4.4 REG. DE ASISTENCIA A LA RESOLUCIÓN DEL EXAMEN (F-PD-006) | Z4: 4.5 INF. MIN, MAX, PROM DE EVALUAC. DE CONOCIMIENTO (F-PD-013) | AC4: 4.6 REGISTRO DE INGRESO DE NOTAS (F-CC) | AG4: 4.7 REG. NOTAS DE PRÁCTICA (F-PD-015)
G5: 1.1 CARATULA (F-02) | H5: 1.2 CARGA ACADÉMICA (F-PD-001) | I5: 1.3 FILOSOFÍA DEL DOCENTE (F-03) | J5: 1.4 CURRÍCULO VITAE (F-04) | K5: 2.1 SILABO (F-CC) | L5: 2.3 RELACIÓN DE ESTUDIANTES (F-CC) | M5: 2.4 AVANCE ACADÉMICO (F-PD-012) | N5: 2.5 REG. ENTREGA DE SILABO (F-PD-002) | O5: 2.6 REG. DE ASISTENCIA (F-CC) | P5: 3.1 EVIDENCIA DE ACT. DE ENSEÑANZA (F-PD-014) | Q5: 4.1 ENUN. Y RESOL. DE EVALUACIÓN DE ENTRADA | R5: 4.2 INF. DE EVALUACIÓN DE ENTRADA (F-10) | S5: PRIMERA EVALUACIÓN | T5: SEGUNDA EVALUACIÓN | U5: TERCERA EVALUACIÓN | V5: SUSTITUTORIO | W5: PRIMERA EVALUACIÓN | X5: SEGUNDA EVALUACIÓN | Y5: TERCERA EVALUACIÓN | Z5: PRIMERA EVALUACIÓN | AA5: SEGUNDA EVALUACIÓN | AB5: TERCERA EVALUACIÓN | AC5: PRIMERA EVALUACIÓN | AD5: SEGUNDA EVALUACIÓN | AE5: TERCERA EVALUACIÓN | AF5: SUSTITUTORIO | AG5: PRIMERA EVALUACIÓN | AH5: SEGUNDA EVALUACIÓN | AI5: TERCERA EVALUACIÓN | AJ5: 5.1 RÚBRICA PARA LA CALIFICA. DEL PROY. INDIVIDUAL Y GRUPAL (F-PD-007) | AK5: 5.2 DOC. DE ASIGNACION DE PROY. INDIVIDUALES Y GRUPALES (F-PD-010) | AL5: 5.3 INFORME SOBRE AVANCES DE PROYECTOS (F-PD-011) | AM5: 5.4 INF. ENTREGA FINAL DE PROY, EVAL. Y RESULT. DE CALIFICA. | AN5: 5.5 OTRAS EVALUACIONES -SI CORESPONDE (F-PD-007) | AP5: 1 | AQ5: 2 | AR5: 3 | AS5: 8 | AT5: NO CUMPLIO (0) | AU5: CUMPLIO A MEDIAS (1) | AV5: CUMPLIO EN LA TOTALIDAD (2) | AW5: NO CUMPLIO (0) | AX5: CUMPLIO A MEDIAS (1) | AY5: CUMPLIO EN LA TOTALIDAD (2)
A6: 1 | B6: LAURO ENCISO RODAS | C6: IF650AIN | D6: MODELOS PROBABILISTICOS | E6: 4 | G6: 2 | H6: 2 | I6: 2 | J6: 2 | K6: 2 | L6: 2 | M6: 2 | N6: 2 | O6: 2 | Q6: 2 | S6: 2 | T6: 2 | U6: 2 | W6: 2 | X6: 2 | AC6: 2 | AD6: 2 | AE6: 2 | AO6: 2 | AV6: =IF(COUNTIF(RC7:RC45;2)=0;" ";COUNTIF(RC7:RC45;2)) -> 19 | AW6: =IF(RC[-3]=" ";0%;RC[-3]/COUNTIF(RC7:RC45;">=0")) -> 0 | AX6: =IF(RC[-3]=" ";0%;RC[-3]/COUNTIF(RC7:RC45;">=0")) -> 0 | AY6: =IF(RC[-3]=" ";0%;RC[-3]/COUNTIF(RC7:RC45;">=0")) -> 1 | AZ6: =IF(RC[-1]>60%;"Completo";IF(RC[-3]>RC[-2]+RC[-1];"No Cumplio";"Incompleto")) -> Completo | BA6: =IF(RC[-1]=R[1]C[-1];RC[-1];"Incompleto") -> Completo
C7: IF456BIN | D7: ALGORITMOS AVANZADOS | E7: 4 | F7: T / P | G7: 2 | H7: 2 | I7: 2 | J7: 2 | K7: 2 | L7: 2 | M7: 2 | N7: 2 | O7: 2 | S7: 2 | T7: 2 | U7: 2 | W7: 2 | X7: 2 | Y7: 2 | AC7: 2 | AD7: 2 | AO7: 2 | AV7: =IF(COUNTIF(RC7:RC45;2)=0;" ";COUNTIF(RC7:RC45;2)) -> 18 | AW7: =IF(RC[-3]=" ";0%;RC[-3]/COUNTIF(RC7:RC45;">=0")) -> 0 | AX7: =IF(RC[-3]=" ";0%;RC[-3]/COUNTIF(RC7:RC45;">=0")) -> 0 | AY7: =IF(RC[-3]=" ";0%;RC[-3]/COUNTIF(RC7:RC45;">=0")) -> 1 | AZ7: =IF(RC[-1]>60%;"Completo";IF(RC[-3]>RC[-2]+RC[-1];"No Cumplio";"Incompleto")) -> Completo
A8: 2 | B8: JULIO CESAR CARBAJAL LUNA | C8: IF653AIN | D8: MINERIA DE DATOS | E8: 4 | F8: T / P | G8: 2 | H8: 2 | I8: 2 | J8: 2 | K8: 2 | L8: 2 | M8: 2 | N8: 2 | O8: 2 | Q8: 2 | S8: 2 | T8: 0 | U8: 0 | W8: 2 | X8: 0 | Y8: 0 | AC8: 0 | AD8: 0 | AE8: 0 | AO8: 0 | AV8: =IF(COUNTIF(RC7:RC45;2)=0;" ";COUNTIF(RC7:RC45;2)) -> 12 | AW8: =IF(RC[-3]=" ";0%;RC[-3]/COUNTIF(RC7:RC45;">=0")) -> 0 | AX8: =IF(RC[-3]=" ";0%;RC[-3]/COUNTIF(RC7:RC45;">=0")) -> 0 | AY8: =IF(RC[-3]=" ";0%;RC[-3]/COUNTIF(RC7:RC45;">=0")) -> 0.6 | AZ8: =IF(RC[-1]>60%;"Completo";IF(RC[-3]>RC[-2]+RC[-1];"No Cumplio";"Incompleto")) -> Incompleto | BA8: =IF(RC[-1]=R[1]C[-1];RC[-1];"Incompleto") -> Incompleto
C9: IF664AIN | D9: BIOINFORMATICA | E9: 4 | F9: T / P | G9: 2 | H9: 2 | I9: 2 | J9: 2 | K9: 2 | L9: 2 | M9: 2 | N9: 2 | O9: 2 | Q9: 2 | S9: 2 | T9: 0 | U9: 0 | W9: 2 | X9: 0 | Y9: 0 | AC9: 0 | AD9: 0 | AE9: 0 | AO9: 0 | AV9: =IF(COUNTIF(RC7:RC45;2)=0;" ";COUNTIF(RC7:RC45;2)) -> 12 | AW9: =IF(RC[-3]=" ";0%;RC[-3]/COUNTIF(RC7:RC45;">=0")) -> 0 | AX9: =IF(RC[-3]=" ";0%;RC[-3]/COUNTIF(RC7:RC45;">=0")) -> 0 | AY9: =IF(RC[-3]=" ";0%;RC[-3]/COUNTIF(RC7:RC45;">=0")) -> 0.6 | AZ9: =IF(RC[-1]>60%;"Completo";IF(RC[-3]>RC[-2]+RC[-1];"No Cumplio";"Incompleto")) -> Incompleto
A10: 3 | B10: NILA ZONIA ACURIO USCA | C10: IF450BIN | D10: ABSTRACCION DE DATOS Y OBJETOS | E10: 4 | F10: T / P | G10: 2 | H10: 2 | I10: 2 | J10: 2 | K10: 2 | L10: 2 | M10: 2 | N10: 2 | O10: 1 | P10: 2 | Q10: 2 | R10: 2 | S10: 2 | T10: 2 | U10: 2 | W10: 2 | X10: 2 | Y10: 2 | AC10: 2 | AD10: 2 | AE10: 2 | AO10: 2 | AV10: =IF(COUNTIF(RC7:RC45;2)=0;" ";COUNTIF(RC7:RC45;2)) -> 21 | AW10: =IF(RC[-3]=" ";0%;RC[-3]/COUNTIF(RC7:RC45;">=0")) -> 0 | AX10: =IF(RC[-3]=" ";0%;RC[-3]/COUNTIF(RC7:RC45;">=0")) -> 0 | AY10: =IF(RC[-3]=" ";0%;RC[-3]/COUNTIF(RC7:RC45;">=0")) -> 0.954545454545455 | AZ10: =IF(RC[-1]>60%;"Completo";IF(RC[-3]>RC[-2]+RC[-1];"No Cumplio";"Incompleto")) -> Completo | BA10: =IF(RC[-1]=R[1]C[-1];RC[-1];"Incompleto") -> Completo
C11: IF468AIN | D11: FUNDAMENTOS DE LA PROGRAMACION | E11: 4 | F11: T / P | G11: 2 | H11: 2 | I11: 2 | J11: 2 | K11: 2 | L11: 2 | M11: 2 | N11: 2 | O11: 1 | P11: 2 | Q11: 2 | R11: 2 | S11: 2 | T11: 2 | U11: 2 | W11: 2 | X11: 2 | Y11: 2 | AC11: 2 | AD11: 2 | AE11: 2 | AO11: 2 | AV11: =IF(COUNTIF(RC7:RC45;2)=0;" ";COUNTIF(RC7:RC45;2)) -> 21 | AW11: =IF(RC[-3]=" ";0%;RC[-3]/COUNTIF(RC7:RC45;">=0")) -> 0 | AX11: =IF(RC[-3]=" ";0%;RC[-3]/COUNTIF(RC7:RC45;">=0")) -> 0 | AY11: =IF(RC[-3]=" ";0%;RC[-3]/COUNTIF(RC7:RC45;">=0")) -> 0.954545454545455 | AZ11: =IF(RC[-1]>60%;"Completo";IF(RC[-3]>RC[-2]+RC[-1];"No Cumplio";"Incompleto")) -> Completo
A12: 4 | B12: JAVIER ARTURO ROZAS HUACHO | C12: IF450AIN | D12: ABSTRACCION DE DATOS Y OBJETOS | E12: 4 | F12: T / P | G12: 2 | H12: 2 | I12: 2 | J12: 2 | K12: 2 | L12: 2 | M12: 2 | N12: 2 | O12: 1 | P12: 2 | Q12: 2 | S12: 2 | T12: 2 | U12: 2 | W12: 2 | X12: 2 | Y12: 2 | Z12: 2 | AA12: 2 | AB12: 2 | AC12: 2 | AD12: 2 | AE12: 2 | AO12: 0 | AV12: =IF(COUNTIF(RC7:RC45;2)=0;" ";COUNTIF(RC7:RC45;2)) -> 22 | AW12: =IF(RC[-3]=" ";0%;RC[-3]/COUNTIF(RC7:RC45;">=0")) -> 0 | AX12: =IF(RC[-3]=" ";0%;RC[-3]/COUNTIF(RC7:RC45;">=0")) -> 0 | AY12: =IF(RC[-3]=" ";0%;RC[-3]/COUNTIF(RC7:RC45;">=0")) -> 0.916666666666667 | AZ12: =IF(RC[-1]>60%;"Completo";IF(RC[-3]>RC[-2]+RC[-1];"No Cumplio";"Incompleto")) -> Completo | BA12: =IF(RC[-1]=R[1]C[-1];RC[-1];"Incompleto") -> Completo
C13: IF651AIN | D13: INTELIGENCIA ARTIFICIAL | E13: 4 | F13: T / P | G13: 2 | H13: 2 | I13: 2 | J13: 2 | K13: 2 | L13: 2 | M13: 2 | N13: 2 | O13: 1 | P13: 2 | Q13: 2 | R13: 2 | S13: 2 | T13: 2 | U13: 2 | W13: 2 | X13: 2 | Y13: 2 | Z13: 2 | AA13: 2 | AB13: 2 | AC13: 2 | AD13: 2 | AE13: 2 | AO13: 0 | AV13: =IF(COUNTIF(RC7:RC45;2)=0;" ";COUNTIF(RC7:RC45;2)) -> 23 | AW13: =IF(RC[-3]=" ";0%;RC[-3]/COUNTIF(RC7:RC45;">=0")) -> 0 | AX13: =IF(RC[-3]=" ";0%;RC[-3]/COUNTIF(RC7:RC45;">=0")) -> 0 | AY13: =IF(RC[-3]=" ";0%;RC[-3]/COUNTIF(RC7:RC45;">=0")) -> 0.92 | AZ13: =IF(RC[-1]>60%;"Completo";IF(RC[-3]>RC[-2]+RC[-1];"No Cumplio";"Incompleto")) -> Completo
A14: 5 | B14: LINO PRISCILIANO FLORES PACHECO | C14: IF652AIN | D14: APRENDIZAJE AUTOMATICO | E14: 4 | F14: T / P | G14: 2 | H14: 2 | I14: 2 | J14: 2 | K14: 2 | L14: 2 | M14: 2 | N14: 2 | O14: 1 | P14: 2 | Q14: 2 | R14: 1 | S14: 2 | T14: 2 | U14: 2 | W14: 2 | X14: 2 | Y14: 2 | Z14: 2 | AA14: 2 | AB14: 2 | AJ14: 2 | AM14: 2 | AO14: 2 | AV14: =IF(COUNTIF(RC7:RC45;2)=0;" ";COUNTIF(RC7:RC45;2)) -> 22 | AW14: =IF(RC[-3]=" ";0%;RC[-3]/COUNTIF(RC7:RC45;">=0")) -> 0 | AX14: =IF(RC[-3]=" ";0%;RC[-3]/COUNTIF(RC7:RC45;">=0")) -> 0 | AY14: =IF(RC[-3]=" ";0%;RC[-3]/COUNTIF(RC7:RC45;">=0")) -> 0.916666666666667 | AZ14: =IF(RC[-1]>60%;"Completo";IF(RC[-3]>RC[-2]+RC[-1];"No Cumplio";"Incompleto")) -> Completo | BA14: =IF(RC[-1]=R[1]C[-1];RC[-1];"Incompleto") -> Completo
C15: IF652BIN | D15: APRENDIZAJE AUTOMATICO | E15: 4 | F15: T / P | G15: 2 | H15: 2 | I15: 2 | J15: 2 | K15: 2 | L15: 2 | M15: 2 | N15: 2 | O15: 1 | P15: 2 | Q15: 2 | R15: 1 | S15: 2 | T15: 2 | U15: 2 | W15: 2 | X15: 2 | Y15: 2 | Z15: 2 | AA15: 2 | AB15: 2 | AJ15: 2 | AM15: 2 | AO15: 2 | AV15: =IF(COUNTIF(RC7:RC45;2)=0;" ";COUNTIF(RC7:RC45;2)) -> 22 | AW15: =IF(RC[-3]=" ";0%;RC[-3]/COUNTIF(RC7:RC45;">=0")) -> 0 | AX15: =IF(RC[-3]=" ";0%;RC[-3]/COUNTIF(RC7:RC45;">=0")) -> 0 | AY15: =IF(RC[-3]=" ";0%;RC[-3]/COUNTIF(RC7:RC45;">=0")) -> 0.916666666666667 | AZ15: =IF(RC[-1]>60%;"Completo";IF(RC[-3]>RC[-2]+RC[-1];"No Cumplio";"Incompleto")) -> Completo
A16: 6 | B16: EDWIN CARRASCO POBLETE | C16: IF550AIN | D16: ORGANIZACION Y ARQUITECTURA DEL COMPUTADOR | E16: 4 | F16: T / P | G16: 2 | H16: 2 | I16: 2 | J16: 2 | K16: 2 | L16: 2 | M16: 1 | N16: 2 | O16: 2 | P16: 2 | Q16: 2 | S16: 2 | T16: 2 | U16: 2 | W16: 2 | X16: 2 | Y16: 2 | AC16: 2 | AD16: 2 | AE16: 2 | AP16: 2 | AQ16: 2 | AR16: 2 | AS16: 2 | AV16: =IF(COUNTIF(RC7:RC45;2)=0;" ";COUNTIF(RC7:RC45;2)) -> 23 | AW16: =IF(RC[-3]=" ";0%;RC[-3]/COUNTIF(RC7:RC45;">=0")) -> 0 | AX16: =IF(RC[-3]=" ";0%;RC[-3]/COUNTIF(RC7:RC45;">=0")) -> 0 | AY16: =IF(RC[-3]=" ";0%;RC[-3]/COUNTIF(RC7:RC45;">=0")) -> 0.958333333333333 | AZ16: =IF(RC[-1]>60%;"Completo";IF(RC[-3]>RC[-2]+RC[-1];"No Cumplio";"Incompleto")) -> Completo | BA16: =IF(RC[-1]=R[1]C[-1];RC[-1];"Incompleto") -> Completo
C17: IF551AIN | D17: SISTEMAS OPERATIVOS | E17: 4 | F17: T / P | G17: 2 | H17: 2 | I17: 2 | J17: 2 | K17: 2 | L17: 2 | M17: 1 | N17: 2 | O17: 2 | P17: 2 | Q17: 2 | S17: 2 | T17: 2 | U17: 2 | W17: 2 | X17: 2 | Y17: 2 | AC17: 2 | AD17: 2 | AE17: 2 | AP17: 2 | AQ17: 2 | AR17: 2 | AS17: 2 | AV17: =IF(COUNTIF(RC7:RC45;2)=0;" ";COUNTIF(RC7:RC45;2)) -> 23 | AW17: =IF(RC[-3]=" ";0%;RC[-3]/COUNTIF(RC7:RC45;">=0")) -> 0 | AX17: =IF(RC[-3]=" ";0%;RC[-3]/COUNTIF(RC7:RC45;">=0")) -> 0 | AY17: =IF(RC[-3]=" ";0%;RC[-3]/COUNTIF(RC7:RC45;">=0")) -> 0.958333333333333 | AZ17: =IF(RC[-1]>60%;"Completo";IF(RC[-3]>RC[-2]+RC[-1];"No Cumplio";"Incompleto")) -> Completo
A18: 7 | B18: EMILIO PALOMINO OLIVERA | C18: IF483AIN | D18: FORMULACION DE PROYECTOS DE TECNOLOGIAS DE LA INFORMACION | E18: 3 | F18: T / P | G18: 2 | H18: 2 | I18: 2 | J18: 2 | K18: 2 | L18: 2 | M18: 0 | N18: 2 | O18: 0 | P18: 2 | Q18: 0 | R18: 0 | S18: 2 | T18: 2 | V18: 0 | W18: 0 | X18: 0 | Z18: 2 | AA18: 2 | AC18: 2 | AD18: 2 | AF18: 2 | AO18: 2 | AT18: =IF(COUNTIF(RC7:RC45;2)=0;" ";COUNTIF(RC7:RC45;0)) -> 7 | AU18: =IF(COUNTIF(RC7:RC45;2)=0;" ";COUNTIF(RC7:RC45;1)) -> 0 | AV18: =IF(COUNTIF(RC7:RC45;2)=0;" ";COUNTIF(RC7:RC45;2)) -> 16 | AW18: =IF(RC[-3]=" ";0%;RC[-3]/COUNTIF(RC7:RC45;">=0")) -> 0.304347826086957 | AX18: =IF(RC[-3]=" ";0%;RC[-3]/COUNTIF(RC7:RC45;">=0")) -> 0 | AY18: =IF(RC[-3]=" ";0%;RC[-3]/COUNTIF(RC7:RC45;">=0")) -> 0.695652173913043 | AZ18: =IF(RC[-1]>60%;"Completo";IF(RC[-3]>RC[-2]+RC[-1];"No Cumplio";"Incompleto")) -> Completo | BA18: =IF(AND(RC[-1]=R[1]C[-1];RC[-1]=R[2]C[-1]);RC[-1];"Incompleto") -> Completo
C19: IF553AIN | D19: LENGUAJE ENSAMBLADOR | E19: 3 | F19: T / P | G19: 2 | H19: 2 | I19: 2 | J19: 2 | K19: 2 | L19: 2 | M19: 0 | N19: 2 | O19: 0 | P19: 2 | Q19: 0 | R19: 0 | S19: 2 | T19: 2 | V19: 0 | W19: 0 | X19: 0 | Z19: 2 | AA19: 2 | AC19: 2 | AD19: 2 | AF19: 2 | AO19: 2 | AT19: =IF(COUNTIF(RC7:RC45;2)=0;" ";COUNTIF(RC7:RC45;0)) -> 7 | AU19: =IF(COUNTIF(RC7:RC45;2)=0;" ";COUNTIF(RC7:RC45;1)) -> 0 | AV19: =IF(COUNTIF(RC7:RC45;2)=0;" ";COUNTIF(RC7:RC45;2)) -> 16 | AW19: =IF(RC[-3]=" ";0%;RC[-3]/COUNTIF(RC7:RC45;">=0")) -> 0.304347826086957 | AX19: =IF(RC[-3]=" ";0%;RC[-3]/COUNTIF(RC7:RC45;">=0")) -> 0 | AY19: =IF(RC[-3]=" ";0%;RC[-3]/COUNTIF(RC7:RC45;">=0")) -> 0.695652173913043 | AZ19: =IF(RC[-1]>60%;"Completo";IF(RC[-3]>RC[-2]+RC[-1];"No Cumplio";"Incompleto")) -> Completo
C20: IF902ATU | D20: TECNOLOGIAS DE LA INFORMACION Y LA COMUNICACION | E20: 3 | F20: T | G20: 2 | H20: 2 | I20: 2 | J20: 2 | K20: 2 | L20: 2 | M20: 0 | N20: 2 | O20: 0 | P20: 2 | Q20: 0 | R20: 0 | S20: 2 | T20: 2 | V20: 0 | W20: 0 | X20: 0 | Z20: 2 | AA20: 2 | AC20: 2 | AD20: 2 | AF20: 2 | AO20: 2 | AT20: =IF(COUNTIF(RC7:RC45;2)=0;" ";COUNTIF(RC7:RC45;0)) -> 7 | AU20: =IF(COUNTIF(RC7:RC45;2)=0;" ";COUNTIF(RC7:RC45;1)) -> 0 | AV20: =IF(COUNTIF(RC7:RC45;2)=0;" ";COUNTIF(RC7:RC45;2)) -> 16 | AW20: =IF(RC[-3]=" ";0%;RC[-3]/COUNTIF(RC7:RC45;">=0")) -> 0.304347826086957 | AX20: =IF(RC[-3]=" ";0%;RC[-3]/COUNTIF(RC7:RC45;">=0")) -> 0 | AY20: =IF(RC[-3]=" ";0%;RC[-3]/COUNTIF(RC7:RC45;">=0")) -> 0.695652173913043 | AZ20: =IF(RC[-1]>60%;"Completo";IF(RC[-3]>RC[-2]+RC[-1];"No Cumplio";"Incompleto")) -> Completo
A21: 8 | B21: ENRIQUE GAMARRA SALDIVAR | C21: IF401BMI | E21: 2 | F21: T | G21: 2 | H21: 2 | I21: 2 | J21: 2 | K21: 2 | L21: 2 | M21: 2 | N21: 2 | O21: 2 | P21: 2 | Q21: 2 | R21: 2 | S21: 1 | T21: 1 | V21: 0 | W21: 0 | X21: 0 | Z21: 0 | AA21: 0 | AC21: 2 | AD21: 2 | AF21: 0 | AO21: 2 | AT21: =IF(COUNTIF(RC7:RC45;2)=0;" ";COUNTIF(RC7:RC45;0)) -> 6 | AU21: =IF(COUNTIF(RC7:RC45;2)=0;" ";COUNTIF(RC7:RC45;1)) -> 2 | AV21: =IF(COUNTIF(RC7:RC45;2)=0;" ";COUNTIF(RC7:RC45;2)) -> 15 | AW21: =IF(RC[-3]=" ";0%;RC[-3]/COUNTIF(RC7:RC45;">=0")) -> 0.260869565217391 | AX21: =IF(RC[-3]=" ";0%;RC[-3]/COUNTIF(RC7:RC45;">=0")) -> 0.0869565217391304 | AY21: =IF(RC[-3]=" ";0%;RC[-3]/COUNTIF(RC7:RC45;">=0")) -> 0.652173913043478 | AZ21: =IF(RC[-1]>60%;"Completo";IF(RC[-3]>RC[-2]+RC[-1];"No Cumplio";"Incompleto")) -> Completo | BA21: =IF(AND(RC[-1]=R[1]C[-1];RC[-1]=R[2]C[-1]);RC[-1];"Incompleto") -> Completo
C22: IF457AIN | D22: METODOS NUMERICOS | E22: 3 | F22: T | G22: 2 | H22: 2 | I22: 2 | J22: 2 | K22: 2 | L22: 2 | M22: 2 | N22: 2 | O22: 2 | P22: 2 | Q22: 2 | R22: 2 | S22: 2 | T22: 1 | V22: 0 | W22: 0 | X22: 0 | Z22: 0 | AA22: 0 | AC22: 0 | AD22: 0 | AF22: 0 | AO22: 2 | AT22: =IF(COUNTIF(RC7:RC45;2)=0;" ";COUNTIF(RC7:RC45;0)) -> 8 | AU22: =IF(COUNTIF(RC7:RC45;2)=0;" ";COUNTIF(RC7:RC45;1)) -> 1 | AV22: =IF(COUNTIF(RC7:RC45;2)=0;" ";COUNTIF(RC7:RC45;2)) -> 14 | AW22: =IF(RC[-3]=" ";0%;RC[-3]/COUNTIF(RC7:RC45;">=0")) -> 0.347826086956522 | AX22: =IF(RC[-3]=" ";0%;RC[-3]/COUNTIF(RC7:RC45;">=0")) -> 0.0434782608695652 | AY22: =IF(RC[-3]=" ";0%;RC[-3]/COUNTIF(RC7:RC45;">=0")) -> 0.608695652173913 | AZ22: =IF(RC[-1]>60%;"Completo";IF(RC[-3]>RC[-2]+RC[-1];"No Cumplio";"Incompleto")) -> Completo
C23: IF758BCI | D23: METODOS NUMERICOS | E23: 3 | F23: T / P | G23: 2 | H23: 2 | I23: 2 | J23: 2 | K23: 2 | L23: 2 | M23: 2 | N23: 2 | O23: 2 | P23: 2 | Q23: 2 | R23: 2 | S23: 2 | T23: 1 | V23: 0 | W23: 0 | X23: 0 | Z23: 0 | AA23: 0 | AC23: 0 | AD23: 0 | AF23: 0 | AO23: 2 | AT23: =IF(COUNTIF(RC7:RC45;2)=0;" ";COUNTIF(RC7:RC45;0)) -> 8 | AU23: =IF(COUNTIF(RC7:RC45;2)=0;" ";COUNTIF(RC7:RC45;1)) -> 1 | AV23: =IF(COUNTIF(RC7:RC45;2)=0;" ";COUNTIF(RC7:RC45;2)) -> 14 | AW23: =IF(RC[-3]=" ";0%;RC[-3]/COUNTIF(RC7:RC45;">=0")) -> 0.347826086956522 | AX23: =IF(RC[-3]=" ";0%;RC[-3]/COUNTIF(RC7:RC45;">=0")) -> 0.0434782608695652 | AY23: =IF(RC[-3]=" ";0%;RC[-3]/COUNTIF(RC7:RC45;">=0")) -> 0.608695652173913 | AZ23: =IF(RC[-1]>60%;"Completo";IF(RC[-3]>RC[-2]+RC[-1];"No Cumplio";"Incompleto")) -> Completo
A24: 9 | B24: DENNIS IVÁN CANDIA OVIEDO | C24: IF391AMI | D24: SISTEMA DE BASE DE DATOS | E24: 2 | F24: P | G24: 2 | H24: 2 | I24: 2 | J24: 2 | K24: 2 | L24: 2 | M24: 2 | N24: 0 | O24: 2 | P24: 2 | Q24: 0 | R24: 0 | S24: 2 | T24: 2 | V24: 0 | W24: 2 | X24: 2 | Z24: 2 | AA24: 2 | AC24: 2 | AD24: 2 | AF24: 2 | AO24: 0 | AT24: =IF(COUNTIF(RC7:RC45;2)=0;" ";COUNTIF(RC7:RC45;0)) -> 5 | AU24: =IF(COUNTIF(RC7:RC45;2)=0;" ";COUNTIF(RC7:RC45;1)) -> 0 | AV24: =IF(COUNTIF(RC7:RC45;2)=0;" ";COUNTIF(RC7:RC45;2)) -> 18 | AW24: =IF(RC[-3]=" ";0%;RC[-3]/COUNTIF(RC7:RC45;">=0")) -> 0.217391304347826 | AX24: =IF(RC[-3]=" ";0%;RC[-3]/COUNTIF(RC7:RC45;">=0")) -> 0 | AY24: =IF(RC[-3]=" ";0%;RC[-3]/COUNTIF(RC7:RC45;">=0")) -> 0.782608695652174 | AZ24: =IF(RC[-1]>60%;"Completo";IF(RC[-3]>RC[-2]+RC[-1];"No Cumplio";"Incompleto")) -> Completo | BA24: =IF(AND(RC[-1]=R[1]C[-1];RC[-1]=R[2]C[-1]);RC[-1];"Incompleto") -> Completo
C25: IF480AIN | D25: ADMINISTRACION DE TECNOLOGÍAS DE LA INFORMACIÓN | E25: 3 | F25: T / P | G25: 2 | H25: 2 | I25: 2 | J25: 2 | K25: 2 | L25: 2 | M25: 2 | N25: 2 | O25: 2 | P25: 2 | Q25: 0 | R25: 0 | S25: 0 | T25: 0 | V25: 0 | W25: 2 | X25: 2 | Z25: 2 | AA25: 2 | AC25: 0 | AD25: 0 | AF25: 0 | AO25: 2 | AT25: =IF(COUNTIF(RC7:RC45;2)=0;" ";COUNTIF(RC7:RC45;0)) -> 8 | AU25: =IF(COUNTIF(RC7:RC45;2)=0;" ";COUNTIF(RC7:RC45;1)) -> 0 | AV25: =IF(COUNTIF(RC7:RC45;2)=0;" ";COUNTIF(RC7:RC45;2)) -> 15 | AW25: =IF(RC[-3]=" ";0%;RC[-3]/COUNTIF(RC7:RC45;">=0")) -> 0.347826086956522 | AX25: =IF(RC[-3]=" ";0%;RC[-3]/COUNTIF(RC7:RC45;">=0")) -> 0 | AY25: =IF(RC[-3]=" ";0%;RC[-3]/COUNTIF(RC7:RC45;">=0")) -> 0.652173913043478 | AZ25: =IF(RC[-1]>60%;"Completo";IF(RC[-3]>RC[-2]+RC[-1];"No Cumplio";"Incompleto")) -> Completo
C26: IF610AIN | D26: ANALISIS Y DISEÑO DE SISTEMAS DE INFORMACION | E26: 3 | F26: T / P | G26: 2 | H26: 2 | I26: 2 | J26: 2 | K26: 2 | L26: 2 | M26: 2 | N26: 2 | O26: 2 | P26: 2 | Q26: 0 | R26: 0 | S26: 0 | T26: 0 | V26: 0 | W26: 2 | X26: 2 | Y26: 2 | Z26: 2 | AA26: 2 | AB26: 2 | AC26: 0 | AD26: 0 | AF26: 0 | AO26: 2 | AT26: =IF(COUNTIF(RC7:RC45;2)=0;" ";COUNTIF(RC7:RC45;0)) -> 8 | AU26: =IF(COUNTIF(RC7:RC45;2)=0;" ";COUNTIF(RC7:RC45;1)) -> 0 | AV26: =IF(COUNTIF(RC7:RC45;2)=0;" ";COUNTIF(RC7:RC45;2)) -> 17 | AW26: =IF(RC[-3]=" ";0%;RC[-3]/COUNTIF(RC7:RC45;">=0")) -> 0.32 | AX26: =IF(RC[-3]=" ";0%;RC[-3]/COUNTIF(RC7:RC45;">=0")) -> 0 | AY26: =IF(RC[-3]=" ";0%;RC[-3]/COUNTIF(RC7:RC45;">=0")) -> 0.68 | AZ26: =IF(RC[-1]>60%;"Completo";IF(RC[-3]>RC[-2]+RC[-1];"No Cumplio";"Incompleto")) -> Completo
A27: 10 | B27: RONY VILLAFUERTE SERNA | C27: IF459BIN | D27: COMPUTACION GRAFICA II | E27: 4 | F27: T / P | G27: 2 | H27: 2 | I27: 2 | J27: 2 | K27: 2 | L27: 2 | M27: 2 | N27: 2 | O27: 2 | P27: 2 | Q27: 1 | R27: 2 | S27: 1 | T27: 1 | U27: 1 | V27: 0 | W27: 2 | X27: 0 | Y27: 0 | Z27: 2 | AA27: 2 | AB27: 2 | AC27: 2 | AD27: 2 | AE27: 2 | AF27: 2 | AJ27: 0 | AK27: 0 | AL27: 0 | AM27: 0 | AO27: 2 | AT27: =IF(COUNTIF(RC7:RC45;2)=0;" ";COUNTIF(RC7:RC45;0)) -> 7 | AU27: =IF(COUNTIF(RC7:RC45;2)=0;" ";COUNTIF(RC7:RC45;1)) -> 4 | AV27: =IF(COUNTIF(RC7:RC45;2)=0;" ";COUNTIF(RC7:RC45;2)) -> 20 | AW27: =IF(RC[-3]=" ";0%;RC[-3]/COUNTIF(RC7:RC45;">=0")) -> 0.225806451612903 | AX27: =IF(RC[-3]=" ";0%;RC[-3]/COUNTIF(RC7:RC45;">=0")) -> 0.129032258064516 | AY27: =IF(RC[-3]=" ";0%;RC[-3]/COUNTIF(RC7:RC45;">=0")) -> 0.645161290322581 | AZ27: =IF(RC[-1]>60%;"Completo";IF(RC[-3]>RC[-2]+RC[-1];"No Cumplio";"Incompleto")) -> Completo | BA27: =IF(RC[-1]=R[1]C[-1];RC[-1];"Incompleto") -> Completo
C28: IF552BIN | D28: REDES DE COMPUTADORAS I | E28: 4 | F28: T / P | G28: 2 | H28: 2 | I28: 2 | J28: 2 | K28: 2 | L28: 2 | M28: 2 | N28: 2 | O28: 2 | P28: 2 | Q28: 1 | R28: 2 | S28: 1 | T28: 1 | U28: 1 | V28: 0 | W28: 2 | X28: 0 | Y28: 0 | Z28: 2 | AA28: 2 | AB28: 2 | AC28: 2 | AD28: 2 | AE28: 2 | AF28: 2 | AJ28: 0 | AK28: 0 | AL28: 0 | AM28: 0 | AO28: 2 | AT28: =IF(COUNTIF(RC7:RC45;2)=0;" ";COUNTIF(RC7:RC45;0)) -> 7 | AU28: =IF(COUNTIF(RC7:RC45;2)=0;" ";COUNTIF(RC7:RC45;1)) -> 4 | AV28: =IF(COUNTIF(RC7:RC45;2)=0;" ";COUNTIF(RC7:RC45;2)) -> 20 | AW28: =IF(RC[-3]=" ";0%;RC[-3]/COUNTIF(RC7:RC45;">=0")) -> 0.225806451612903 | AX28: =IF(RC[-3]=" ";0%;RC[-3]/COUNTIF(RC7:RC45;">=0")) -> 0.129032258064516 | AY28: =IF(RC[-3]=" ";0%;RC[-3]/COUNTIF(RC7:RC45;">=0")) -> 0.645161290322581 | AZ28: =IF(RC[-1]>60%;"Completo";IF(RC[-3]>RC[-2]+RC[-1];"No Cumplio";"Incompleto")) -> Completo
A29: 11 | B29: GUZMÁN TICONA PARI | C29: IF467AEI | D29: PROGRAMACION DIGITAL | E29: 4 | F29: T / P | G29: 2 | H29: 2 | I29: 2 | J29: 2 | K29: 2 | L29: 2 | M29: 2 | N29: 0 | O29: 0 | P29: 0 | Q29: 0 | R29: 0 | S29: 2 | T29: 2 | U29: 2 | V29: 0 | W29: 2 | X29: 2 | Y29: 2 | Z29: 0 | AA29: 0 | AB29: 0 | AC29: 2 | AD29: 2 | AE29: 2 | AF29: 2 | AO29: 2 | AP29: 2 | AQ29: 0 | AR29: 2 | AS29: 2 | AT29: =IF(COUNTIF(RC7:RC45;2)=0;" ";COUNTIF(RC7:RC45;0)) -> 10 | AU29: =IF(COUNTIF(RC7:RC45;2)=0;" ";COUNTIF(RC7:RC45;1)) -> 0 | AV29: =IF(COUNTIF(RC7:RC45;2)=0;" ";COUNTIF(RC7:RC45;2)) -> 21 | AW29: =IF(RC[-3]=" ";0%;RC[-3]/COUNTIF(RC7:RC45;">=0")) -> 0.32258064516129 | AX29: =IF(RC[-3]=" ";0%;RC[-3]/COUNTIF(RC7:RC45;">=0")) -> 0 | AY29: =IF(RC[-3]=" ";0%;RC[-3]/COUNTIF(RC7:RC45;">=0")) -> 0.67741935483871 | AZ29: =IF(RC[-1]>60%;"Completo";IF(RC[-3]>RC[-2]+RC[-1];"No Cumplio";"Incompleto")) -> Completo | BA29: =IF(RC[-1]=R[1]C[-1];RC[-1];"Incompleto") -> Completo
C30: IF612AIN | D30: FUNDAMENTOS Y DISEÑO DE BASE DE DATOS | E30: 4 | F30: T / P | G30: 2 | H30: 2 | I30: 2 | J30: 2 | K30: 2 | L30: 2 | M30: 2 | N30: 0 | O30: 0 | P30: 0 | Q30: 1 | R30: 2 | S30: 0 | T30: 0 | U30: 2 | V30: 0 | W30: 2 | X30: 2 | Y30: 2 | Z30: 2 | AA30: 0 | AB30: 0 | AC30: 2 | AD30: 2 | AE30: 2 | AF30: 2 | AO30: 2 | AP30: 2 | AQ30: 0 | AR30: 2 | AS30: 2 | AT30: =IF(COUNTIF(RC7:RC45;2)=0;" ";COUNTIF(RC7:RC45;0)) -> 9 | AU30: =IF(COUNTIF(RC7:RC45;2)=0;" ";COUNTIF(RC7:RC45;1)) -> 1 | AV30: =IF(COUNTIF(RC7:RC45;2)=0;" ";COUNTIF(RC7:RC45;2)) -> 21 | AW30: =IF(RC[-3]=" ";0%;RC[-3]/COUNTIF(RC7:RC45;">=0")) -> 0.290322580645161 | AX30: =IF(RC[-3]=" ";0%;RC[-3]/COUNTIF(RC7:RC45;">=0")) -> 0.032258064516129 | AY30: =IF(RC[-3]=" ";0%;RC[-3]/COUNTIF(RC7:RC45;">=0")) -> 0.67741935483871 | AZ30: =IF(RC[-1]>60%;"Completo";IF(RC[-3]>RC[-2]+RC[-1];"No Cumplio";"Incompleto")) -> Completo
A31: 12 | B31: YESHICA ISELA ORMEÑO AYALA | C31: IF710AIN | D31: SEMINARIO DE INVESTIGACION I | E31: 3 | F31: T / P | G31: 2 | H31: 2 | I31: 2 | J31: 2 | K31: 2 | L31: 0 | M31: 0 | N31: 0 | O31: 0 | P31: 0 | Q31: 0 | R31: 0 | S31: 0 | T31: 0 | U31: 0 | V31: 0 | W31: 0 | X31: 0 | Y31: 0 | Z31: 0 | AA31: 0 | AB31: 0 | AC31: 0 | AD31: 0 | AE31: 0 | AF31: 0 | AO31: 0 | AT31: =IF(COUNTIF(RC7:RC45;2)=0;" ";COUNTIF(RC7:RC45;0)) -> 22 | AU31: =IF(COUNTIF(RC7:RC45;2)=0;" ";COUNTIF(RC7:RC45;1)) -> 0 | AV31: =IF(COUNTIF(RC7:RC45;2)=0;" ";COUNTIF(RC7:RC45;2)) -> 5 | AW31: =IF(RC[-3]=" ";0%;RC[-3]/COUNTIF(RC7:RC45;">=0")) -> 0.814814814814815 | AX31: =IF(RC[-3]=" ";0%;RC[-3]/COUNTIF(RC7:RC45;">=0")) -> 0 | AY31: =IF(RC[-3]=" ";0%;RC[-3]/COUNTIF(RC7:RC45;">=0")) -> 0.185185185185185 | AZ31: =IF(RC[-1]>60%;"Completo";IF(RC[-3]>RC[-2]+RC[-1];"No Cumplio";"Incompleto")) -> No Cumplio | BA31: =RC[-1] -> No Cumplio
C32: IF711BIN | D32: SEMINARIO DE INVESTIGACION II | E32: 3 | F32: T / P | G32: 2 | H32: 2 | I32: 2 | J32: 2 | K32: 2 | L32: 2 | M32: 2 | N32: 2 | O32: 2 | P32: 2 | Q32: 2 | R32: 2 | S32: 2 | T32: 2 | U32: 2 | W32: 2 | X32: 2 | Y32: 2 | Z32: 2 | AA32: 2 | AB32: 2 | AJ32: 2 | AK32: 2 | AL32: 2 | AO32: 0 | AT32: =IF(COUNTIF(RC7:RC45;2)=0;" ";COUNTIF(RC7:RC45;0)) -> 1 | AU32: =IF(COUNTIF(RC7:RC45;2)=0;" ";COUNTIF(RC7:RC45;1)) -> 0 | AV32: =IF(COUNTIF(RC7:RC45;2)=0;" ";COUNTIF(RC7:RC45;2)) -> 24 | AW32: =IF(RC[-3]=" ";0%;RC[-3]/COUNTIF(RC7:RC45;">=0")) -> 0.04 | AX32: =IF(RC[-3]=" ";0%;RC[-3]/COUNTIF(RC7:RC45;">=0")) -> 0 | AY32: =IF(RC[-3]=" ";0%;RC[-3]/COUNTIF(RC7:RC45;">=0")) -> 0.96 | AZ32: =IF(RC[-1]>60%;"Completo";IF(RC[-3]>RC[-2]+RC[-1];"No Cumplio";"Incompleto")) -> Completo
C33: IF902AFLAIN | D33: TECNOLOGIAS DE LA INFORMACION Y LA COMUNICACIÓN | E33: 3 | F33: P | G33: 2 | H33: 2 | I33: 2 | J33: 2 | K33: 2 | L33: 2 | M33: 0 | N33: 0 | O33: 0 | P33: 2 | Q33: 2 | R33: 0 | S33: 0 | T33: 0 | U33: 0 | V33: 0 | W33: 0 | X33: 0 | Y33: 0 | Z33: 0 | AA33: 0 | AB33: 0 | AC33: 0 | AD33: 0 | AE33: 0 | AF33: 0 | AO33: 0 | AT33: =IF(COUNTIF(RC7:RC45;2)=0;" ";COUNTIF(RC7:RC45;0)) -> 19 | AU33: =IF(COUNTIF(RC7:RC45;2)=0;" ";COUNTIF(RC7:RC45;1)) -> 0 | AV33: =IF(COUNTIF(RC7:RC45;2)=0;" ";COUNTIF(RC7:RC45;2)) -> 8 | AW33: =IF(RC[-3]=" ";0%;RC[-3]/COUNTIF(RC7:RC45;">=0")) -> 0.703703703703704 | AX33: =IF(RC[-3]=" ";0%;RC[-3]/COUNTIF(RC7:RC45;">=0")) -> 0 | AY33: =IF(RC[-3]=" ";0%;RC[-3]/COUNTIF(RC7:RC45;">=0")) -> 0.296296296296296 | AZ33: =IF(RC[-1]>60%;"Completo";IF(RC[-3]>RC[-2]+RC[-1];"No Cumplio";"Incompleto")) -> No Cumplio
A34: 13 | B34: JAVIER DAVID CHÁVEZ CENTENO | C34: IF484AIN | D34: EMPRENDIMIENTO E INNOVACION | E34: 3 | F34: T / P | G34: 2 | H34: 2 | I34: 2 | J34: 2 | K34: 2 | L34: 2 | M34: 2 | N34: 2 | O34: 2 | P34: 2 | Q34: 2 | R34: 0 | S34: 2 | T34: 2 | W34: 1 | X34: 1 | Z34: 2 | AA34: 2 | AC34: 1 | AD34: 1 | AO34: 2 | AP34: 2 | AQ34: 2 | AR34: 2 | AS34: 2 | AV34: =IF(COUNTIF(RC7:RC45;2)=0;" ";COUNTIF(RC7:RC45;2)) -> 20 | AW34: =IF(RC[-3]=" ";0%;RC[-3]/COUNTIF(RC7:RC45;">=0")) -> 0 | AX34: =IF(RC[-3]=" ";0%;RC[-3]/COUNTIF(RC7:RC45;">=0")) -> 0 | AY34: =IF(RC[-3]=" ";0%;RC[-3]/COUNTIF(RC7:RC45;">=0")) -> 0.8 | AZ34: =IF(RC[-1]>60%;"Completo";IF(AND(RC[-3]>RC[-2]+RC[-1];RC[-1]<20%);"No Cumplio";"Incompleto")) -> Completo | BA34: =IF(AND(RC[-1]=R[1]C[-1];RC[-1]=R[2]C[-1]);RC[-1];"Incompleto") -> Completo
C35: IF902AAE / IF902CHI | D35: TECNOLOGIAS DE LA INFORMACION Y LA COMUNICACIÓN | E35: 3 | F35: T | G35: 2 | H35: 2 | I35: 2 | J35: 2 | K35: 2 | L35: 2 | M35: 2 | N35: 2 | O35: 2 | P35: 2 | Q35: 2 | R35: 0 | S35: 2 | T35: 2 | W35: 1 | X35: 1 | Z35: 2 | AA35: 2 | AC35: 1 | AD35: 1 | AO35: 2 | AP35: 2 | AQ35: 2 | AR35: 2 | AS35: 2 | AV35: =IF(COUNTIF(RC7:RC45;2)=0;" ";COUNTIF(RC7:RC45;2)) -> 20 | AW35: =IF(RC[-3]=" ";0%;RC[-3]/COUNTIF(RC7:RC45;">=0")) -> 0 | AX35: =IF(RC[-3]=" ";0%;RC[-3]/COUNTIF(RC7:RC45;">=0")) -> 0 | AY35: =IF(RC[-3]=" ";0%;RC[-3]/COUNTIF(RC7:RC45;">=0")) -> 0.8 | AZ35: =IF(RC[-1]>60%;"Completo";IF(AND(RC[-3]>RC[-2]+RC[-1];RC[-1]<20%);"No Cumplio";"Incompleto")) -> Completo
C36: IF902AEU | D36: TECNOLOGIAS DE LA INFORMACION Y LA COMUNICACIÓN | E36: 3 | F36: T/P | G36: 2 | H36: 2 | I36: 2 | J36: 2 | K36: 2 | L36: 2 | M36: 2 | N36: 2 | O36: 2 | P36: 2 | Q36: 2 | R36: 0 | S36: 2 | T36: 2 | W36: 1 | X36: 1 | Z36: 2 | AA36: 2 | AC36: 1 | AD36: 1 | AO36: 2 | AP36: 2 | AQ36: 2 | AR36: 2 | AS36: 2 | AV36: =IF(COUNTIF(RC7:RC45;2)=0;" ";COUNTIF(RC7:RC45;2)) -> 20 | AW36: =IF(RC[-3]=" ";0%;RC[-3]/COUNTIF(RC7:RC45;">=0")) -> 0 | AX36: =IF(RC[-3]=" ";0%;RC[-3]/COUNTIF(RC7:RC45;">=0")) -> 0 | AY36: =IF(RC[-3]=" ";0%;RC[-3]/COUNTIF(RC7:RC45;">=0")) -> 0.8 | AZ36: =IF(RC[-1]>60%;"Completo";IF(AND(RC[-3]>RC[-2]+RC[-1];RC[-1]<20%);"No Cumplio";"Incompleto")) -> Completo
A37: 14 | B37: ROXANA LISETTE QUINTANILLA PORTUGAL | C37: IF902CEU | D37: TECNOLOGIAS DE LA INFORMACION Y LA COMUNICACIÓN | E37: 3 | F37: T/P | G37: 2 | H37: 2 | I37: 2 | J37: 2 | K37: 2 | L37: 2 | M37: 2 | N37: 2 | O37: 2 | P37: 2 | Q37: 2 | R37: 2 | S37: 2 | T37: 2 | W37: 2 | X37: 2 | Z37: 2 | AA37: 2 | AC37: 2 | AD37: 2 | AO37: 2 | AT37: =IF(COUNTIF(RC7:RC45;0)=0;" ";COUNTIF(RC7:RC45;0)) ->  | AU37: =IF(COUNTIF(RC7:RC45;1)=0;" ";COUNTIF(RC7:RC45;1)) ->  | AV37: =IF(COUNTIF(RC7:RC45;2)=0;" ";COUNTIF(RC7:RC45;2)) -> 21 | AW37: =IF(RC[-3]=" ";0%;RC[-3]/COUNTIF(RC7:RC45;">=0")) -> 0 | AX37: =IF(RC[-3]=" ";0%;RC[-3]/COUNTIF(RC7:RC45;">=0")) -> 0 | AY37: =IF(RC[-3]=" ";0%;RC[-3]/COUNTIF(RC7:RC45;">=0")) -> 1 | AZ37: =IF(RC[-1]>60%;"Completo";IF(RC[-3]>RC[-2]+RC[-1];"No Cumplio";"Incompleto")) -> Completo | BA37: =IF(AND(RC[-1]=R[1]C[-1];RC[-1]=R[2]C[-1]);RC[-1];"Incompleto") -> Completo
C38: IF902AFL / IF902APS | D38: TECNOLOGIAS DE LA INFORMACION Y LA COMUNICACIÓN | E38: 3 | F38: T/P | G38: 2 | H38: 2 | I38: 2 | J38: 2 | K38: 2 | L38: 2 | M38: 2 | N38: 2 | O38: 2 | P38: 2 | Q38: 2 | R38: 2 | S38: 2 | T38: 2 | W38: 2 | X38: 2 | Z38: 2 | AA38: 2 | AC38: 2 | AD38: 2 | AO38: 2 | AT38: =IF(COUNTIF(RC7:RC45;0)=0;" ";COUNTIF(RC7:RC45;0)) ->  | AU38: =IF(COUNTIF(RC7:RC45;1)=0;" ";COUNTIF(RC7:RC45;1)) ->  | AV38: =IF(COUNTIF(RC7:RC45;2)=0;" ";COUNTIF(RC7:RC45;2)) -> 21 | AW38: =IF(RC[-3]=" ";0%;RC[-3]/COUNTIF(RC7:RC45;">=0")) -> 0 | AX38: =IF(RC[-3]=" ";0%;RC[-3]/COUNTIF(RC7:RC45;">=0")) -> 0 | AY38: =IF(RC[-3]=" ";0%;RC[-3]/COUNTIF(RC7:RC45;">=0")) -> 1 | AZ38: =IF(RC[-1]>60%;"Completo";IF(RC[-3]>RC[-2]+RC[-1];"No Cumplio";"Incompleto")) -> Completo
C39: IF902ACI | D39: TECNOLOGIAS DE LA INFORMACION Y LA COMUNICACIÓN | E39: 3 | F39: P | G39: 2 | H39: 2 | I39: 2 | J39: 2 | L39: 2 | O39: 2 | AG39: 2 | AH39: 2 | AT39: =IF(COUNTIF(RC7:RC45;0)=0;" ";COUNTIF(RC7:RC45;0)) ->  | AU39: =IF(COUNTIF(RC7:RC45;1)=0;" ";COUNTIF(RC7:RC45;1)) ->  | AV39: =IF(COUNTIF(RC7:RC45;2)=0;" ";COUNTIF(RC7:RC45;2)) -> 8 | AW39: =IF(RC[-3]=" ";0%;RC[-3]/COUNTIF(RC7:RC45;">=0")) -> 0 | AX39: =IF(RC[-3]=" ";0%;RC[-3]/COUNTIF(RC7:RC45;">=0")) -> 0 | AY39: =IF(RC[-3]=" ";0%;RC[-3]/COUNTIF(RC7:RC45;">=0")) -> 1 | AZ39: =IF(RC[-1]>60%;"Completo";IF(RC[-3]>RC[-2]+RC[-1];"No Cumplio";"Incompleto")) -> Completo
A40: 15 | B40: IVÁN CESAR MEDRANO VALENCIA | C40: IF657AIN | D40: VISION COMPUTACIONAL | E40: 4 | F40: T / P | G40: 2 | H40: 2 | I40: 2 | J40: 2 | K40: 2 | L40: 2 | M40: 2 | N40: 2 | O40: 2 | P40: 1 | Q40: 1 | R40: 1 | S40: 1 | T40: 2 | U40: 2 | W40: 2 | X40: 2 | Y40: 2 | Z40: 2 | AA40: 2 | AB40: 2 | AC40: 1 | AD40: 1 | AE40: 1 | AF40: 1 | AN40: 2 | AO40: 2 | AV40: =IF(COUNTIF(RC7:RC45;2)=0;" ";COUNTIF(RC7:RC45;2)) -> 19 | AW40: =IF(RC[-3]=" ";0%;RC[-3]/COUNTIF(RC7:RC45;">=0")) -> 0 | AX40: =IF(RC[-3]=" ";0%;RC[-3]/COUNTIF(RC7:RC45;">=0")) -> 0 | AY40: =IF(RC[-3]=" ";0%;RC[-3]/COUNTIF(RC7:RC45;">=0")) -> 0.703703703703704 | AZ40: =IF(RC[-1]>60%;"Completo";IF(RC[-3]>RC[-2]+RC[-1];"No Cumplio";"Incompleto")) -> Completo | BA40: =IF(RC[-1]=R[1]C[-1];RC[-1];"Incompleto") -> Completo
C41: IF662AIN | D41: DEEP LEARNING | E41: 4 | F41: T / P | G41: 2 | H41: 2 | I41: 2 | J41: 2 | K41: 2 | L41: 2 | M41: 2 | N41: 2 | O41: 2 | P41: 1 | Q41: 1 | R41: 1 | S41: 2 | T41: 2 | U41: 2 | W41: 2 | X41: 2 | Y41: 2 | Z41: 2 | AA41: 2 | AB41: 2 | AC41: 1 | AD41: 1 | AE41: 1 | AF41: 1 | AN41: 2 | AO41: 2 | AV41: =IF(COUNTIF(RC7:RC45;2)=0;" ";COUNTIF(RC7:RC45;2)) -> 20 | AW41: =IF(RC[-3]=" ";0%;RC[-3]/COUNTIF(RC7:RC45;">=0")) -> 0 | AX41: =IF(RC[-3]=" ";0%;RC[-3]/COUNTIF(RC7:RC45;">=0")) -> 0 | AY41: =IF(RC[-3]=" ";0%;RC[-3]/COUNTIF(RC7:RC45;">=0")) -> 0.740740740740741 | AZ41: =IF(RC[-1]>60%;"Completo";IF(RC[-3]>RC[-2]+RC[-1];"No Cumplio";"Incompleto")) -> Completo
A42: 16 | B42: LUIS BELTRÁN PALMA TTITO | C42: IF669AIN | D42: MODELADO Y SIMULACION | E42: 4 | F42: T / P | G42: 2 | H42: 2 | I42: 2 | J42: 2 | K42: 2 | L42: 2 | M42: 2 | N42: 0 | O42: 1 | P42: 0 | S42: 2 | T42: 2 | U42: 1 | V42: 1 | AC42: 2 | AD42: 2 | AE42: 2 | AN42: 2 | AO42: 2 | AV42: =IF(COUNTIF(RC7:RC45;2)=0;" ";COUNTIF(RC7:RC45;2)) -> 14 | AW42: =IF(RC[-3]=" ";0%;RC[-3]/COUNTIF(RC7:RC45;">=0")) -> 0 | AX42: =IF(RC[-3]=" ";0%;RC[-3]/COUNTIF(RC7:RC45;">=0")) -> 0 | AY42: =IF(RC[-3]=" ";0%;RC[-3]/COUNTIF(RC7:RC45;">=0")) -> 0.736842105263158 | AZ42: =IF(RC[-1]>60%;"Completo";IF(RC[-3]>RC[-2]+RC[-1];"No Cumplio";"Incompleto")) -> Completo | BA42: =IF(RC[-1]=R[1]C[-1];RC[-1];"Incompleto") -> Completo
C43: IF658AIN | D43: REDES NEURONALES ARTIFICIALES | E43: 4 | F43: T / P | G43: 2 | H43: 2 | I43: 2 | J43: 2 | K43: 2 | L43: 2 | M43: 2 | N43: 0 | O43: 1 | P43: 0 | S43: 2 | T43: 2 | U43: 2 | V43: 1 | AC43: 2 | AD43: 2 | AE43: 2 | AN43: 2 | AO43: 2 | AV43: =IF(COUNTIF(RC7:RC45;2)=0;" ";COUNTIF(RC7:RC45;2)) -> 15 | AW43: =IF(RC[-3]=" ";0%;RC[-3]/COUNTIF(RC7:RC45;">=0")) -> 0 | AX43: =IF(RC[-3]=" ";0%;RC[-3]/COUNTIF(RC7:RC45;">=0")) -> 0 | AY43: =IF(RC[-3]=" ";0%;RC[-3]/COUNTIF(RC7:RC45;">=0")) -> 0.789473684210526 | AZ43: =IF(RC[-1]>60%;"Completo";IF(RC[-3]>RC[-2]+RC[-1];"No Cumplio";"Incompleto")) -> Completo
A44: 17 | B44: ROBERT WILBERT ALZAMORA PAREDES | C44: IF452AIN | D44: ALGORITMOS Y ESTRUCTURAS DE DATOS | E44: 4 | F44: T / P | G44: 2 | H44: 2 | I44: 2 | J44: 2 | K44: 2 | L44: 2 | M44: 2 | N44: 2 | O44: 2 | P44: 2 | Q44: 2 | R44: 2 | S44: 2 | T44: 2 | U44: 2 | W44: 2 | X44: 2 | Y44: 2 | Z44: 2 | AA44: 2 | AB44: 2 | AC44: 2 | AD44: 2 | AE44: 2 | AO44: 2 | AV44: =IF(COUNTIF(RC7:RC45;2)=0;" ";COUNTIF(RC7:RC45;2)) -> 25 | AW44: =IF(RC[-3]=" ";0%;RC[-3]/COUNTIF(RC7:RC45;">=0")) -> 0 | AX44: =IF(RC[-3]=" ";0%;RC[-3]/COUNTIF(RC7:RC45;">=0")) -> 0 | AY44: =IF(RC[-3]=" ";0%;RC[-3]/COUNTIF(RC7:RC45;">=0")) -> 1 | AZ44: =IF(RC[-1]>60%;"Completo";IF(RC[-3]>RC[-2]+RC[-1];"No Cumplio";"Incompleto")) -> Completo | BA44: =IF(RC[-1]=R[1]C[-1];RC[-1];"Incompleto") -> Completo
C45: IF656AIN | D45: PROCESAMIENTO DE LENGUAJE NATURAL | E45: 4 | F45: T / P | G45: 2 | H45: 2 | I45: 2 | J45: 2 | K45: 2 | L45: 2 | M45: 2 | N45: 2 | O45: 2 | P45: 2 | Q45: 2 | R45: 2 | S45: 2 | T45: 2 | U45: 2 | W45: 2 | X45: 2 | Y45: 2 | Z45: 2 | AA45: 2 | AB45: 2 | AC45: 2 | AD45: 2 | AE45: 2 | AO45: 2 | AV45: =IF(COUNTIF(RC7:RC45;2)=0;" ";COUNTIF(RC7:RC45;2)) -> 25 | AW45: =IF(RC[-3]=" ";0%;RC[-3]/COUNTIF(RC7:RC45;">=0")) -> 0 | AX45: =IF(RC[-3]=" ";0%;RC[-3]/COUNTIF(RC7:RC45;">=0")) -> 0 | AY45: =IF(RC[-3]=" ";0%;RC[-3]/COUNTIF(RC7:RC45;">=0")) -> 1 | AZ45: =IF(RC[-1]>60%;"Completo";IF(RC[-3]>RC[-2]+RC[-1];"No Cumplio";"Incompleto")) -> Completo
A46: 18 | B46: WALDO ELIO IBARRA ZAMBRANO | C46: IF167AFI | D46: PROGRAMACION CIENTIFICA | E46: 4 | F46: T / P | G46: 2 | I46: 2 | J46: 2 | AV46: =IF(COUNTIF(RC7:RC45;2)=0;" ";COUNTIF(RC7:RC45;2)) -> 3 | AW46: =IF(RC[-3]=" ";0%;RC[-3]/COUNTIF(RC7:RC45;">=0")) -> 0 | AX46: =IF(RC[-3]=" ";0%;RC[-3]/COUNTIF(RC7:RC45;">=0")) -> 0 | AY46: =IF(RC[-3]=" ";0%;RC[-3]/COUNTIF(RC7:RC45;">=0")) -> 1 | AZ46: =IF(RC[-1]>60%;"Completo";IF(RC[-3]>RC[-2]+RC[-1];"No Cumplio";"Incompleto")) -> Completo | BA46: =IF(AND(RC[-1]=R[1]C[-1];RC[-1]=#REF!);RC[-1];"Incompleto") -> #REF!
C47: IF468BIN | D47: FUNDAMENTOS DE LA PROGRAMACION | E47: 4 | F47: T / P | G47: 2 | I47: 2 | J47: 2 | AV47: =IF(COUNTIF(RC7:RC45;2)=0;" ";COUNTIF(RC7:RC45;2)) -> 3 | AW47: =IF(RC[-3]=" ";0%;RC[-3]/COUNTIF(RC7:RC45;">=0")) -> 0 | AX47: =IF(RC[-3]=" ";0%;RC[-3]/COUNTIF(RC7:RC45;">=0")) -> 0 | AY47: =IF(RC[-3]=" ";0%;RC[-3]/COUNTIF(RC7:RC45;">=0")) -> 1 | AZ47: =IF(RC[-1]>60%;"Completo";IF(RC[-3]>RC[-2]+RC[-1];"No Cumplio";"Incompleto")) -> Completo
A48: 19 | B48: KARELIA MEDINA MIRANDA | C48: IF452BIN | D48: ALGORITMOS Y ESTRUCTURAS DE DATOS | E48: 4 | F48: T / P | G48: 2 | H48: 2 | I48: 2 | J48: 2 | K48: 2 | L48: 2 | M48: 2 | N48: 2 | O48: 0 | P48: 2 | Q48: 0 | R48: 0 | S48: 1 | T48: 2 | U48: 1 | V48: 1 | W48: 2 | X48: 2 | Y48: 2 | Z48: 2 | AA48: 2 | AB48: 2 | AC48: 2 | AD48: 2 | AE48: 2 | AO48: 2 | AV48: =IF(COUNTIF(RC7:RC45;2)=0;" ";COUNTIF(RC7:RC45;2)) -> 20 | AW48: =IF(RC[-3]=" ";0%;RC[-3]/COUNTIF(RC7:RC45;">=0")) -> 0 | AX48: =IF(RC[-3]=" ";0%;RC[-3]/COUNTIF(RC7:RC45;">=0")) -> 0 | AY48: =IF(RC[-3]=" ";0%;RC[-3]/COUNTIF(RC7:RC45;">=0")) -> 0.769230769230769 | AZ48: =IF(RC[-1]>60%;"Completo";IF(RC[-3]>RC[-2]+RC[-1];"No Cumplio";"Incompleto")) -> Completo | BA48: =IF(RC[-1]=R[1]C[-1];RC[-1];"Incompleto") -> Completo
C49: IF612BIN | D49: FUNDAMENTOS Y DISEÑO DE BASE DE DATOS | E49: 4 | F49: T / P | G49: 2 | H49: 2 | I49: 2 | J49: 2 | K49: 2 | L49: 2 | M49: 2 | N49: 2 | O49: 0 | P49: 2 | Q49: 1 | R49: 0 | S49: 1 | T49: 1 | U49: 1 | W49: 2 | X49: 2 | Y49: 2 | Z49: 2 | AA49: 2 | AB49: 2 | AC49: 2 | AD49: 2 | AE49: 2 | AO49: 2 | AV49: =IF(COUNTIF(RC7:RC45;2)=0;" ";COUNTIF(RC7:RC45;2)) -> 19 | AW49: =IF(RC[-3]=" ";0%;RC[-3]/COUNTIF(RC7:RC45;">=0")) -> 0 | AX49: =IF(RC[-3]=" ";0%;RC[-3]/COUNTIF(RC7:RC45;">=0")) -> 0 | AY49: =IF(RC[-3]=" ";0%;RC[-3]/COUNTIF(RC7:RC45;">=0")) -> 0.76 | AZ49: =IF(RC[-1]>60%;"Completo";IF(RC[-3]>RC[-2]+RC[-1];"No Cumplio";"Incompleto")) -> Completo
A50: 20 | B50: VANESSA MARIBEL CHOQUE SOTO | C50: IF481AIN | D50: INGENIERIA ECONOMICA | E50: 3 | F50: T / P | G50: 2 | H50: 2 | I50: 2 | J50: 2 | K50: 2 | L50: 2 | M50: 2 | N50: 2 | O50: 2 | P50: 2 | Q50: 2 | R50: 2 | S50: 2 | T50: 2 | W50: 2 | X50: 2 | Z50: 2 | AA50: 2 | AC50: 2 | AD50: 2 | AO50: 2 | AV50: =IF(COUNTIF(RC7:RC45;2)=0;" ";COUNTIF(RC7:RC45;2)) -> 21 | AW50: =IF(RC[-3]=" ";0%;RC[-3]/COUNTIF(RC7:RC45;">=0")) -> 0 | AX50: =IF(RC[-3]=" ";0%;RC[-3]/COUNTIF(RC7:RC45;">=0")) -> 0 | AY50: =IF(RC[-3]=" ";0%;RC[-3]/COUNTIF(RC7:RC45;">=0")) -> 1 | AZ50: =IF(RC[-1]>60%;"Completo";IF(RC[-3]>RC[-2]+RC[-1];"No Cumplio";"Incompleto")) -> Completo | BA50: =IF(AND(RC[-1]=R[1]C[-1];RC[-1]=R[2]C[-1]);RC[-1];"Incompleto") -> Completo
C51: IF482AIN | D51: PLANEAMIENTO Y DIRECCION ESTRATEGICA DE TECNOLOGIA DE INFORMACION | E51: 3 | F51: T / P | G51: 2 | H51: 2 | I51: 2 | J51: 2 | K51: 2 | L51: 2 | M51: 2 | N51: 2 | O51: 2 | P51: 2 | Q51: 2 | R51: 2 | S51: 2 | T51: 2 | W51: 2 | X51: 2 | Z51: 2 | AA51: 2 | AC51: 2 | AD51: 2 | AO51: 2 | AV51: =IF(COUNTIF(RC7:RC45;2)=0;" ";COUNTIF(RC7:RC45;2)) -> 21 | AW51: =IF(RC[-3]=" ";0%;RC[-3]/COUNTIF(RC7:RC45;">=0")) -> 0 | AX51: =IF(RC[-3]=" ";0%;RC[-3]/COUNTIF(RC7:RC45;">=0")) -> 0 | AY51: =IF(RC[-3]=" ";0%;RC[-3]/COUNTIF(RC7:RC45;">=0")) -> 1 | AZ51: =IF(RC[-1]>60%;"Completo";IF(RC[-3]>RC[-2]+RC[-1];"No Cumplio";"Incompleto")) -> Completo
C52: IF902AAN / IF902BCC | D52: TECNOLOGIAS DE LA INFORMACION Y LA COMUNICACIÓN | E52: 3 | F52: T | G52: 2 | H52: 2 | I52: 2 | J52: 2 | K52: 2 | L52: 2 | M52: 2 | N52: 2 | O52: 2 | P52: 2 | Q52: 2 | R52: 2 | S52: 2 | T52: 2 | W52: 2 | X52: 2 | Z52: 2 | AA52: 2 | AC52: 2 | AD52: 2 | AO52: 2 | AV52: =IF(COUNTIF(RC7:RC45;2)=0;" ";COUNTIF(RC7:RC45;2)) -> 21 | AW52: =IF(RC[-3]=" ";0%;RC[-3]/COUNTIF(RC7:RC45;">=0")) -> 0 | AX52: =IF(RC[-3]=" ";0%;RC[-3]/COUNTIF(RC7:RC45;">=0")) -> 0 | AY52: =IF(RC[-3]=" ";0%;RC[-3]/COUNTIF(RC7:RC45;">=0")) -> 1 | AZ52: =IF(RC[-1]>60%;"Completo";IF(RC[-3]>RC[-2]+RC[-1];"No Cumplio";"Incompleto")) -> Completo
A53: 21 | B53: MANUEL AURELIO PEÑALOZA FIGUEROA | C53: IF482BIN | D53: PLANEAMIENTO Y DIRECCION ESTRATEGICA DE TECNOLOGIA DE INFORMACION | E53: 3 | F53: T / P | G53: 2 | H53: 2 | I53: 2 | J53: 2 | K53: 2 | L53: 2 | M53: 2 | N53: 2 | O53: 2 | P53: 2 | Q53: 2 | R53: 2 | S53: 2 | T53: 2 | W53: 2 | X53: 2 | Z53: 2 | AA53: 2 | AC53: 2 | AD53: 2 | AO53: 2 | AV53: =IF(COUNTIF(RC7:RC45;2)=0;" ";COUNTIF(RC7:RC45;2)) -> 21 | AW53: =IF(RC[-3]=" ";0%;RC[-3]/COUNTIF(RC7:RC45;">=0")) -> 0 | AX53: =IF(RC[-3]=" ";0%;RC[-3]/COUNTIF(RC7:RC45;">=0")) -> 0 | AY53: =IF(RC[-3]=" ";0%;RC[-3]/COUNTIF(RC7:RC45;">=0")) -> 1 | AZ53: =IF(RC[-1]>60%;"Completo";IF(RC[-3]>RC[-2]+RC[-1];"No Cumplio";"Incompleto")) -> Completo | BA53: =IF(RC[-1]=R[1]C[-1];RC[-1];"Incompleto") -> Completo
C54: IF551BIN | D54: SISTEMAS OPERATIVOS | E54: 4 | F54: T / P | G54: 2 | H54: 2 | I54: 2 | J54: 2 | K54: 2 | L54: 2 | M54: 2 | N54: 2 | O54: 2 | P54: 2 | Q54: 2 | R54: 2 | S54: 2 | T54: 2 | U54: 2 | W54: 2 | X54: 2 | Y54: 2 | Z54: 2 | AA54: 2 | AB54: 2 | AC54: 2 | AD54: 2 | AE54: 2 | AO54: 2 | AV54: =IF(COUNTIF(RC7:RC45;2)=0;" ";COUNTIF(RC7:RC45;2)) -> 25 | AW54: =IF(RC[-3]=" ";0%;RC[-3]/COUNTIF(RC7:RC45;">=0")) -> 0 | AX54: =IF(RC[-3]=" ";0%;RC[-3]/COUNTIF(RC7:RC45;">=0")) -> 0 | AY54: =IF(RC[-3]=" ";0%;RC[-3]/COUNTIF(RC7:RC45;">=0")) -> 1 | AZ54: =IF(RC[-1]>60%;"Completo";IF(RC[-3]>RC[-2]+RC[-1];"No Cumplio";"Incompleto")) -> Completo
C55: IF902AQI | D55: TECNOLOGIAS DE LA INFORMACION Y LA COMUNICACIÓN | E55: 3 | F55: P | G55: 2 | H55: 2 | I55: 2 | J55: 2 | M55: 2 | O55: 2 | P55: 2 | AG55: 2 | AH55: 2 | AV55: =IF(COUNTIF(RC7:RC45;2)=0;" ";COUNTIF(RC7:RC45;2)) -> 9 | AW55: =IF(RC[-3]=" ";0%;RC[-3]/COUNTIF(RC7:RC45;">=0")) -> 0 | AX55: =IF(RC[-3]=" ";0%;RC[-3]/COUNTIF(RC7:RC45;">=0")) -> 0 | AY55: =IF(RC[-3]=" ";0%;RC[-3]/COUNTIF(RC7:RC45;">=0")) -> 1 | AZ55: =IF(RC[-1]>60%;"Completo";IF(RC[-3]>RC[-2]+RC[-1];"No Cumplio";"Incompleto")) -> Completo
A56: 22 | B56: JOSÉ MAURO PILLCO QUISPE | C56: IF458AIN | D56: COMPUTACION GRAFICA I | E56: 4 | F56: T / P | G56: 2 | H56: 2 | I56: 2 | J56: 2 | K56: 2 | L56: 2 | M56: 2 | N56: 2 | O56: 2 | P56: 2 | Q56: 2 | R56: 2 | S56: 2 | T56: 2 | U56: 2 | W56: 2 | X56: 2 | Y56: 2 | Z56: 2 | AA56: 2 | AB56: 2 | AC56: 2 | AD56: 2 | AE56: 2 | AO56: 2 | AV56: =IF(COUNTIF(RC7:RC45;2)=0;" ";COUNTIF(RC7:RC45;2)) -> 25 | AW56: =IF(RC[-3]=" ";0%;RC[-3]/COUNTIF(RC7:RC45;">=0")) -> 0 | AX56: =IF(RC[-3]=" ";0%;RC[-3]/COUNTIF(RC7:RC45;">=0")) -> 0 | AY56: =IF(RC[-3]=" ";0%;RC[-3]/COUNTIF(RC7:RC45;">=0")) -> 1 | AZ56: =IF(RC[-1]>60%;"Completo";IF(RC[-3]>RC[-2]+RC[-1];"No Cumplio";"Incompleto")) -> Completo | BA56: =IF(AND(RC[-1]=R[1]C[-1]);RC[-1];"Incompleto") -> Completo
C57: IF654AIN | D57: ROBOTICA | E57: 4 | F57: T / P | G57: 2 | H57: 2 | I57: 2 | J57: 2 | K57: 2 | L57: 2 | M57: 2 | N57: 2 | O57: 2 | P57: 2 | Q57: 2 | R57: 2 | S57: 2 | T57: 2 | U57: 2 | W57: 2 | X57: 2 | Y57: 2 | Z57: 2 | AA57: 2 | AB57: 2 | AC57: 2 | AD57: 2 | AE57: 2 | AO57: 2 | AV57: =IF(COUNTIF(RC7:RC45;2)=0;" ";COUNTIF(RC7:RC45;2)) -> 25 | AW57: =IF(RC[-3]=" ";0%;RC[-3]/COUNTIF(RC7:RC45;">=0")) -> 0 | AX57: =IF(RC[-3]=" ";0%;RC[-3]/COUNTIF(RC7:RC45;">=0")) -> 0 | AY57: =IF(RC[-3]=" ";0%;RC[-3]/COUNTIF(RC7:RC45;">=0")) -> 1 | AZ57: =IF(RC[-1]>60%;"Completo";IF(RC[-3]>RC[-2]+RC[-1];"No Cumplio";"Incompleto")) -> Completo
A58: 23 | B58: LINO AQUILES BACA CARDENAS | C58: IF457AIN | D58: METODOS NUMERICOS | E58: 3 | F58: T / P | G58: 2 | H58: 2 | I58: 2 | J58: 2 | K58: 2 | L58: 2 | M58: 2 | N58: 2 | O58: 2 | P58: 2 | Q58: 2 | R58: 2 | S58: 2 | T58: 2 | W58: 2 | X58: 2 | AC58: 2 | AD58: 2 | AO58: 2 | AV58: =IF(COUNTIF(RC7:RC45;2)=0;" ";COUNTIF(RC7:RC45;2)) -> 19 | AW58: =IF(RC[-3]=" ";0%;RC[-3]/COUNTIF(RC7:RC45;">=0")) -> 0 | AX58: =IF(RC[-3]=" ";0%;RC[-3]/COUNTIF(RC7:RC45;">=0")) -> 0 | AY58: =IF(RC[-3]=" ";0%;RC[-3]/COUNTIF(RC7:RC45;">=0")) -> 1 | AZ58: =IF(RC[-1]>60%;"Completo";IF(RC[-3]>RC[-2]+RC[-1];"No Cumplio";"Incompleto")) -> Completo | BA58: =IF(RC[-1]=R[1]C[-1];RC[-1];"Incompleto") -> Completo
C59: IF902ACC | D59: TECNOLOGIAS DE LA INFORMACION Y LA COMUNICACIÓN | E59: 3 | F59: T / P | G59: 2 | H59: 2 | I59: 2 | J59: 2 | K59: 2 | L59: 2 | M59: 2 | N59: 2 | O59: 2 | P59: 2 | Q59: 2 | R59: 2 | S59: 2 | T59: 2 | W59: 2 | X59: 2 | AC59: 2 | AD59: 2 | AO59: 2 | AV59: =IF(COUNTIF(RC7:RC45;2)=0;" ";COUNTIF(RC7:RC45;2)) -> 19 | AW59: =IF(RC[-3]=" ";0%;RC[-3]/COUNTIF(RC7:RC45;">=0")) -> 0 | AX59: =IF(RC[-3]=" ";0%;RC[-3]/COUNTIF(RC7:RC45;">=0")) -> 0 | AY59: =IF(RC[-3]=" ";0%;RC[-3]/COUNTIF(RC7:RC45;">=0")) -> 1 | AZ59: =IF(RC[-1]>60%;"Completo";IF(RC[-3]>RC[-2]+RC[-1];"No Cumplio";"Incompleto")) -> Completo
C60: IF902AEO / IF902BHI | D60: TECNOLOGIAS DE LA INFORMACION Y LA COMUNICACIÓN | E60: 3 | F60: P | G60: 2 | H60: 2 | I60: 2 | J60: 2 | M60: 0 | O60: 0 | P60: 0 | AG60: 2 | AH60: 2 | AW60: =IF(RC[-3]=" ";0%;RC[-3]/COUNTIF(RC7:RC45;">=0")) -> 0 | AX60: =IF(RC[-3]=" ";0%;RC[-3]/COUNTIF(RC7:RC45;">=0")) -> 0 | AY60: =IF(RC[-3]=" ";0%;RC[-3]/COUNTIF(RC7:RC45;">=0")) -> 0 | AZ60: =IF(RC[-1]>60%;"Completo";IF(RC[-3]>RC[-2]+RC[-1];"No Cumplio";"Incompleto")) -> Incompleto
C61: IF902ACI | D61: TECNOLOGIAS DE LA INFORMACION Y LA COMUNICACIÓN | E61: 3 | F61: P | G61: 2 | H61: 2 | I61: 2 | J61: 2 | M61: 0 | O61: 0 | P61: 0 | AG61: 2 | AH61: 2 | AW61: =IF(RC[-3]=" ";0%;RC[-3]/COUNTIF(RC7:RC45;">=0")) -> 0 | AX61: =IF(RC[-3]=" ";0%;RC[-3]/COUNTIF(RC7:RC45;">=0")) -> 0 | AY61: =IF(RC[-3]=" ";0%;RC[-3]/COUNTIF(RC7:RC45;">=0")) -> 0 | AZ61: =IF(RC[-1]>60%;"Completo";IF(RC[-3]>RC[-2]+RC[-1];"No Cumplio";"Incompleto")) -> Incompleto
A62: 24 | B62: ESTHER CRISTINA PACHECO VÁSQUEZ | C62: IF470AME | D62: LENGUAJE DE PROGRAMACION | E62: 4 | F62: T | G62: 2 | H62: 2 | I62: 2 | J62: 2 | K62: 2 | L62: 2 | M62: 2 | N62: 2 | O62: 2 | P62: 2 | Q62: 2 | R62: 2 | S62: 2 | T62: 2 | U62: 2 | W62: 2 | X62: 2 | Y62: 2 | AC62: 2 | AD62: 2 | AE62: 2 | AO62: 2 | AV62: =IF(COUNTIF(RC7:RC45;2)=0;" ";COUNTIF(RC7:RC45;2)) -> 22 | AW62: =IF(RC[-3]=" ";0%;RC[-3]/COUNTIF(RC7:RC45;">=0")) -> 0 | AX62: =IF(RC[-3]=" ";0%;RC[-3]/COUNTIF(RC7:RC45;">=0")) -> 0 | AY62: =IF(RC[-3]=" ";0%;RC[-3]/COUNTIF(RC7:RC45;">=0")) -> 1 | AZ62: =IF(RC[-1]>60%;"Completo";IF(RC[-3]>RC[-2]+RC[-1];"No Cumplio";"Incompleto")) -> Completo | BA62: =IF(AND(RC[-1]=R[1]C[-1];RC[-1]=R[2]C[-1]);RC[-1];"Incompleto") -> Completo
C63: IF902BCO / IF902CEO | D63: TECNOLOGIAS DE LA INFORMACION Y LA COMUNICACIÓN | E63: 3 | F63: T / P | G63: 2 | H63: 2 | I63: 2 | J63: 2 | K63: 2 | L63: 2 | M63: 2 | N63: 2 | O63: 2 | P63: 2 | Q63: 2 | R63: 2 | S63: 2 | T63: 2 | W63: 2 | X63: 2 | AC63: 2 | AD63: 2 | AO63: 2 | AV63: =IF(COUNTIF(RC7:RC45;2)=0;" ";COUNTIF(RC7:RC45;2)) -> 19 | AW63: =IF(RC[-3]=" ";0%;RC[-3]/COUNTIF(RC7:RC45;">=0")) -> 0 | AX63: =IF(RC[-3]=" ";0%;RC[-3]/COUNTIF(RC7:RC45;">=0")) -> 0 | AY63: =IF(RC[-3]=" ";0%;RC[-3]/COUNTIF(RC7:RC45;">=0")) -> 1 | AZ63: =IF(RC[-1]>60%;"Completo";IF(RC[-3]>RC[-2]+RC[-1];"No Cumplio";"Incompleto")) -> Completo
C64: IF902BEU | D64: TECNOLOGIAS DE LA INFORMACION Y LA COMUNICACIÓN | E64: 3 | F64: T / P | G64: 2 | H64: 2 | I64: 2 | J64: 2 | K64: 2 | L64: 2 | M64: 2 | N64: 2 | O64: 2 | P64: 2 | Q64: 2 | R64: 2 | S64: 2 | T64: 2 | W64: 2 | X64: 2 | AC64: 2 | AD64: 2 | AO64: 2 | AV64: =IF(COUNTIF(RC7:RC45;2)=0;" ";COUNTIF(RC7:RC45;2)) -> 19 | AW64: =IF(RC[-3]=" ";0%;RC[-3]/COUNTIF(RC7:RC45;">=0")) -> 0 | AX64: =IF(RC[-3]=" ";0%;RC[-3]/COUNTIF(RC7:RC45;">=0")) -> 0 | AY64: =IF(RC[-3]=" ";0%;RC[-3]/COUNTIF(RC7:RC45;">=0")) -> 1 | AZ64: =IF(RC[-1]>60%;"Completo";IF(RC[-3]>RC[-2]+RC[-1];"No Cumplio";"Incompleto")) -> Completo
A65: 25 | B65: WILLIAN ZAMALLOA PARO | C65: IF616AIN | D65: DESARROLLO DE SOFTWARE II | E65: 2 | F65: P | G65: 2 | H65: 2 | I65: 2 | J65: 2 | K65: 2 | L65: 2 | M65: 2 | N65: 2 | O65: 2 | P65: 2 | Q65: 2 | R65: 2 | S65: 2 | T65: 2 | U65: 2 | V65: 2 | AC65: 2 | AD65: 2 | AE65: 2 | AO65: 2 | AV65: =IF(COUNTIF(RC7:RC45;2)=0;" ";COUNTIF(RC7:RC45;2)) -> 20 | AW65: =IF(RC[-3]=" ";0%;RC[-3]/COUNTIF(RC7:RC45;">=0")) -> 0 | AX65: =IF(RC[-3]=" ";0%;RC[-3]/COUNTIF(RC7:RC45;">=0")) -> 0 | AY65: =IF(RC[-3]=" ";0%;RC[-3]/COUNTIF(RC7:RC45;">=0")) -> 1 | AZ65: =IF(RC[-1]>60%;"Completo";IF(RC[-3]>RC[-2]+RC[-1];"No Cumplio";"Incompleto")) -> Completo | BA65: =IF(AND(RC[-1]=R[1]C[-1];RC[-1]=R[2]C[-1]);RC[-1];"Incompleto") -> Completo
C66: IF617AIN | D66: INGENIERIA DE SOFTWARE II | E66: 4 | F66: T / P | G66: 2 | H66: 2 | I66: 2 | J66: 2 | K66: 2 | L66: 2 | M66: 2 | N66: 2 | O66: 2 | P66: 2 | Q66: 2 | R66: 2 | S66: 2 | T66: 2 | U66: 2 | V66: 2 | AC66: 2 | AD66: 2 | AE66: 2 | AO66: 2 | AV66: =IF(COUNTIF(RC7:RC45;2)=0;" ";COUNTIF(RC7:RC45;2)) -> 20 | AW66: =IF(RC[-3]=" ";0%;RC[-3]/COUNTIF(RC7:RC45;">=0")) -> 0 | AX66: =IF(RC[-3]=" ";0%;RC[-3]/COUNTIF(RC7:RC45;">=0")) -> 0 | AY66: =IF(RC[-3]=" ";0%;RC[-3]/COUNTIF(RC7:RC45;">=0")) -> 1 | AZ66: =IF(RC[-1]>60%;"Completo";IF(RC[-3]>RC[-2]+RC[-1];"No Cumplio";"Incompleto")) -> Completo
C67: IF902AAQ | D67: TECNOLOGIAS DE LA INFORMACION Y LA COMUNICACION | E67: 3 | F67: T | G67: 2 | H67: 2 | I67: 2 | J67: 2 | K67: 2 | L67: 2 | M67: 2 | N67: 2 | O67: 2 | P67: 2 | Q67: 2 | R67: 2 | S67: 2 | T67: 2 | U67: 2 | V67: 2 | AC67: 2 | AD67: 2 | AE67: 2 | AO67: 2 | AV67: =IF(COUNTIF(RC7:RC45;2)=0;" ";COUNTIF(RC7:RC45;2)) -> 20 | AW67: =IF(RC[-3]=" ";0%;RC[-3]/COUNTIF(RC7:RC45;">=0")) -> 0 | AX67: =IF(RC[-3]=" ";0%;RC[-3]/COUNTIF(RC7:RC45;">=0")) -> 0 | AY67: =IF(RC[-3]=" ";0%;RC[-3]/COUNTIF(RC7:RC45;">=0")) -> 1 | AZ67: =IF(RC[-1]>60%;"Completo";IF(RC[-3]>RC[-2]+RC[-1];"No Cumplio";"Incompleto")) -> Completo
A68: 26 | B68: HARLEY VERA OLIVERA | C68: IF710BIN | D68: SEMINARIO DE INVESTIGACION I | E68: 3 | F68: T / P | G68: 2 | H68: 2 | I68: 2 | J68: 2 | K68: 2 | L68: 2 | M68: 2 | N68: 2 | AV68: =IF(COUNTIF(RC7:RC45;2)=0;" ";COUNTIF(RC7:RC45;2)) -> 8 | AW68: =IF(RC[-3]=" ";0%;RC[-3]/COUNTIF(RC7:RC45;">=0")) -> 0 | AX68: =IF(RC[-3]=" ";0%;RC[-3]/COUNTIF(RC7:RC45;">=0")) -> 0 | AY68: =IF(RC[-3]=" ";0%;RC[-3]/COUNTIF(RC7:RC45;">=0")) -> 1 | AZ68: =IF(RC[-1]>60%;"Completo";IF(RC[-3]>RC[-2]+RC[-1];"No Cumplio";"Incompleto")) -> Completo | BA68: =IF(AND(RC[-1]=RC[-1];RC[-1]=RC[-1]);RC[-1];"Incompleto") -> Completo
A69: 27 | B69: MARITZA KATHERINE IRPANOCA CUSIMAYTA | C69: IF212AEI | D69: ANALISIS NUMERICO | E69: 3 | F69: T/P | G69: 2 | H69: 2 | I69: 2 | J69: 2 | K69: 2 | L69: 2 | M69: 2 | N69: 2 | P69: 2 | Q69: 2 | AV69: =IF(COUNTIF(RC7:RC45;2)=0;" ";COUNTIF(RC7:RC45;2)) -> 10 | AW69: =IF(RC[-3]=" ";0%;RC[-3]/COUNTIF(RC7:RC45;">=0")) -> 0 | AX69: =IF(RC[-3]=" ";0%;RC[-3]/COUNTIF(RC7:RC45;">=0")) -> 0 | AY69: =IF(RC[-3]=" ";0%;RC[-3]/COUNTIF(RC7:RC45;">=0")) -> 1 | AZ69: =IF(RC[-1]>60%;"Completo";IF(RC[-3]>RC[-2]+RC[-1];"No Cumplio";"Incompleto")) -> Completo | BA69: =IF(AND(RC[-1]=R[1]C[-1];RC[-1]=R[2]C[-1]);RC[-1];"Incompleto") -> Completo
C70: IF471AME | D70: METODOS NUMERICOS | E70: 3 | F70: T | G70: 2 | H70: 2 | I70: 2 | J70: 2 | K70: 2 | L70: 2 | M70: 2 | N70: 2 | P70: 2 | Q70: 2 | AV70: =IF(COUNTIF(RC7:RC45;2)=0;" ";COUNTIF(RC7:RC45;2)) -> 10 | AW70: =IF(RC[-3]=" ";0%;RC[-3]/COUNTIF(RC7:RC45;">=0")) -> 0 | AX70: =IF(RC[-3]=" ";0%;RC[-3]/COUNTIF(RC7:RC45;">=0")) -> 0 | AY70: =IF(RC[-3]=" ";0%;RC[-3]/COUNTIF(RC7:RC45;">=0")) -> 1 | AZ70: =IF(RC[-1]>60%;"Completo";IF(RC[-3]>RC[-2]+RC[-1];"No Cumplio";"Incompleto")) -> Completo
C71: IF902ABI | D71: TECNOLOGIAS DE LA INFORMACION Y LA COMUNICACIÓN | E71: 3 | F71: P | G71: 2 | H71: 2 | I71: 2 | J71: 2 | K71: 2 | L71: 2 | M71: 2 | N71: 2 | P71: 2 | Q71: 2 | AV71: =IF(COUNTIF(RC7:RC45;2)=0;" ";COUNTIF(RC7:RC45;2)) -> 10 | AW71: =IF(RC[-3]=" ";0%;RC[-3]/COUNTIF(RC7:RC45;">=0")) -> 0 | AX71: =IF(RC[-3]=" ";0%;RC[-3]/COUNTIF(RC7:RC45;">=0")) -> 0 | AY71: =IF(RC[-3]=" ";0%;RC[-3]/COUNTIF(RC7:RC45;">=0")) -> 1 | AZ71: =IF(RC[-1]>60%;"Completo";IF(RC[-3]>RC[-2]+RC[-1];"No Cumplio";"Incompleto")) -> Completo
C72: IF902BBI / IF902AMC | D72: TECNOLOGIAS DE LA INFORMACION Y LA COMUNICACIÓN | E72: 3 | F72: P | G72: 2 | H72: 2 | I72: 2 | J72: 2 | AW72: =IF(RC[-3]=" ";0%;RC[-3]/COUNTIF(RC7:RC45;">=0")) -> 0 | AX72: =IF(RC[-3]=" ";0%;RC[-3]/COUNTIF(RC7:RC45;">=0")) -> 0 | AY72: =IF(RC[-3]=" ";0%;RC[-3]/COUNTIF(RC7:RC45;">=0")) -> 0 | AZ72: =IF(RC[-1]>60%;"Completo";IF(RC[-3]>RC[-2]+RC[-1];"No Cumplio";"Incompleto")) -> Incompleto
C73: IF902AMI / IF902AQM | D73: TECNOLOGIAS DE LA INFORMACION Y LA COMUNICACIÓN | E73: 3 | F73: T | G73: 2 | H73: 2 | I73: 2 | J73: 2 | K73: 2 | L73: 2 | M73: 2 | N73: 2 | P73: 2 | Q73: 2 | AW73: =IF(RC[-3]=" ";0%;RC[-3]/COUNTIF(RC7:RC45;">=0")) -> 0 | AX73: =IF(RC[-3]=" ";0%;RC[-3]/COUNTIF(RC7:RC45;">=0")) -> 0 | AY73: =IF(RC[-3]=" ";0%;RC[-3]/COUNTIF(RC7:RC45;">=0")) -> 0 | AZ73: =IF(RC[-1]>60%;"Completo";IF(RC[-3]>RC[-2]+RC[-1];"No Cumplio";"Incompleto")) -> Incompleto
A74: 28 | B74: EFRAINA GLADYS CUTIPA ARAPA | C74: IF451AIN | D74: PROGRAMACION I | E74: 2 | F74: P | G74: 2 | H74: 2 | I74: 2 | J74: 2 | K74: 2 | M74: 2 | N74: 2 | O74: 2 | Q74: 2 | W74: 2 | X74: 2 | AC74: 2 | AD74: 2 | AO74: 2 | AV74: =IF(COUNTIF(RC7:RC45;2)=0;" ";COUNTIF(RC7:RC45;2)) -> 14 | AW74: =IF(RC[-3]=" ";0%;RC[-3]/COUNTIF(RC7:RC45;">=0")) -> 0 | AX74: =IF(RC[-3]=" ";0%;RC[-3]/COUNTIF(RC7:RC45;">=0")) -> 0 | AY74: =IF(RC[-3]=" ";0%;RC[-3]/COUNTIF(RC7:RC45;">=0")) -> 1 | AZ74: =IF(RC[-1]>60%;"Completo";IF(RC[-3]>RC[-2]+RC[-1];"No Cumplio";"Incompleto")) -> Completo | BA74: =IF(AND(RC[-1]=R[1]C[-1];RC[-1]=R[2]C[-1]);RC[-1];"Incompleto") -> Completo
C75: IF552AIN | D75: REDES DE COMPUTADORAS I | E75: 4 | F75: T / P | G75: 2 | H75: 2 | I75: 2 | J75: 2 | K75: 2 | L75: 2 | M75: 2 | N75: 2 | O75: 2 | Q75: 2 | W75: 2 | X75: 2 | Y75: 2 | AC75: 2 | AD75: 2 | AE75: 2 | AO75: 2 | AV75: =IF(COUNTIF(RC7:RC45;2)=0;" ";COUNTIF(RC7:RC45;2)) -> 17 | AW75: =IF(RC[-3]=" ";0%;RC[-3]/COUNTIF(RC7:RC45;">=0")) -> 0 | AX75: =IF(RC[-3]=" ";0%;RC[-3]/COUNTIF(RC7:RC45;">=0")) -> 0 | AY75: =IF(RC[-3]=" ";0%;RC[-3]/COUNTIF(RC7:RC45;">=0")) -> 1 | AZ75: =IF(RC[-1]>60%;"Completo";IF(RC[-3]>RC[-2]+RC[-1];"No Cumplio";"Incompleto")) -> Completo
C76: IF902AFI / IF902AME | D76: TECNOLOGIAS DE LA INFORMACION Y LA COMUNICACIÓN | E76: 3 | F76: T | G76: 2 | H76: 2 | I76: 2 | J76: 2 | K76: 2 | M76: 2 | N76: 2 | O76: 2 | Q76: 2 | W76: 2 | X76: 2 | AC76: 2 | AD76: 2 | AO76: 2 | AV76: =IF(COUNTIF(RC7:RC45;2)=0;" ";COUNTIF(RC7:RC45;2)) -> 14 | AW76: =IF(RC[-3]=" ";0%;RC[-3]/COUNTIF(RC7:RC45;">=0")) -> 0 | AX76: =IF(RC[-3]=" ";0%;RC[-3]/COUNTIF(RC7:RC45;">=0")) -> 0 | AY76: =IF(RC[-3]=" ";0%;RC[-3]/COUNTIF(RC7:RC45;">=0")) -> 1 | AZ76: =IF(RC[-1]>60%;"Completo";IF(RC[-3]>RC[-2]+RC[-1];"No Cumplio";"Incompleto")) -> Completo
A77: 29 | B77: DARIO FRANCISCO DUEÑAS BUSTINZA | C77: IF480BIN | D77: ADMINISTRACION DE TECNOLOGÍAS DE LA INFORMACIÓN | E77: 3 | F77: T/P | G77: 2 | H77: 2 | I77: 2 | J77: 2 | K77: 2 | L77: 2 | M77: 2 | N77: 2 | Q77: 2 | R77: 2 | S77: 2 | T77: 2 | W77: 2 | X77: 2 | AC77: 2 | AD77: 2 | AV77: =IF(COUNTIF(RC7:RC45;2)=0;" ";COUNTIF(RC7:RC45;2)) -> 16 | AW77: =IF(RC[-3]=" ";0%;RC[-3]/COUNTIF(RC7:RC45;">=0")) -> 0 | AX77: =IF(RC[-3]=" ";0%;RC[-3]/COUNTIF(RC7:RC45;">=0")) -> 0 | AY77: =IF(RC[-3]=" ";0%;RC[-3]/COUNTIF(RC7:RC45;">=0")) -> 1 | AZ77: =IF(RC[-1]>60%;"Completo";IF(RC[-3]>RC[-2]+RC[-1];"No Cumplio";"Incompleto")) -> Completo | BA77: =IF(AND(RC[-1]=R[1]C[-1];RC[-1]=R[2]C[-1]);RC[-1];"Incompleto") -> Completo
C78: IF481AIN | D78: INGENIERIA ECONOMICA | E78: 3 | F78: P | G78: 2 | H78: 2 | I78: 2 | J78: 2 | K78: 2 | L78: 2 | M78: 2 | N78: 2 | Q78: 2 | R78: 2 | S78: 2 | T78: 2 | W78: 2 | X78: 2 | AC78: 2 | AD78: 2 | AV78: =IF(COUNTIF(RC7:RC45;2)=0;" ";COUNTIF(RC7:RC45;2)) -> 16 | AW78: =IF(RC[-3]=" ";0%;RC[-3]/COUNTIF(RC7:RC45;">=0")) -> 0 | AX78: =IF(RC[-3]=" ";0%;RC[-3]/COUNTIF(RC7:RC45;">=0")) -> 0 | AY78: =IF(RC[-3]=" ";0%;RC[-3]/COUNTIF(RC7:RC45;">=0")) -> 1 | AZ78: =IF(RC[-1]>60%;"Completo";IF(RC[-3]>RC[-2]+RC[-1];"No Cumplio";"Incompleto")) -> Completo
C79: IF902BBI / IF902AMC | D79: TECNOLOGIAS DE LA INFORMACION Y LA COMUNICACIÓN | E79: 3 | F79: T | G79: 2 | H79: 2 | I79: 2 | J79: 2 | K79: 2 | L79: 2 | M79: 2 | N79: 2 | Q79: 2 | R79: 2 | S79: 2 | T79: 2 | W79: 2 | X79: 2 | AC79: 2 | AD79: 2 | AV79: =IF(COUNTIF(RC7:RC45;2)=0;" ";COUNTIF(RC7:RC45;2)) -> 16 | AW79: =IF(RC[-3]=" ";0%;RC[-3]/COUNTIF(RC7:RC45;">=0")) -> 0 | AX79: =IF(RC[-3]=" ";0%;RC[-3]/COUNTIF(RC7:RC45;">=0")) -> 0 | AY79: =IF(RC[-3]=" ";0%;RC[-3]/COUNTIF(RC7:RC45;">=0")) -> 1 | AZ79: =IF(RC[-1]>60%;"Completo";IF(RC[-3]>RC[-2]+RC[-1];"No Cumplio";"Incompleto")) -> Completo
C80: IF902AGI / IF902APQ | D80: TECNOLOGIAS DE LA INFORMACION Y LA COMUNICACIÓN | E80: 3 | F80: T | G80: 2 | H80: 2 | I80: 2 | J80: 2 | K80: 2 | L80: 2 | M80: 2 | N80: 2 | Q80: 2 | R80: 2 | S80: 2 | T80: 2 | W80: 2 | X80: 2 | AC80: 2 | AD80: 2 | AW80: =IF(RC[-3]=" ";0%;RC[-3]/COUNTIF(RC7:RC45;">=0")) -> 0 | AX80: =IF(RC[-3]=" ";0%;RC[-3]/COUNTIF(RC7:RC45;">=0")) -> 0 | AY80: =IF(RC[-3]=" ";0%;RC[-3]/COUNTIF(RC7:RC45;">=0")) -> 0 | AZ80: =IF(RC[-1]>60%;"Completo";IF(RC[-3]>RC[-2]+RC[-1];"No Cumplio";"Incompleto")) -> Incompleto
A81: 30 | B81: DORIS SABINA AGUIRRE CARBAJAL | C81: IF459BIN | D81: COMPUTACION GRAFICA II | E81: 4 | F81: P | G81: 2 | H81: 2 | I81: 2 | J81: 2 | K81: 2 | L81: 2 | M81: 2 | N81: 2 | AV81: =IF(COUNTIF(RC7:RC45;2)=0;" ";COUNTIF(RC7:RC45;2)) -> 8 | AW81: =IF(RC[-3]=" ";0%;RC[-3]/COUNTIF(RC7:RC45;">=0")) -> 0 | AX81: =IF(RC[-3]=" ";0%;RC[-3]/COUNTIF(RC7:RC45;">=0")) -> 0 | AY81: =IF(RC[-3]=" ";0%;RC[-3]/COUNTIF(RC7:RC45;">=0")) -> 1 | AZ81: =IF(RC[-1]>60%;"Completo";IF(RC[-3]>RC[-2]+RC[-1];"No Cumplio";"Incompleto")) -> Completo | BA81: =IF(AND(RC[-1]=R[1]C[-1];RC[-1]=R[2]C[-1]);RC[-1];"Incompleto") -> Completo
C82: IF902ACO | D82: TECNOLOGIAS DE LA INFORMACION Y LA COMUNICACIÓN | E82: 3 | F82: T | G82: 2 | H82: 2 | I82: 2 | J82: 2 | K82: 2 | L82: 2 | M82: 2 | N82: 2 | O82: 2 | P82: 2 | Q82: 2 | R82: 2 | S82: 2 | T82: 2 | W82: 2 | X82: 2 | Z82: 2 | AA82: 2 | AC82: 2 | AD82: 2 | AV82: =IF(COUNTIF(RC7:RC45;2)=0;" ";COUNTIF(RC7:RC45;2)) -> 20 | AW82: =IF(RC[-3]=" ";0%;RC[-3]/COUNTIF(RC7:RC45;">=0")) -> 0 | AX82: =IF(RC[-3]=" ";0%;RC[-3]/COUNTIF(RC7:RC45;">=0")) -> 0 | AY82: =IF(RC[-3]=" ";0%;RC[-3]/COUNTIF(RC7:RC45;">=0")) -> 1 | AZ82: =IF(RC[-1]>60%;"Completo";IF(RC[-3]>RC[-2]+RC[-1];"No Cumplio";"Incompleto")) -> Completo
C83: IF902DEU | D83: TECNOLOGIAS DE LA INFORMACION Y LA COMUNICACIÓN | E83: 3 | F83: T | G83: 2 | H83: 2 | I83: 2 | J83: 2 | K83: 2 | L83: 2 | M83: 2 | N83: 2 | O83: 2 | P83: 2 | Q83: 2 | R83: 2 | S83: 2 | T83: 2 | W83: 2 | X83: 2 | Z83: 2 | AA83: 2 | AC83: 2 | AD83: 2 | AV83: =IF(COUNTIF(RC7:RC45;2)=0;" ";COUNTIF(RC7:RC45;2)) -> 20 | AW83: =IF(RC[-3]=" ";0%;RC[-3]/COUNTIF(RC7:RC45;">=0")) -> 0 | AX83: =IF(RC[-3]=" ";0%;RC[-3]/COUNTIF(RC7:RC45;">=0")) -> 0 | AY83: =IF(RC[-3]=" ";0%;RC[-3]/COUNTIF(RC7:RC45;">=0")) -> 1 | AZ83: =IF(RC[-1]>60%;"Completo";IF(RC[-3]>RC[-2]+RC[-1];"No Cumplio";"Incompleto")) -> Completo
C84: IF902AEN | D84: TECNOLOGIAS DE LA INFORMACION Y LA COMUNICACIÓN | E84: 3 | F84: T | G84: 2 | H84: 2 | I84: 2 | J84: 2 | K84: 2 | L84: 2 | M84: 2 | N84: 2 | O84: 2 | P84: 2 | Q84: 2 | R84: 2 | S84: 2 | T84: 2 | W84: 2 | X84: 2 | Z84: 2 | AA84: 2 | AC84: 2 | AD84: 2 | AV84: =IF(COUNTIF(RC7:RC45;2)=0;" ";COUNTIF(RC7:RC45;2)) -> 20 | AW84: =IF(RC[-3]=" ";0%;RC[-3]/COUNTIF(RC7:RC45;">=0")) -> 0 | AX84: =IF(RC[-3]=" ";0%;RC[-3]/COUNTIF(RC7:RC45;">=0")) -> 0 | AY84: =IF(RC[-3]=" ";0%;RC[-3]/COUNTIF(RC7:RC45;">=0")) -> 1 | AZ84: =IF(RC[-1]>60%;"Completo";IF(RC[-3]>RC[-2]+RC[-1];"No Cumplio";"Incompleto")) -> Completo
C85: IF902AFI / IF902AME | D85: TECNOLOGIAS DE LA INFORMACION Y LA COMUNICACIÓN | E85: 3 | F85: P | G85: 2 | H85: 2 | I85: 2 | J85: 2 | K85: 2 | L85: 2 | M85: 2 | N85: 2 | AV85: =IF(COUNTIF(RC7:RC45;2)=0;" ";COUNTIF(RC7:RC45;2)) -> 8 | AW85: =IF(RC[-3]=" ";0%;RC[-3]/COUNTIF(RC7:RC45;">=0")) -> 0 | AX85: =IF(RC[-3]=" ";0%;RC[-3]/COUNTIF(RC7:RC45;">=0")) -> 0 | AY85: =IF(RC[-3]=" ";0%;RC[-3]/COUNTIF(RC7:RC45;">=0")) -> 1 | AZ85: =IF(RC[-1]>60%;"Completo";IF(RC[-3]>RC[-2]+RC[-1];"No Cumplio";"Incompleto")) -> Completo
A86: 31 | B86: TANY VILLALBA VILLALBA | C86: IF556AIN | D86: SISTEMAS EMBEBIDOS | E86: 4 | F86: T / P | AV86: =IF(COUNTIF(RC7:RC45;2)=0;" ";COUNTIF(RC7:RC45;2)) ->  | AW86: =IF(RC[-3]=" ";0%;RC[-3]/COUNTIF(RC7:RC45;">=0")) -> #DIV/0! | AX86: =IF(RC[-3]=" ";0%;RC[-3]/COUNTIF(RC7:RC45;">=0")) -> #DIV/0! | AY86: =IF(RC[-3]=" ";0%;RC[-3]/COUNTIF(RC7:RC45;">=0")) -> 0 | AZ86: =IF(RC[-1]>60%;"Completo";IF(RC[-3]>RC[-2]+RC[-1];"No Cumplio";"Incompleto")) -> #DIV/0! | BA86: =IF(RC[-1]=R[1]C[-1];RC[-1];"Incompleto") -> #DIV/0!
C87: IF902BAE / IF902BEO | D87: TECNOLOGIAS DE LA INFORMACION Y LA COMUNICACIÓN | E87: 3 | F87: T | AV87: =IF(COUNTIF(RC7:RC45;2)=0;" ";COUNTIF(RC7:RC45;2)) ->  | AW87: =IF(RC[-3]=" ";0%;RC[-3]/COUNTIF(RC7:RC45;">=0")) -> #DIV/0! | AX87: =IF(RC[-3]=" ";0%;RC[-3]/COUNTIF(RC7:RC45;">=0")) -> #DIV/0! | AY87: =IF(RC[-3]=" ";0%;RC[-3]/COUNTIF(RC7:RC45;">=0")) -> 0 | AZ87: =IF(RC[-1]>60%;"Completo";IF(RC[-3]>RC[-2]+RC[-1];"No Cumplio";"Incompleto")) -> #DIV/0!
C88: IF902BEN / IF902AQF | D88: TECNOLOGIAS DE LA INFORMACION Y LA COMUNICACIÓN | E88: 3 | F88: T / P | AW88: =IF(RC[-3]=" ";0%;RC[-3]/COUNTIF(RC7:RC45;">=0")) -> #DIV/0! | AX88: =IF(RC[-3]=" ";0%;RC[-3]/COUNTIF(RC7:RC45;">=0")) -> #DIV/0! | AY88: =IF(RC[-3]=" ";0%;RC[-3]/COUNTIF(RC7:RC45;">=0")) -> #DIV/0! | AZ88: =IF(RC[-1]>60%;"Completo";IF(RC[-3]>RC[-2]+RC[-1];"No Cumplio";"Incompleto")) -> #DIV/0!
A89: 32 | B89: CARLOS FERNANDO MONTOYA CUBAS | C89: IF453CIN | D89: PROGRAMACION II | E89: 2 | F89: P | G89: 2 | H89: 2 | I89: 2 | J89: 2 | K89: 2 | L89: 2 | M89: 2 | N89: 2 | O89: 2 | P89: 2 | Q89: 2 | R89: 2 | S89: 2 | T89: 2 | V89: 2 | W89: 2 | X89: 2 | AC89: 2 | AD89: 2 | AF89: 2 | AO89: 2 | AV89: =IF(COUNTIF(RC7:RC45;2)=0;" ";COUNTIF(RC7:RC45;2)) -> 21 | AW89: =IF(RC[-3]=" ";0%;RC[-3]/COUNTIF(RC7:RC45;">=0")) -> 0 | AX89: =IF(RC[-3]=" ";0%;RC[-3]/COUNTIF(RC7:RC45;">=0")) -> 0 | AY89: =IF(RC[-3]=" ";0%;RC[-3]/COUNTIF(RC7:RC45;">=0")) -> 1 | AZ89: =IF(RC[-1]>60%;"Completo";IF(RC[-3]>RC[-2]+RC[-1];"No Cumplio";"Incompleto")) -> Completo | BA89: =IF(AND(RC[-1]=R[1]C[-1];R[2]C[-1]=R[3]C[-1];R[1]C[-1]=R[2]C[-1]);RC[-1];"Incompleto") -> Completo
C90: IF466AIN | D90: COMPILADORES | E90: 3 | F90: T | G90: 2 | H90: 2 | I90: 2 | J90: 2 | K90: 2 | L90: 2 | M90: 2 | N90: 2 | O90: 2 | P90: 2 | Q90: 2 | R90: 2 | S90: 2 | T90: 2 | V90: 2 | W90: 2 | X90: 2 | AC90: 2 | AD90: 2 | AF90: 2 | AO90: 2 | AV90: =IF(COUNTIF(RC7:RC45;2)=0;" ";COUNTIF(RC7:RC45;2)) -> 21 | AW90: =IF(RC[-3]=" ";0%;RC[-3]/COUNTIF(RC7:RC45;">=0")) -> 0 | AX90: =IF(RC[-3]=" ";0%;RC[-3]/COUNTIF(RC7:RC45;">=0")) -> 0 | AY90: =IF(RC[-3]=" ";0%;RC[-3]/COUNTIF(RC7:RC45;">=0")) -> 1 | AZ90: =IF(RC[-1]>60%;"Completo";IF(RC[-3]>RC[-2]+RC[-1];"No Cumplio";"Incompleto")) -> Completo
C91: IF650BIN | D91: MODELOS PROBABILISTICOS | E91: 4 | F91: T / P | G91: 2 | H91: 2 | I91: 2 | J91: 2 | K91: 2 | L91: 2 | M91: 2 | N91: 2 | O91: 2 | P91: 2 | Q91: 2 | R91: 2 | S91: 2 | T91: 2 | U91: 2 | W91: 2 | X91: 2 | Y91: 2 | AC91: 2 | AD91: 2 | AE91: 2 | AO91: 2 | AV91: =IF(COUNTIF(RC7:RC45;2)=0;" ";COUNTIF(RC7:RC45;2)) -> 22 | AW91: =IF(RC[-3]=" ";0%;RC[-3]/COUNTIF(RC7:RC45;">=0")) -> 0 | AX91: =IF(RC[-3]=" ";0%;RC[-3]/COUNTIF(RC7:RC45;">=0")) -> 0 | AY91: =IF(RC[-3]=" ";0%;RC[-3]/COUNTIF(RC7:RC45;">=0")) -> 1 | AZ91: =IF(RC[-1]>60%;"Completo";IF(RC[-3]>RC[-2]+RC[-1];"No Cumplio";"Incompleto")) -> Completo
C92: IF651BIN | D92: INTELIGENCIA ARTIFICIAL | E92: 4 | F92: T / P | G92: 2 | H92: 2 | I92: 2 | J92: 2 | K92: 2 | L92: 2 | M92: 2 | N92: 2 | O92: 2 | P92: 2 | Q92: 2 | R92: 2 | S92: 2 | T92: 2 | U92: 2 | W92: 2 | X92: 2 | Y92: 2 | AC92: 2 | AD92: 2 | AE92: 2 | AO92: 2 | AV92: =IF(COUNTIF(RC7:RC45;2)=0;" ";COUNTIF(RC7:RC45;2)) -> 22 | AW92: =IF(RC[-3]=" ";0%;RC[-3]/COUNTIF(RC7:RC45;">=0")) -> 0 | AX92: =IF(RC[-3]=" ";0%;RC[-3]/COUNTIF(RC7:RC45;">=0")) -> 0 | AY92: =IF(RC[-3]=" ";0%;RC[-3]/COUNTIF(RC7:RC45;">=0")) -> 1 | AZ92: =IF(RC[-1]>60%;"Completo";IF(RC[-3]>RC[-2]+RC[-1];"No Cumplio";"Incompleto")) -> Completo
A93: 33 | B93: CARLOS RAMÓN QUISPE ONOFRE | C93: IF401AMI | D93: PROGRAMACION DIGITAL | E93: 2 | F93: T / P | G93: 2 | H93: 2 | I93: 2 | J93: 2 | K93: 2 | L93: 2 | M93: 2 | N93: 2 | O93: 2 | P93: 2 | Q93: 2 | S93: 2 | T93: 2 | W93: 2 | X93: 2 | Z93: 2 | AA93: 2 | AC93: 2 | AD93: 2 | AG93: 2 | AH93: 2 | AO93: 2 | AV93: =IF(COUNTIF(RC7:RC45;2)=0;" ";COUNTIF(RC7:RC45;2)) -> 22 | AW93: =IF(RC[-3]=" ";0%;RC[-3]/COUNTIF(RC7:RC45;">=0")) -> 0 | AX93: =IF(RC[-3]=" ";0%;RC[-3]/COUNTIF(RC7:RC45;">=0")) -> 0 | AY93: =IF(RC[-3]=" ";0%;RC[-3]/COUNTIF(RC7:RC45;">=0")) -> 1 | AZ93: =IF(RC[-1]>60%;"Completo";IF(RC[-3]>RC[-2]+RC[-1];"No Cumplio";"Incompleto")) -> Completo | BA93: =IF(AND(RC[-1]=R[1]C[-1];R[2]C[-1]=R[3]C[-1];R[1]C[-1]=R[2]C[-1]);RC[-1];"Incompleto") -> Completo
C94: IF669BIN | D94: MODELADO Y SIMULACION | E94: 4 | F94: T / P | G94: 2 | H94: 2 | I94: 2 | J94: 2 | K94: 2 | L94: 2 | M94: 2 | N94: 2 | O94: 2 | P94: 2 | Q94: 2 | S94: 2 | T94: 2 | U94: 2 | W94: 2 | X94: 2 | Y94: 2 | Z94: 2 | AA94: 2 | AB94: 2 | AC94: 2 | AD94: 2 | AE94: 2 | AO94: 2 | AV94: =IF(COUNTIF(RC7:RC45;2)=0;" ";COUNTIF(RC7:RC45;2)) -> 24 | AW94: =IF(RC[-3]=" ";0%;RC[-3]/COUNTIF(RC7:RC45;">=0")) -> 0 | AX94: =IF(RC[-3]=" ";0%;RC[-3]/COUNTIF(RC7:RC45;">=0")) -> 0 | AY94: =IF(RC[-3]=" ";0%;RC[-3]/COUNTIF(RC7:RC45;">=0")) -> 1 | AZ94: =IF(RC[-1]>60%;"Completo";IF(RC[-3]>RC[-2]+RC[-1];"No Cumplio";"Incompleto")) -> Completo
C95: IF902ABI | D95: TECNOLOGIAS DE LA INFORMACION Y LA COMUNICACIÓN | E95: 3 | F95: P | G95: 2 | H95: 2 | I95: 2 | J95: 2 | L95: 2 | M95: 2 | O95: 2 | P95: 2 | AG95: 2 | AH95: 2 | AV95: =IF(COUNTIF(RC7:RC45;2)=0;" ";COUNTIF(RC7:RC45;2)) -> 10 | AW95: =IF(RC[-3]=" ";0%;RC[-3]/COUNTIF(RC7:RC45;">=0")) -> 0 | AX95: =IF(RC[-3]=" ";0%;RC[-3]/COUNTIF(RC7:RC45;">=0")) -> 0 | AY95: =IF(RC[-3]=" ";0%;RC[-3]/COUNTIF(RC7:RC45;">=0")) -> 1 | AZ95: =IF(RC[-1]>60%;"Completo";IF(RC[-3]>RC[-2]+RC[-1];"No Cumplio";"Incompleto")) -> Completo
C96: IF902AEE | D96: TECNOLOGIAS DE LA INFORMACION Y LA COMUNICACIÓN | E96: 3 | F96: T | G96: 2 | H96: 2 | I96: 2 | J96: 2 | K96: 2 | L96: 2 | M96: 2 | N96: 2 | O96: 2 | P96: 2 | Q96: 2 | S96: 2 | T96: 2 | W96: 2 | X96: 2 | Z96: 2 | AA96: 2 | AC96: 2 | AD96: 2 | AO96: 2 | AV96: =IF(COUNTIF(RC7:RC45;2)=0;" ";COUNTIF(RC7:RC45;2)) -> 20 | AW96: =IF(RC[-3]=" ";0%;RC[-3]/COUNTIF(RC7:RC45;">=0")) -> 0 | AX96: =IF(RC[-3]=" ";0%;RC[-3]/COUNTIF(RC7:RC45;">=0")) -> 0 | AY96: =IF(RC[-3]=" ";0%;RC[-3]/COUNTIF(RC7:RC45;">=0")) -> 1 | AZ96: =IF(RC[-1]>60%;"Completo";IF(RC[-3]>RC[-2]+RC[-1];"No Cumplio";"Incompleto")) -> Completo
C97: IF902AHI | D97: TECNOLOGIAS DE LA INFORMACION Y LA COMUNICACIÓN | E97: 3 | F97: T/P | G97: 2 | H97: 2 | I97: 2 | J97: 2 | K97: 2 | L97: 2 | M97: 2 | N97: 2 | O97: 2 | P97: 2 | Q97: 2 | S97: 2 | T97: 2 | W97: 2 | X97: 2 | Z97: 2 | AA97: 2 | AC97: 2 | AD97: 2 | AO97: 2 | AV97: =IF(COUNTIF(RC7:RC45;2)=0;" ";COUNTIF(RC7:RC45;2)) -> 20 | AW97: =IF(RC[-3]=" ";0%;RC[-3]/COUNTIF(RC7:RC45;">=0")) -> 0 | AX97: =IF(RC[-3]=" ";0%;RC[-3]/COUNTIF(RC7:RC45;">=0")) -> 0 | AY97: =IF(RC[-3]=" ";0%;RC[-3]/COUNTIF(RC7:RC45;">=0")) -> 1 | AZ97: =IF(RC[-1]>60%;"Completo";IF(RC[-3]>RC[-2]+RC[-1];"No Cumplio";"Incompleto")) -> Completo
A98: 34 | B98: BORIS CHULLO LLAVE | C98: IF453BIN | D98: PROGRAMACION II | E98: 2 | F98: P | G98: 2 | H98: 2 | I98: 2 | J98: 2 | L98: 2 | N98: 2 | O98: 2 | P98: 2 | S98: 2 | T98: 2 | W98: 2 | X98: 2 | Z98: 2 | AA98: 2 | AC98: 2 | AD98: 2 | AG98: 2 | AH98: 2 | AP98: 2 | AV98: =IF(COUNTIF(RC7:RC45;2)=0;" ";COUNTIF(RC7:RC45;2)) -> 19 | AW98: =IF(RC[-3]=" ";0%;RC[-3]/COUNTIF(RC7:RC45;">=0")) -> 0 | AX98: =IF(RC[-3]=" ";0%;RC[-3]/COUNTIF(RC7:RC45;">=0")) -> 0 | AY98: =IF(RC[-3]=" ";0%;RC[-3]/COUNTIF(RC7:RC45;">=0")) -> 1 | AZ98: =IF(RC[-1]>60%;"Completo";IF(AND(RC[-3]>RC[-2]+RC[-1];RC[-1]<20%);"No Cumplio";"Incompleto")) -> Completo | BA98: =IF(AND(RC[-1]=R[1]C[-1];R[2]C[-1]=R[3]C[-1];R[1]C[-1]=R[2]C[-1]);RC[-1];"Incompleto") -> Completo
C99: IF455AIN | D99: ALGORITMOS PARALELOS Y DISTRIBUIDOS | E99: 4 | F99: T / P | G99: 2 | H99: 2 | I99: 2 | J99: 2 | K99: 2 | L99: 2 | N99: 2 | O99: 2 | P99: 2 | Q99: 2 | S99: 2 | T99: 2 | U99: 2 | W99: 2 | X99: 2 | Y99: 2 | Z99: 2 | AA99: 2 | AB99: 2 | AC99: 2 | AD99: 2 | AE99: 2 | AG99: 2 | AP99: 2 | AV99: =IF(COUNTIF(RC7:RC45;2)=0;" ";COUNTIF(RC7:RC45;2)) -> 24 | AW99: =IF(RC[-3]=" ";0%;RC[-3]/COUNTIF(RC7:RC45;">=0")) -> 0 | AX99: =IF(RC[-3]=" ";0%;RC[-3]/COUNTIF(RC7:RC45;">=0")) -> 0 | AY99: =IF(RC[-3]=" ";0%;RC[-3]/COUNTIF(RC7:RC45;">=0")) -> 1 | AZ99: =IF(RC[-1]>60%;"Completo";IF(AND(RC[-3]>RC[-2]+RC[-1];RC[-1]<20%);"No Cumplio";"Incompleto")) -> Completo
C100: IF467BIN | D100: ANALISIS Y DISEÑO DE ALGORITMOS | E100: 3 | F100: T / P | G100: 2 | H100: 2 | I100: 2 | J100: 2 | K100: 2 | L100: 2 | N100: 2 | O100: 2 | P100: 2 | Q100: 2 | S100: 2 | T100: 2 | W100: 2 | X100: 2 | Z100: 2 | AA100: 2 | AC100: 2 | AD100: 2 | AG100: 2 | AP100: 2 | AV100: =IF(COUNTIF(RC7:RC45;2)=0;" ";COUNTIF(RC7:RC45;2)) -> 20 | AW100: =IF(RC[-3]=" ";0%;RC[-3]/COUNTIF(RC7:RC45;">=0")) -> 0 | AX100: =IF(RC[-3]=" ";0%;RC[-3]/COUNTIF(RC7:RC45;">=0")) -> 0 | AY100: =IF(RC[-3]=" ";0%;RC[-3]/COUNTIF(RC7:RC45;">=0")) -> 1 | AZ100: =IF(RC[-1]>60%;"Completo";IF(AND(RC[-3]>RC[-2]+RC[-1];RC[-1]<20%);"No Cumplio";"Incompleto")) -> Completo
C101: IF902AAO / IF902AZO | D101: TECNOLOGIAS DE LA INFORMACION Y LA COMUNICACIÓN | E101: 3 | F101: P | G101: 2 | H101: 2 | I101: 2 | J101: 2 | AV101: =IF(COUNTIF(RC7:RC45;2)=0;" ";COUNTIF(RC7:RC45;2)) -> 4 | AW101: =IF(RC[-3]=" ";0%;RC[-3]/COUNTIF(RC7:RC45;">=0")) -> 0 | AX101: =IF(RC[-3]=" ";0%;RC[-3]/COUNTIF(RC7:RC45;">=0")) -> 0 | AY101: =IF(RC[-3]=" ";0%;RC[-3]/COUNTIF(RC7:RC45;">=0")) -> 1 | AZ101: =IF(RC[-1]>60%;"Completo";IF(AND(RC[-3]>RC[-2]+RC[-1];RC[-1]<20%);"No Cumplio";"Incompleto")) -> Completo
C102: IF902ADR | D102: TECNOLOGIAS DE LA INFORMACION Y LA COMUNICACIÓN | E102: 3 | F102: P | G102: 2 | H102: 2 | I102: 2 | J102: 2 | L102: 2 | M102: 2 | P102: 2 | AG102: 2 | AH102: 2 | AW102: =IF(RC[-3]=" ";0%;RC[-3]/COUNTIF(RC7:RC45;">=0")) -> 0 | AX102: =IF(RC[-3]=" ";0%;RC[-3]/COUNTIF(RC7:RC45;">=0")) -> 0 | AY102: =IF(RC[-3]=" ";0%;RC[-3]/COUNTIF(RC7:RC45;">=0")) -> 0 | AZ102: =IF(RC[-1]>60%;"Completo";IF(AND(RC[-3]>RC[-2]+RC[-1];RC[-1]<20%);"No Cumplio";"Incompleto")) -> Incompleto
A103: 35 | B103: RAY DUEÑAS JIMÉNEZ | C103: IF109ALI | D103: PROGRAMACION DIGITAL II | E103: 3 | F103: T / P | G103: 2 | H103: 2 | I103: 2 | J103: 2 | K103: 2 | L103: 2 | M103: 2 | N103: 2 | O103: 2 | P103: 2 | Q103: 2 | R103: 2 | S103: 2 | T103: 2 | W103: 2 | X103: 2 | Z103: 2 | AA103: 2 | AC103: 2 | AD103: 2 | AG103: 2 | AH103: 2 | AO103: 2 | AP103: 2 | AQ103: 2 | AR103: 2 | AV103: =IF(COUNTIF(RC7:RC45;2)=0;" ";COUNTIF(RC7:RC45;2)) -> 26 | AW103: =IF(RC[-3]=" ";0%;RC[-3]/COUNTIF(RC7:RC45;">=0")) -> 0 | AX103: =IF(RC[-3]=" ";0%;RC[-3]/COUNTIF(RC7:RC45;">=0")) -> 0 | AY103: =IF(RC[-3]=" ";0%;RC[-3]/COUNTIF(RC7:RC45;">=0")) -> 1 | AZ103: =IF(RC[-1]>60%;"Completo";IF(RC[-3]>RC[-2]+RC[-1];"No Cumplio";"Incompleto")) -> Completo | BA103: =IF(AND(RC[-1]=R[1]C[-1];R[2]C[-1]=R[3]C[-1];R[1]C[-1]=R[2]C[-1]);RC[-1];"Incompleto") -> Completo
C104: IF619BIN | D104: ANÁLISIS DE DATOS EMPRESARIALES | E104: 3 | F104: P | G104: 2 | H104: 2 | I104: 2 | J104: 2 | L104: 2 | M104: 2 | P104: 2 | AG104: 2 | AH104: 2 | AV104: =IF(COUNTIF(RC7:RC45;2)=0;" ";COUNTIF(RC7:RC45;2)) -> 9 | AW104: =IF(RC[-3]=" ";0%;RC[-3]/COUNTIF(RC7:RC45;">=0")) -> 0 | AX104: =IF(RC[-3]=" ";0%;RC[-3]/COUNTIF(RC7:RC45;">=0")) -> 0 | AY104: =IF(RC[-3]=" ";0%;RC[-3]/COUNTIF(RC7:RC45;">=0")) -> 1 | AZ104: =IF(RC[-1]>60%;"Completo";IF(RC[-3]>RC[-2]+RC[-1];"No Cumplio";"Incompleto")) -> Completo
C105: IF711BIN | D105: SEMINARIO DE INVESTIGACION II | E105: 3 | F105: T / P | G105: 2 | H105: 2 | I105: 2 | J105: 2 | K105: 2 | L105: 2 | M105: 2 | N105: 2 | O105: 2 | Q105: 2 | R105: 2 | S105: 2 | T105: 2 | W105: 2 | X105: 2 | Z105: 2 | AA105: 2 | AC105: 2 | AD105: 2 | AO105: 2 | AP105: 2 | AQ105: 2 | AR105: 2 | AV105: =IF(COUNTIF(RC7:RC45;2)=0;" ";COUNTIF(RC7:RC45;2)) -> 23 | AW105: =IF(RC[-3]=" ";0%;RC[-3]/COUNTIF(RC7:RC45;">=0")) -> 0 | AX105: =IF(RC[-3]=" ";0%;RC[-3]/COUNTIF(RC7:RC45;">=0")) -> 0 | AY105: =IF(RC[-3]=" ";0%;RC[-3]/COUNTIF(RC7:RC45;">=0")) -> 1 | AZ105: =IF(RC[-1]>60%;"Completo";IF(RC[-3]>RC[-2]+RC[-1];"No Cumplio";"Incompleto")) -> Completo
C106: IF902ACO | D106: TECNOLOGIAS DE LA INFORMACION Y LA COMUNICACIÓN | E106: 3 | F106: P | G106: 2 | H106: 2 | I106: 2 | J106: 2 | L106: 2 | M106: 2 | P106: 2 | AG106: 2 | AH106: 2 | AV106: =IF(COUNTIF(RC7:RC45;2)=0;" ";COUNTIF(RC7:RC45;2)) -> 9 | AW106: =IF(RC[-3]=" ";0%;RC[-3]/COUNTIF(RC7:RC45;">=0")) -> 0 | AX106: =IF(RC[-3]=" ";0%;RC[-3]/COUNTIF(RC7:RC45;">=0")) -> 0 | AY106: =IF(RC[-3]=" ";0%;RC[-3]/COUNTIF(RC7:RC45;">=0")) -> 1 | AZ106: =IF(RC[-1]>60%;"Completo";IF(RC[-3]>RC[-2]+RC[-1];"No Cumplio";"Incompleto")) -> Completo
C107: IF902ADR | D107: TECNOLOGIAS DE LA INFORMACION Y LA COMUNICACIÓN | E107: 3 | F107: T | G107: 2 | H107: 2 | I107: 2 | J107: 2 | K107: 2 | L107: 2 | M107: 2 | N107: 2 | O107: 2 | P107: 2 | Q107: 2 | R107: 2 | S107: 2 | T107: 2 | W107: 2 | X107: 2 | Z107: 2 | AA107: 2 | AC107: 2 | AD107: 2 | AO107: 2 | AP107: 2 | AQ107: 2 | AR107: 2 | AV107: =IF(COUNTIF(RC7:RC45;2)=0;" ";COUNTIF(RC7:RC45;2)) -> 24 | AW107: =IF(RC[-3]=" ";0%;RC[-3]/COUNTIF(RC7:RC45;">=0")) -> 0 | AX107: =IF(RC[-3]=" ";0%;RC[-3]/COUNTIF(RC7:RC45;">=0")) -> 0 | AY107: =IF(RC[-3]=" ";0%;RC[-3]/COUNTIF(RC7:RC45;">=0")) -> 1 | AZ107: =IF(RC[-1]>60%;"Completo";IF(RC[-3]>RC[-2]+RC[-1];"No Cumplio";"Incompleto")) -> Completo
C108: IF902AIA / IF902AVS | D108: TECNOLOGIAS DE LA INFORMACION Y LA COMUNICACIÓN | E108: 3 | F108: T | G108: 2 | H108: 2 | I108: 2 | J108: 2 | K108: 2 | L108: 2 | M108: 2 | N108: 2 | O108: 2 | P108: 2 | Q108: 2 | R108: 2 | S108: 2 | T108: 2 | W108: 2 | X108: 2 | Z108: 2 | AA108: 2 | AC108: 2 | AD108: 2 | AO108: 2 | AP108: 2 | AQ108: 2 | AR108: 2 | AV108: =IF(COUNTIF(RC7:RC45;2)=0;" ";COUNTIF(RC7:RC45;2)) -> 24 | AW108: =IF(RC[-3]=" ";0%;RC[-3]/COUNTIF(RC7:RC45;">=0")) -> 0 | AX108: =IF(RC[-3]=" ";0%;RC[-3]/COUNTIF(RC7:RC45;">=0")) -> 0 | AY108: =IF(RC[-3]=" ";0%;RC[-3]/COUNTIF(RC7:RC45;">=0")) -> 1 | AZ108: =IF(RC[-1]>60%;"Completo";IF(RC[-3]>RC[-2]+RC[-1];"No Cumplio";"Incompleto")) -> Completo
A109: 36 | B109: HÉCTOR EDUARDO UGARTE ROJAS | C109: IF453AIN | D109: PROGRAMACION II | E109: 2 | F109: T / P | G109: 2 | H109: 2 | I109: 2 | J109: 2 | K109: 2 | L109: 2 | M109: 2 | N109: 2 | O109: 2 | S109: 2 | T109: 2 | AC109: 2 | AD109: 2 | AV109: =IF(COUNTIF(RC7:RC45;2)=0;" ";COUNTIF(RC7:RC45;2)) -> 13 | AW109: =IF(RC[-3]=" ";0%;RC[-3]/COUNTIF(RC7:RC45;">=0")) -> 0 | AX109: =IF(RC[-3]=" ";0%;RC[-3]/COUNTIF(RC7:RC45;">=0")) -> 0 | AY109: =IF(RC[-3]=" ";0%;RC[-3]/COUNTIF(RC7:RC45;">=0")) -> 1 | AZ109: =IF(RC[-1]>60%;"Completo";IF(RC[-3]>RC[-2]+RC[-1];"No Cumplio";"Incompleto")) -> Completo | BA109: =IF(AND(RC[-1]=R[1]C[-1];R[2]C[-1]=R[3]C[-1];R[1]C[-1]=R[2]C[-1]);RC[-1];"Incompleto") -> Completo
C110: IF454AIN | D110: TEORIA DE LA COMPUTACION | E110: 3 | F110: T / P | G110: 2 | H110: 2 | I110: 2 | J110: 2 | K110: 2 | L110: 2 | M110: 2 | N110: 2 | S110: 2 | T110: 2 | AC110: 2 | AD110: 2 | AV110: =IF(COUNTIF(RC7:RC45;2)=0;" ";COUNTIF(RC7:RC45;2)) -> 12 | AW110: =IF(RC[-3]=" ";0%;RC[-3]/COUNTIF(RC7:RC45;">=0")) -> 0 | AX110: =IF(RC[-3]=" ";0%;RC[-3]/COUNTIF(RC7:RC45;">=0")) -> 0 | AY110: =IF(RC[-3]=" ";0%;RC[-3]/COUNTIF(RC7:RC45;">=0")) -> 1 | AZ110: =IF(RC[-1]>60%;"Completo";IF(RC[-3]>RC[-2]+RC[-1];"No Cumplio";"Incompleto")) -> Completo
C111: IF611AIN | D111: METODOLOGIA DE DESARROLLO DE SOFTWARE | E111: 3 | F111: T / P | G111: 2 | H111: 2 | I111: 2 | J111: 2 | L111: 2 | M111: 2 | O111: 2 | AG111: 2 | AH111: 2 | AV111: =IF(COUNTIF(RC7:RC45;2)=0;" ";COUNTIF(RC7:RC45;2)) -> 9 | AW111: =IF(RC[-3]=" ";0%;RC[-3]/COUNTIF(RC7:RC45;">=0")) -> 0 | AX111: =IF(RC[-3]=" ";0%;RC[-3]/COUNTIF(RC7:RC45;">=0")) -> 0 | AY111: =IF(RC[-3]=" ";0%;RC[-3]/COUNTIF(RC7:RC45;">=0")) -> 1 | AZ111: =IF(RC[-1]>60%;"Completo";IF(RC[-3]>RC[-2]+RC[-1];"No Cumplio";"Incompleto")) -> Completo
C112: IF902AAO / IF902AZO | D112: TECNOLOGIAS DE LA INFORMACION Y LA COMUNICACIÓN | E112: 3 | F112: T | G112: 2 | H112: 2 | I112: 2 | J112: 2 | K112: 2 | L112: 2 | M112: 2 | N112: 2 | O112: 2 | Q112: 2 | S112: 2 | T112: 2 | AC112: 2 | AD112: 2 | AV112: =IF(COUNTIF(RC7:RC45;2)=0;" ";COUNTIF(RC7:RC45;2)) -> 14 | AW112: =IF(RC[-3]=" ";0%;RC[-3]/COUNTIF(RC7:RC45;">=0")) -> 0 | AX112: =IF(RC[-3]=" ";0%;RC[-3]/COUNTIF(RC7:RC45;">=0")) -> 0 | AY112: =IF(RC[-3]=" ";0%;RC[-3]/COUNTIF(RC7:RC45;">=0")) -> 1 | AZ112: =IF(RC[-1]>60%;"Completo";IF(RC[-3]>RC[-2]+RC[-1];"No Cumplio";"Incompleto")) -> Completo
C113: IF902AEI / IF902BIN | D113: TECNOLOGIAS DE LA INFORMACION Y LA COMUNICACIÓN | E113: 3 | F113: T | G113: 2 | H113: 2 | I113: 2 | J113: 2 | K113: 2 | L113: 2 | M113: 2 | O113: 2 | Q113: 2 | S113: 2 | T113: 2 | AC113: 2 | AD113: 2 | AV113: =IF(COUNTIF(RC7:RC45;2)=0;" ";COUNTIF(RC7:RC45;2)) -> 13 | AW113: =IF(RC[-3]=" ";0%;RC[-3]/COUNTIF(RC7:RC45;">=0")) -> 0 | AX113: =IF(RC[-3]=" ";0%;RC[-3]/COUNTIF(RC7:RC45;">=0")) -> 0 | AY113: =IF(RC[-3]=" ";0%;RC[-3]/COUNTIF(RC7:RC45;">=0")) -> 1 | AZ113: =IF(RC[-1]>60%;"Completo";IF(RC[-3]>RC[-2]+RC[-1];"No Cumplio";"Incompleto")) -> Completo
A114: 37 | B114: LISETH URPY SEGUNDO CARPIO | C114: IF064AIN | D114: TALLER DE DEBATE | E114: 2 | F114: T | G114: 2 | H114: 2 | I114: 2 | J114: 2 | K114: 2 | L114: 2 | M114: 2 | N114: 2 | O114: 2 | P114: 2 | Q114: 2 | R114: 2 | S114: 2 | T114: 2 | W114: 2 | X114: 2 | Z114: 2 | AA114: 2 | AC114: 2 | AD114: 2 | AO114: 2 | AP114: 2 | AQ114: 2 | AR114: 2 | AV114: =IF(COUNTIF(RC7:RC45;2)=0;" ";COUNTIF(RC7:RC45;2)) -> 24 | AW114: =IF(RC[-3]=" ";0%;RC[-3]/COUNTIF(RC7:RC45;">=0")) -> 0 | AX114: =IF(RC[-3]=" ";0%;RC[-3]/COUNTIF(RC7:RC45;">=0")) -> 0 | AY114: =IF(RC[-3]=" ";0%;RC[-3]/COUNTIF(RC7:RC45;">=0")) -> 1 | AZ114: =IF(RC[-1]>60%;"Completo";IF(RC[-3]>RC[-2]+RC[-1];"No Cumplio";"Incompleto")) -> Completo | BA114: =IF(AND(RC[-1]=R[1]C[-1];RC[-1]=R[2]C[-1];RC[-1]=R[3]C[-1];RC[-1]=R[4]C[-1]);RC[-1];"Incompleto") -> Completo
C115: IF613AIN | D115: DESARROLLO DE SOFTWARE I | E115: 2 | F115: T / P | G115: 2 | H115: 2 | I115: 2 | J115: 2 | K115: 2 | L115: 2 | M115: 2 | N115: 2 | O115: 2 | P115: 2 | Q115: 2 | R115: 2 | S115: 2 | T115: 2 | W115: 2 | X115: 2 | Z115: 2 | AA115: 2 | AC115: 2 | AD115: 2 | AO115: 2 | AP115: 2 | AQ115: 2 | AR115: 2 | AV115: =IF(COUNTIF(RC7:RC45;2)=0;" ";COUNTIF(RC7:RC45;2)) -> 24 | AW115: =IF(RC[-3]=" ";0%;RC[-3]/COUNTIF(RC7:RC45;">=0")) -> 0 | AX115: =IF(RC[-3]=" ";0%;RC[-3]/COUNTIF(RC7:RC45;">=0")) -> 0 | AY115: =IF(RC[-3]=" ";0%;RC[-3]/COUNTIF(RC7:RC45;">=0")) -> 1 | AZ115: =IF(RC[-1]>60%;"Completo";IF(RC[-3]>RC[-2]+RC[-1];"No Cumplio";"Incompleto")) -> Completo
C116: IF619AIN | D116: ANÁLISIS DE DATOS EMPRESARIALES | E116: 3 | F116: T | G116: 2 | H116: 2 | I116: 2 | J116: 2 | K116: 2 | L116: 2 | M116: 2 | N116: 2 | O116: 2 | P116: 2 | Q116: 2 | R116: 2 | S116: 2 | T116: 2 | W116: 2 | X116: 2 | Z116: 2 | AA116: 2 | AC116: 2 | AD116: 2 | AO116: 2 | AP116: 2 | AQ116: 2 | AR116: 2 | AV116: =IF(COUNTIF(RC7:RC45;2)=0;" ";COUNTIF(RC7:RC45;2)) -> 24 | AW116: =IF(RC[-3]=" ";0%;RC[-3]/COUNTIF(RC7:RC45;">=0")) -> 0 | AX116: =IF(RC[-3]=" ";0%;RC[-3]/COUNTIF(RC7:RC45;">=0")) -> 0 | AY116: =IF(RC[-3]=" ";0%;RC[-3]/COUNTIF(RC7:RC45;">=0")) -> 1 | AZ116: =IF(RC[-1]>60%;"Completo";IF(RC[-3]>RC[-2]+RC[-1];"No Cumplio";"Incompleto")) -> Completo
C117: IF902AMD / IF902AOD | D117: TECNOLOGIAS DE LA INFORMACION Y LA COMUNICACIÓN | E117: 3 | F117: T | G117: 2 | H117: 2 | I117: 2 | J117: 2 | K117: 2 | L117: 2 | M117: 2 | N117: 2 | O117: 2 | P117: 2 | Q117: 2 | R117: 2 | S117: 2 | T117: 2 | W117: 2 | X117: 2 | Z117: 2 | AA117: 2 | AC117: 2 | AD117: 2 | AO117: 2 | AP117: 2 | AQ117: 2 | AR117: 2 | AV117: =IF(COUNTIF(RC7:RC45;2)=0;" ";COUNTIF(RC7:RC45;2)) -> 24 | AW117: =IF(RC[-3]=" ";0%;RC[-3]/COUNTIF(RC7:RC45;">=0")) -> 0 | AX117: =IF(RC[-3]=" ";0%;RC[-3]/COUNTIF(RC7:RC45;">=0")) -> 0 | AY117: =IF(RC[-3]=" ";0%;RC[-3]/COUNTIF(RC7:RC45;">=0")) -> 1 | AZ117: =IF(RC[-1]>60%;"Completo";IF(RC[-3]>RC[-2]+RC[-1];"No Cumplio";"Incompleto")) -> Completo
C118: IF902AMD / IF902AOD | D118: TECNOLOGIAS DE LA INFORMACION Y LA COMUNICACIÓN | E118: 3 | F118: P | G118: 2 | H118: 2 | I118: 2 | J118: 2 | K118: 2 | L118: 2 | M118: 2 | O118: 2 | P118: 2 | AG118: 2 | AH118: 2 | AO118: 2 | AV118: =IF(COUNTIF(RC7:RC45;2)=0;" ";COUNTIF(RC7:RC45;2)) -> 12 | AW118: =IF(RC[-3]=" ";0%;RC[-3]/COUNTIF(RC7:RC45;">=0")) -> 0 | AX118: =IF(RC[-3]=" ";0%;RC[-3]/COUNTIF(RC7:RC45;">=0")) -> 0 | AY118: =IF(RC[-3]=" ";0%;RC[-3]/COUNTIF(RC7:RC45;">=0")) -> 1 | AZ118: =IF(RC[-1]>60%;"Completo";IF(RC[-3]>RC[-2]+RC[-1];"No Cumplio";"Incompleto")) -> Completo
A119: 38 | B119: LUIS ALVARO MONZÓN CONDORI | C119: IF451BIN | D119: PROGRAMACION I | E119: 2 | F119: T / P | G119: 2 | H119: 2 | I119: 2 | J119: 2 | K119: 2 | L119: 2 | M119: 2 | N119: 2 | O119: 2 | P119: 2 | Q119: 2 | R119: 2 | S119: 2 | T119: 2 | V119: 2 | W119: 2 | X119: 2 | Z119: 0 | AA119: 0 | AC119: 2 | AD119: 2 | AO119: 2 | AV119: =IF(COUNTIF(RC7:RC45;2)=0;" ";COUNTIF(RC7:RC45;2)) -> 20 | AW119: =IF(RC[-3]=" ";0%;RC[-3]/COUNTIF(RC7:RC45;">=0")) -> 0 | AX119: =IF(RC[-3]=" ";0%;RC[-3]/COUNTIF(RC7:RC45;">=0")) -> 0 | AY119: =IF(RC[-3]=" ";0%;RC[-3]/COUNTIF(RC7:RC45;">=0")) -> 0.909090909090909 | AZ119: =IF(RC[-1]>60%;"Completo";IF(RC[-3]>RC[-2]+RC[-1];"No Cumplio";"Incompleto")) -> Completo | BA119: =IF(AND(RC[-1]=R[1]C[-1];R[2]C[-1]=R[3]C[-1];R[1]C[-1]=R[2]C[-1]);RC[-1];"Incompleto") -> Completo
C120: IF613BIN | D120: DESARROLLO DE SOFTWARE I | E120: 2 | F120: T / P | G120: 2 | H120: 2 | I120: 2 | J120: 2 | K120: 2 | L120: 2 | M120: 2 | N120: 2 | O120: 0 | P120: 2 | Q120: 2 | R120: 2 | S120: 2 | T120: 2 | V120: 2 | W120: 0 | X120: 0 | Z120: 0 | AA120: 0 | AC120: 2 | AD120: 2 | AO120: 2 | AV120: =IF(COUNTIF(RC7:RC45;2)=0;" ";COUNTIF(RC7:RC45;2)) -> 17 | AW120: =IF(RC[-3]=" ";0%;RC[-3]/COUNTIF(RC7:RC45;">=0")) -> 0 | AX120: =IF(RC[-3]=" ";0%;RC[-3]/COUNTIF(RC7:RC45;">=0")) -> 0 | AY120: =IF(RC[-3]=" ";0%;RC[-3]/COUNTIF(RC7:RC45;">=0")) -> 0.772727272727273 | AZ120: =IF(RC[-1]>60%;"Completo";IF(RC[-3]>RC[-2]+RC[-1];"No Cumplio";"Incompleto")) -> Completo
C121: IF613CIN | D121: DESARROLLO DE SOFTWARE I | E121: 2 | F121: T / P | G121: 2 | H121: 2 | I121: 2 | J121: 2 | K121: 2 | L121: 2 | M121: 2 | N121: 2 | O121: 0 | P121: 2 | Q121: 2 | R121: 2 | S121: 2 | T121: 2 | V121: 2 | W121: 0 | X121: 0 | Z121: 0 | AA121: 0 | AC121: 2 | AD121: 2 | AO121: 2 | AV121: =IF(COUNTIF(RC7:RC45;2)=0;" ";COUNTIF(RC7:RC45;2)) -> 17 | AW121: =IF(RC[-3]=" ";0%;RC[-3]/COUNTIF(RC7:RC45;">=0")) -> 0 | AX121: =IF(RC[-3]=" ";0%;RC[-3]/COUNTIF(RC7:RC45;">=0")) -> 0 | AY121: =IF(RC[-3]=" ";0%;RC[-3]/COUNTIF(RC7:RC45;">=0")) -> 0.772727272727273 | AZ121: =IF(RC[-1]>60%;"Completo";IF(RC[-3]>RC[-2]+RC[-1];"No Cumplio";"Incompleto")) -> Completo
C122: IF902ACI | D122: TECNOLOGIAS DE LA INFORMACION Y LA COMUNICACIÓN | E122: 3 | F122: T | G122: 2 | H122: 2 | I122: 2 | J122: 2 | K122: 2 | L122: 2 | M122: 2 | N122: 2 | O122: 2 | P122: 2 | Q122: 2 | R122: 2 | S122: 2 | T122: 2 | V122: 2 | W122: 0 | X122: 0 | Z122: 0 | AA122: 0 | AC122: 2 | AD122: 2 | AO122: 2 | AV122: =IF(COUNTIF(RC7:RC45;2)=0;" ";COUNTIF(RC7:RC45;2)) -> 18 | AW122: =IF(RC[-3]=" ";0%;RC[-3]/COUNTIF(RC7:RC45;">=0")) -> 0 | AX122: =IF(RC[-3]=" ";0%;RC[-3]/COUNTIF(RC7:RC45;">=0")) -> 0 | AY122: =IF(RC[-3]=" ";0%;RC[-3]/COUNTIF(RC7:RC45;">=0")) -> 0.818181818181818 | AZ122: =IF(RC[-1]>60%;"Completo";IF(RC[-3]>RC[-2]+RC[-1];"No Cumplio";"Incompleto")) -> Completo
C123: IF902AQI | D123: TECNOLOGIAS DE LA INFORMACION Y LA COMUNICACIÓN | E123: 3 | F123: P | G123: 2 | H123: 2 | I123: 2 | J123: 2 | L123: 2 | M123: 2 | O123: 2 | P123: 2 | AG123: 2 | AH123: 2 | AO123: 2 | AV123: =IF(COUNTIF(RC7:RC45;2)=0;" ";COUNTIF(RC7:RC45;2)) -> 11 | AW123: =IF(RC[-3]=" ";0%;RC[-3]/COUNTIF(RC7:RC45;">=0")) -> 0 | AX123: =IF(RC[-3]=" ";0%;RC[-3]/COUNTIF(RC7:RC45;">=0")) -> 0 | AY123: =IF(RC[-3]=" ";0%;RC[-3]/COUNTIF(RC7:RC45;">=0")) -> 1 | AZ123: =IF(RC[-1]>60%;"Completo";IF(RC[-3]>RC[-2]+RC[-1];"No Cumplio";"Incompleto")) -> Completo
A124: 39 | B124: VITALI QUISPE SURCO | C124: IF459AIN | D124: COMPUTACION GRAFICA II | E124: 4 | F124: T / P | G124: 2 | H124: 2 | I124: 2 | J124: 2 | K124: 2 | L124: 2 | M124: 2 | N124: 2 | O124: 2 | AV124: =IF(COUNTIF(RC7:RC45;2)=0;" ";COUNTIF(RC7:RC45;2)) -> 9 | AW124: =IF(RC[-3]=" ";0%;RC[-3]/COUNTIF(RC7:RC45;">=0")) -> 0 | AX124: =IF(RC[-3]=" ";0%;RC[-3]/COUNTIF(RC7:RC45;">=0")) -> 0 | AY124: =IF(RC[-3]=" ";0%;RC[-3]/COUNTIF(RC7:RC45;">=0")) -> 1 | AZ124: =IF(RC[-1]>60%;"Completo";IF(AND(RC[-3]>RC[-2]+RC[-1];RC[-1]<20%);"No Cumplio";"Incompleto")) -> Completo | BA124: =IF(AND(RC[-1]=R[1]C[-1];RC[-1]=R[2]C[-1];RC[-1]=R[3]C[-1];RC[-1]=R[4]C[-1]);RC[-1];"Incompleto") -> Completo
C125: IF466AIN | D125: COMPILADORES | E125: 3 | F125: P | G125: 2 | H125: 2 | I125: 2 | J125: 2 | AV125: =IF(COUNTIF(RC7:RC45;2)=0;" ";COUNTIF(RC7:RC45;2)) -> 4 | AW125: =IF(RC[-3]=" ";0%;RC[-3]/COUNTIF(RC7:RC45;">=0")) -> 0 | AX125: =IF(RC[-3]=" ";0%;RC[-3]/COUNTIF(RC7:RC45;">=0")) -> 0 | AY125: =IF(RC[-3]=" ";0%;RC[-3]/COUNTIF(RC7:RC45;">=0")) -> 1 | AZ125: =IF(RC[-1]>60%;"Completo";IF(AND(RC[-3]>RC[-2]+RC[-1];RC[-1]<20%);"No Cumplio";"Incompleto")) -> Completo
C126: IF618AIN | D126: TOPICOS AVANZADOS EN INGENIERIA DE SOFTWARE | E126: 4 | F126: T / P | G126: 2 | H126: 2 | I126: 2 | J126: 2 | K126: 2 | L126: 2 | M126: 2 | N126: 2 | O126: 2 | AV126: =IF(COUNTIF(RC7:RC45;2)=0;" ";COUNTIF(RC7:RC45;2)) -> 9 | AW126: =IF(RC[-3]=" ";0%;RC[-3]/COUNTIF(RC7:RC45;">=0")) -> 0 | AX126: =IF(RC[-3]=" ";0%;RC[-3]/COUNTIF(RC7:RC45;">=0")) -> 0 | AY126: =IF(RC[-3]=" ";0%;RC[-3]/COUNTIF(RC7:RC45;">=0")) -> 1 | AZ126: =IF(RC[-1]>60%;"Completo";IF(AND(RC[-3]>RC[-2]+RC[-1];RC[-1]<20%);"No Cumplio";"Incompleto")) -> Completo
C127: IF902AEU | D127: TECNOLOGIAS DE LA INFORMACION Y LA COMUNICACIÓN | E127: 3 | F127: P | G127: 2 | H127: 2 | I127: 2 | J127: 2 | AV127: =IF(COUNTIF(RC7:RC45;2)=0;" ";COUNTIF(RC7:RC45;2)) -> 4 | AW127: =IF(RC[-3]=" ";0%;RC[-3]/COUNTIF(RC7:RC45;">=0")) -> 0 | AX127: =IF(RC[-3]=" ";0%;RC[-3]/COUNTIF(RC7:RC45;">=0")) -> 0 | AY127: =IF(RC[-3]=" ";0%;RC[-3]/COUNTIF(RC7:RC45;">=0")) -> 1 | AZ127: =IF(RC[-1]>60%;"Completo";IF(AND(RC[-3]>RC[-2]+RC[-1];RC[-1]<20%);"No Cumplio";"Incompleto")) -> Completo
C128: IF902DEU | D128: TECNOLOGIAS DE LA INFORMACION Y LA COMUNICACIÓN | E128: 3 | F128: P | G128: 2 | H128: 2 | I128: 2 | J128: 2 | AV128: =IF(COUNTIF(RC7:RC45;2)=0;" ";COUNTIF(RC7:RC45;2)) -> 4 | AW128: =IF(RC[-3]=" ";0%;RC[-3]/COUNTIF(RC7:RC45;">=0")) -> 0 | AX128: =IF(RC[-3]=" ";0%;RC[-3]/COUNTIF(RC7:RC45;">=0")) -> 0 | AY128: =IF(RC[-3]=" ";0%;RC[-3]/COUNTIF(RC7:RC45;">=0")) -> 1 | AZ128: =IF(RC[-1]>60%;"Completo";IF(AND(RC[-3]>RC[-2]+RC[-1];RC[-1]<20%);"No Cumplio";"Incompleto")) -> Completo
A129: 40 | B129: JISBAJ GAMARRAS SALAS | C129: IF611BIN | D129: METODOLOGIA DE DESARROLLO DE SOFTWARE | E129: 3 | F129: T / P | G129: 2 | H129: 2 | I129: 2 | J129: 2 | K129: 2 | L129: 2 | M129: 2 | N129: 2 | O129: 2 | P129: 2 | Q129: 2 | R129: 2 | S129: 2 | T129: 2 | W129: 2 | X129: 2 | Z129: 2 | AA129: 2 | AC129: 2 | AD129: 2 | AG129: 0 | AH129: 0 | AO129: 2 | AP129: 2 | AQ129: 2 | AR129: 2 | AV129: =IF(COUNTIF(RC7:RC45;2)=0;" ";COUNTIF(RC7:RC45;2)) -> 24 | AW129: =IF(RC[-3]=" ";0%;RC[-3]/COUNTIF(RC7:RC45;">=0")) -> 0 | AX129: =IF(RC[-3]=" ";0%;RC[-3]/COUNTIF(RC7:RC45;">=0")) -> 0 | AY129: =IF(RC[-3]=" ";0%;RC[-3]/COUNTIF(RC7:RC45;">=0")) -> 0.923076923076923 | AZ129: =IF(RC[-1]>60%;"Completo";IF(RC[-3]>RC[-2]+RC[-1];"No Cumplio";"Incompleto")) -> Completo | BA129: =IF(RC[-1]=R[1]C[-1];RC[-1];"Incompleto") -> Completo
C130: IF902AEO / IF902BHI | D130: TECNOLOGIAS DE LA INFORMACION Y LA COMUNICACIÓN | E130: 3 | F130: T / P | G130: 2 | H130: 2 | I130: 2 | J130: 2 | K130: 2 | L130: 2 | M130: 2 | N130: 2 | O130: 2 | P130: 2 | Q130: 2 | R130: 2 | S130: 2 | T130: 2 | W130: 2 | X130: 2 | Z130: 2 | AA130: 2 | AC130: 2 | AD130: 2 | AG130: 0 | AH130: 0 | AO130: 2 | AP130: 2 | AQ130: 2 | AR130: 2 | AV130: =IF(COUNTIF(RC7:RC45;2)=0;" ";COUNTIF(RC7:RC45;2)) -> 24 | AW130: =IF(RC[-3]=" ";0%;RC[-3]/COUNTIF(RC7:RC45;">=0")) -> 0 | AX130: =IF(RC[-3]=" ";0%;RC[-3]/COUNTIF(RC7:RC45;">=0")) -> 0 | AY130: =IF(RC[-3]=" ";0%;RC[-3]/COUNTIF(RC7:RC45;">=0")) -> 0.923076923076923 | AZ130: =IF(RC[-1]>60%;"Completo";IF(RC[-3]>RC[-2]+RC[-1];"No Cumplio";"Incompleto")) -> Completo
A131: 41 | B131: HENRY SAMUEL DUEÑAS DE LA CRUZ | C131: IF614BIN | D131: INGENIERIA DE SOFTWARE I | E131: 4 | F131: T / P | G131: 2 | H131: 2 | I131: 2 | J131: 2 | K131: 2 | L131: 2 | M131: 2 | N131: 2 | O131: 0 | P131: 2 | Q131: 1 | R131: 2 | S131: 0 | T131: 0 | U131: 0 | W131: 2 | X131: 2 | Y131: 2 | Z131: 0 | AA131: 0 | AB131: 0 | AC131: 0 | AD131: 0 | AE131: 0 | AO131: 0 | AP131: 0 | AQ131: 0 | AR131: 0 | AV131: =IF(COUNTIF(RC7:RC45;2)=0;" ";COUNTIF(RC7:RC45;2)) -> 13 | AW131: =IF(RC[-3]=" ";0%;RC[-3]/COUNTIF(RC7:RC45;">=0")) -> 0 | AX131: =IF(RC[-3]=" ";0%;RC[-3]/COUNTIF(RC7:RC45;">=0")) -> 0 | AY131: =IF(RC[-3]=" ";0%;RC[-3]/COUNTIF(RC7:RC45;">=0")) -> 0.464285714285714 | AZ131: =IF(RC[-1]>60%;"Completo";IF(RC[-3]>RC[-2]+RC[-1];"No Cumplio";"Incompleto")) -> Incompleto | BA131: =IF(RC[-1]=R[1]C[-1];RC[-1];"Incompleto") -> Incompleto
C132: IF902ALI / IF902AIN | D132: TECNOLOGIAS DE LA INFORMACION Y LA COMUNICACIÓN | E132: 3 | F132: T / P | G132: 2 | H132: 2 | I132: 2 | J132: 2 | K132: 2 | L132: 2 | M132: 2 | N132: 2 | O132: 0 | P132: 2 | Q132: 2 | R132: 2 | S132: 2 | T132: 2 | W132: 2 | X132: 2 | Z132: 0 | AA132: 0 | AC132: 0 | AD132: 0 | AG132: 0 | AH132: 0 | AO132: 0 | AP132: 0 | AQ132: 0 | AR132: 0 | AV132: =IF(COUNTIF(RC7:RC45;2)=0;" ";COUNTIF(RC7:RC45;2)) -> 15 | AW132: =IF(RC[-3]=" ";0%;RC[-3]/COUNTIF(RC7:RC45;">=0")) -> 0 | AX132: =IF(RC[-3]=" ";0%;RC[-3]/COUNTIF(RC7:RC45;">=0")) -> 0 | AY132: =IF(RC[-3]=" ";0%;RC[-3]/COUNTIF(RC7:RC45;">=0")) -> 0.576923076923077 | AZ132: =IF(RC[-1]>60%;"Completo";IF(RC[-3]>RC[-2]+RC[-1];"No Cumplio";"Incompleto")) -> Incompleto
A133: 42 | B133: ANA ROCIO CARDENAS MAITA | C133: IF902AAT | D133: TECNOLOGIAS DE LA INFORMACION Y LA COMUNICACIÓN | E133: 3 | F133: T / P | G133: 2 | H133: 2 | I133: 2 | J133: 2 | K133: 2 | L133: 2 | M133: 2 | N133: 2 | O133: 2 | P133: 2 | Q133: 2 | R133: 2 | S133: 0 | T133: 2 | V133: 2 | W133: 2 | X133: 2 | Z133: 2 | AA133: 2 | AC133: 2 | AD133: 2 | AO133: 2 | AV133: =IF(COUNTIF(RC7:RC45;2)=0;" ";COUNTIF(RC7:RC45;2)) -> 21 | AW133: =IF(RC[-3]=" ";0%;RC[-3]/COUNTIF(RC7:RC45;">=0")) -> 0 | AX133: =IF(RC[-3]=" ";0%;RC[-3]/COUNTIF(RC7:RC45;">=0")) -> 0 | AY133: =IF(RC[-3]=" ";0%;RC[-3]/COUNTIF(RC7:RC45;">=0")) -> 0.954545454545455 | AZ133: =IF(RC[-1]>60%;"Completo";IF(RC[-3]>RC[-2]+RC[-1];"No Cumplio";"Incompleto")) -> Completo | BA133: =RC[-1] -> Completo
A134: 43 | B134: RAUL HUILLCA HUALLPARIMACHI | C134: IF467AIN | D134: ANALISIS Y DISEÑO DE ALGORITMOS | E134: 3 | F134: T / P | G134: 2 | H134: 2 | I134: 2 | J134: 2 | K134: 2 | L134: 2 | M134: 2 | N134: 2 | O134: 2 | P134: 2 | Q134: 2 | R134: 2 | S134: 2 | T134: 2 | W134: 2 | X134: 2 | Z134: 0 | AA134: 0 | AC134: 2 | AD134: 2 | AO134: 2 | AP134: 2 | AQ134: 2 | AR134: 2 | AV134: =IF(COUNTIF(RC7:RC45;2)=0;" ";COUNTIF(RC7:RC45;2)) -> 22 | AW134: =IF(RC[-3]=" ";0%;RC[-3]/COUNTIF(RC7:RC45;">=0")) -> 0 | AX134: =IF(RC[-3]=" ";0%;RC[-3]/COUNTIF(RC7:RC45;">=0")) -> 0 | AY134: =IF(RC[-3]=" ";0%;RC[-3]/COUNTIF(RC7:RC45;">=0")) -> 0.916666666666667 | AZ134: =IF(RC[-1]>60%;"Completo";IF(RC[-3]>RC[-2]+RC[-1];"No Cumplio";"Incompleto")) -> Completo | BA134: =RC[-1] -> Completo
A135: 44 | B135: GABRIELA ZÚÑIGA ROJAS | C135: IF651AIN | D135: INTELIGENCIA ARTIFICIAL | E135: 4 | F135: P | L135: 2 | M135: 2 | O135: 2 | P135: 2 | AC135: 2 | AO135: 2 | AV135: =IF(COUNTIF(RC7:RC45;2)=0;" ";COUNTIF(RC7:RC45;2)) -> 6 | AW135: =IF(RC[-3]=" ";0%;RC[-3]/COUNTIF(RC7:RC45;">=0")) -> 0 | AX135: =IF(RC[-3]=" ";0%;RC[-3]/COUNTIF(RC7:RC45;">=0")) -> 0 | AY135: =IF(RC[-3]=" ";0%;RC[-3]/COUNTIF(RC7:RC45;">=0")) -> 1 | AZ135: =IF(RC[-1]>60%;"Completo";IF(RC[-3]>RC[-2]+RC[-1];"No Cumplio";"Incompleto")) -> Completo | BA135: =IF(AND(RC[-1]=R[1]C[-1];RC[-1]=R[2]C[-1];RC[-1]=R[3]C[-1];RC[-1]=R[4]C[-1];RC[-1]=R[5]C[-1];RC[-1]=R[6]C[-1]);RC[-1];"Incompleto") -> Completo
C136: IF652AIN | D136: APRENDIZAJE AUTOMATICO | E136: 4 | F136: P | L136: 2 | M136: 2 | O136: 2 | P136: 2 | AC136: 2 | AO136: 2 | AV136: =IF(COUNTIF(RC7:RC45;2)=0;" ";COUNTIF(RC7:RC45;2)) -> 6 | AW136: =IF(RC[-3]=" ";0%;RC[-3]/COUNTIF(RC7:RC45;">=0")) -> 0 | AX136: =IF(RC[-3]=" ";0%;RC[-3]/COUNTIF(RC7:RC45;">=0")) -> 0 | AY136: =IF(RC[-3]=" ";0%;RC[-3]/COUNTIF(RC7:RC45;">=0")) -> 1 | AZ136: =IF(RC[-1]>60%;"Completo";IF(RC[-3]>RC[-2]+RC[-1];"No Cumplio";"Incompleto")) -> Completo
C137: IF656AIN | D137: PROCESAMIENTO DE LENGUAJE NATURAL | E137: 4 | F137: P | L137: 2 | O137: 2 | AC137: 2 | AO137: 2 | AV137: =IF(COUNTIF(RC7:RC45;2)=0;" ";COUNTIF(RC7:RC45;2)) -> 4 | AW137: =IF(RC[-3]=" ";0%;RC[-3]/COUNTIF(RC7:RC45;">=0")) -> 0 | AX137: =IF(RC[-3]=" ";0%;RC[-3]/COUNTIF(RC7:RC45;">=0")) -> 0 | AY137: =IF(RC[-3]=" ";0%;RC[-3]/COUNTIF(RC7:RC45;">=0")) -> 1 | AZ137: =IF(RC[-1]>60%;"Completo";IF(RC[-3]>RC[-2]+RC[-1];"No Cumplio";"Incompleto")) -> Completo
C138: IF902AAN / IF902BCC | D138: TECNOLOGIAS DE LA INFORMACION Y LA COMUNICACIÓN | E138: 3 | F138: P | K138: 2 | L138: 2 | O138: 2 | P138: 2 | T138: 0 | AO138: 2 | AV138: =IF(COUNTIF(RC7:RC45;2)=0;" ";COUNTIF(RC7:RC45;2)) -> 5 | AW138: =IF(RC[-3]=" ";0%;RC[-3]/COUNTIF(RC7:RC45;">=0")) -> 0 | AX138: =IF(RC[-3]=" ";0%;RC[-3]/COUNTIF(RC7:RC45;">=0")) -> 0 | AY138: =IF(RC[-3]=" ";0%;RC[-3]/COUNTIF(RC7:RC45;">=0")) -> 0.833333333333333 | AZ138: =IF(RC[-1]>60%;"Completo";IF(RC[-3]>RC[-2]+RC[-1];"No Cumplio";"Incompleto")) -> Completo
C139: IF902AAE / IF902CHI | D139: TECNOLOGIAS DE LA INFORMACION Y LA COMUNICACIÓN | E139: 3 | F139: P | L139: 2 | O139: 2 | P139: 2 | AD139: 2 | AO139: 2 | AV139: =IF(COUNTIF(RC7:RC45;2)=0;" ";COUNTIF(RC7:RC45;2)) -> 5 | AW139: =IF(RC[-3]=" ";0%;RC[-3]/COUNTIF(RC7:RC45;">=0")) -> 0 | AX139: =IF(RC[-3]=" ";0%;RC[-3]/COUNTIF(RC7:RC45;">=0")) -> 0 | AY139: =IF(RC[-3]=" ";0%;RC[-3]/COUNTIF(RC7:RC45;">=0")) -> 1 | AZ139: =IF(RC[-1]>60%;"Completo";IF(RC[-3]>RC[-2]+RC[-1];"No Cumplio";"Incompleto")) -> Completo
C140: IF902BAE / IF902BEO | D140: TECNOLOGIAS DE LA INFORMACION Y LA COMUNICACIÓN | E140: 3 | F140: P | L140: 2 | O140: 2 | P140: 2 | AD140: 2 | AO140: 2 | AV140: =IF(COUNTIF(RC7:RC45;2)=0;" ";COUNTIF(RC7:RC45;2)) -> 5 | AW140: =IF(RC[-3]=" ";0%;RC[-3]/COUNTIF(RC7:RC45;">=0")) -> 0 | AX140: =IF(RC[-3]=" ";0%;RC[-3]/COUNTIF(RC7:RC45;">=0")) -> 0 | AY140: =IF(RC[-3]=" ";0%;RC[-3]/COUNTIF(RC7:RC45;">=0")) -> 1 | AZ140: =IF(RC[-1]>60%;"Completo";IF(RC[-3]>RC[-2]+RC[-1];"No Cumplio";"Incompleto")) -> Completo
C141: IF902AEN | D141: TECNOLOGIAS DE LA INFORMACION Y LA COMUNICACIÓN | E141: 3 | F141: P | L141: 2 | O141: 2 | P141: 2 | AD141: 2 | AO141: 2 | AV141: =IF(COUNTIF(RC7:RC45;2)=0;" ";COUNTIF(RC7:RC45;2)) -> 5 | AW141: =IF(RC[-3]=" ";0%;RC[-3]/COUNTIF(RC7:RC45;">=0")) -> 0 | AX141: =IF(RC[-3]=" ";0%;RC[-3]/COUNTIF(RC7:RC45;">=0")) -> 0 | AY141: =IF(RC[-3]=" ";0%;RC[-3]/COUNTIF(RC7:RC45;">=0")) -> 1 | AZ141: =IF(RC[-1]>60%;"Completo";IF(RC[-3]>RC[-2]+RC[-1];"No Cumplio";"Incompleto")) -> Completo
C142: IF902AMI / IF902AQM | D142: TECNOLOGIAS DE LA INFORMACION Y LA COMUNICACIÓN | E142: 3 | L142: 2 | O142: 2 | P142: 2 | AD142: 2 | AO142: 2 | AV142: =IF(COUNTIF(RC7:RC45;2)=0;" ";COUNTIF(RC7:RC45;2)) -> 5 | AW142: =IF(RC[-3]=" ";0%;RC[-3]/COUNTIF(RC7:RC45;">=0")) -> 0 | AX142: =IF(RC[-3]=" ";0%;RC[-3]/COUNTIF(RC7:RC45;">=0")) -> 0 | AY142: =IF(RC[-3]=" ";0%;RC[-3]/COUNTIF(RC7:RC45;">=0")) -> 1 | AZ142: =IF(RC[-1]>60%;"Completo";IF(RC[-3]>RC[-2]+RC[-1];"No Cumplio";"Incompleto")) -> Completo
A143: 45 | B143: MARÍA DEL PILAR VENEGAS VERGARA | C143: IF391AMI | D143: SISTEMA DE BASE DE DATOS | E143: 2 | F143: P | G143: 2 | H143: 2 | I143: 2 | J143: 2 | AV143: =IF(COUNTIF(RC7:RC45;2)=0;" ";COUNTIF(RC7:RC45;2)) -> 4 | AW143: =IF(RC[-3]=" ";0%;RC[-3]/COUNTIF(RC7:RC45;">=0")) -> 0 | AX143: =IF(RC[-3]=" ";0%;RC[-3]/COUNTIF(RC7:RC45;">=0")) -> 0 | AY143: =IF(RC[-3]=" ";0%;RC[-3]/COUNTIF(RC7:RC45;">=0")) -> 1 | AZ143: =IF(RC[-1]>60%;"Completo";IF(RC[-3]>RC[-2]+RC[-1];"No Cumplio";"Incompleto")) -> Completo | BA143: =RC[-1] -> Completo
C144: IF614AIN | D144: INGENIERIA DE SOFTWARE I | E144: 4 | F144: T/P | G144: 2 | H144: 2 | I144: 2 | J144: 2 | K144: 2 | L144: 2 | N144: 2 | O144: 2 | P144: 2 | Q144: 1 | AV144: =IF(COUNTIF(RC7:RC45;2)=0;" ";COUNTIF(RC7:RC45;2)) -> 9 | AW144: =IF(RC[-3]=" ";0%;RC[-3]/COUNTIF(RC7:RC45;">=0")) -> 0 | AX144: =IF(RC[-3]=" ";0%;RC[-3]/COUNTIF(RC7:RC45;">=0")) -> 0 | AY144: =IF(RC[-3]=" ";0%;RC[-3]/COUNTIF(RC7:RC45;">=0")) -> 0.9 | AZ144: =IF(RC[-1]>60%;"Completo";IF(RC[-3]>RC[-2]+RC[-1];"No Cumplio";"Incompleto")) -> Completo
A145: 46 | B145: VÍCTOR DARIO SOSA JAUREGUI | C145: IF612AIN | D145: FUNDAMENTOS Y DISEÑO DE BASE DE DATOS | E145: 4 | F145: P | K145: 2 | L145: 2 | M145: 2 | AV145: =IF(COUNTIF(RC7:RC45;2)=0;" ";COUNTIF(RC7:RC45;2)) -> 3 | AW145: =IF(RC[-3]=" ";0%;RC[-3]/COUNTIF(RC7:RC45;">=0")) -> 0 | AX145: =IF(RC[-3]=" ";0%;RC[-3]/COUNTIF(RC7:RC45;">=0")) -> 0 | AY145: =IF(RC[-3]=" ";0%;RC[-3]/COUNTIF(RC7:RC45;">=0")) -> 1 | AZ145: =IF(RC[-1]>60%;"Completo";IF(RC[-3]>RC[-2]+RC[-1];"No Cumplio";"Incompleto")) -> Completo | BA145: =RC[-1] -> Completo
C146: IF617AIN | D146: INGENIERIA DE SOFTWARE II | E146: 4 | F146: P | K146: 2 | L146: 2 | M146: 2 | AV146: =IF(COUNTIF(RC7:RC45;2)=0;" ";COUNTIF(RC7:RC45;2)) -> 3 | AW146: =IF(RC[-3]=" ";0%;RC[-3]/COUNTIF(RC7:RC45;">=0")) -> 0 | AX146: =IF(RC[-3]=" ";0%;RC[-3]/COUNTIF(RC7:RC45;">=0")) -> 0 | AY146: =IF(RC[-3]=" ";0%;RC[-3]/COUNTIF(RC7:RC45;">=0")) -> 1 | AZ146: =IF(RC[-1]>60%;"Completo";IF(RC[-3]>RC[-2]+RC[-1];"No Cumplio";"Incompleto")) -> Completo
C147: IF619BIN | D147: ANÁLISIS DE DATOS EMPRESARIALES | E147: 3 | F147: T / P | K147: 2 | L147: 2 | M147: 2 | N147: 2 | O147: 2 | P147: 2 | Q147: 2 | R147: 2 | S147: 2 | T147: 2 | W147: 2 | X147: 2 | AV147: =IF(COUNTIF(RC7:RC45;2)=0;" ";COUNTIF(RC7:RC45;2)) -> 12 | AW147: =IF(RC[-3]=" ";0%;RC[-3]/COUNTIF(RC7:RC45;">=0")) -> 0 | AX147: =IF(RC[-3]=" ";0%;RC[-3]/COUNTIF(RC7:RC45;">=0")) -> 0 | AY147: =IF(RC[-3]=" ";0%;RC[-3]/COUNTIF(RC7:RC45;">=0")) -> 1 | AZ147: =IF(RC[-1]>60%;"Completo";IF(RC[-3]>RC[-2]+RC[-1];"No Cumplio";"Incompleto")) -> Completo
A148: 47 | B148: JULIO VLADIMIR QUISPE SOTA | C148: IF455BIN | D148: ALGORITMOS PARALELOS Y DISTRIBUIDOS | E148: 4 | F148: T / P | G148: 2 | H148: 0 | I148: 2 | J148: 2 | K148: 1 | R148: 2 | AO148: 2 | AV148: =IF(COUNTIF(RC7:RC45;2)=0;" ";COUNTIF(RC7:RC45;2)) -> 5 | AW148: =IF(RC[-3]=" ";0%;RC[-3]/COUNTIF(RC7:RC45;">=0")) -> 0 | AX148: =IF(RC[-3]=" ";0%;RC[-3]/COUNTIF(RC7:RC45;">=0")) -> 0 | AY148: =IF(RC[-3]=" ";0%;RC[-3]/COUNTIF(RC7:RC45;">=0")) -> 0.714285714285714 | AZ148: =IF(RC[-1]>60%;"Completo";IF(AND(RC[-3]>RC[-2]+RC[-1];RC[-1]<20%);"No Cumplio";"Incompleto")) -> Completo | BA148: =RC[-1] -> Completo
A149: 48 | B149: ÉLIDA FALCÓN HUALLPA | C149: IF107ALI | D149: PROGRAMACION DIGITAL I | E149: 3 | F149: T/P | K149: 2 | L149: 2 | M149: 2 | N149: 2 | S149: 1 | T149: 1 | V149: 1 | AV149: =IF(COUNTIF(RC7:RC45;2)=0;" ";COUNTIF(RC7:RC45;2)) -> 4 | AW149: =IF(RC[-3]=" ";0%;RC[-3]/COUNTIF(RC7:RC45;">=0")) -> 0 | AX149: =IF(RC[-3]=" ";0%;RC[-3]/COUNTIF(RC7:RC45;">=0")) -> 0 | AY149: =IF(RC[-3]=" ";0%;RC[-3]/COUNTIF(RC7:RC45;">=0")) -> 0.571428571428571 | AZ149: =IF(RC[-1]>60%;"Completo";IF(RC[-3]>RC[-2]+RC[-1];"No Cumplio";"Incompleto")) -> Incompleto
A150: 49 | B150: VANESA LAVILLA ALVAREZ | C150: IF550AIN | D150: ORGANIZACION Y ARQUITECTURA DEL COMPUTADOR | E150: 4 | F150: P | G150: 2 | H150: 2 | I150: 2 | J150: 2 | O150: 2 | P150: 2 | AG150: 2 | AH150: 2 | AI150: 2 | AO150: 2 | AV150: =IF(COUNTIF(RC7:RC45;2)=0;" ";COUNTIF(RC7:RC45;2)) -> 10 | AW150: =IF(RC[-3]=" ";0%;RC[-3]/COUNTIF(RC7:RC45;">=0")) -> 0 | AX150: =IF(RC[-3]=" ";0%;RC[-3]/COUNTIF(RC7:RC45;">=0")) -> 0 | AY150: =IF(RC[-3]=" ";0%;RC[-3]/COUNTIF(RC7:RC45;">=0")) -> 1 | AZ150: =IF(RC[-1]>60%;"Completo";IF(RC[-3]>RC[-2]+RC[-1];"No Cumplio";"Incompleto")) -> Completo | BA150: =IF(AND(RC[-1]=R[1]C[-1];RC[-1]=R[2]C[-1];RC[-1]=R[3]C[-1];RC[-1]=R[4]C[-1]);RC[-1];"Incompleto") -> Completo
C151: IF553AIN | D151: LENGUAJE ENSAMBLADOR | E151: 3 | F151: P | G151: 2 | H151: 2 | I151: 2 | J151: 2 | O151: 2 | P151: 2 | AG151: 2 | AH151: 2 | AO151: 2 | AV151: =IF(COUNTIF(RC7:RC45;2)=0;" ";COUNTIF(RC7:RC45;2)) -> 9 | AW151: =IF(RC[-3]=" ";0%;RC[-3]/COUNTIF(RC7:RC45;">=0")) -> 0 | AX151: =IF(RC[-3]=" ";0%;RC[-3]/COUNTIF(RC7:RC45;">=0")) -> 0 | AY151: =IF(RC[-3]=" ";0%;RC[-3]/COUNTIF(RC7:RC45;">=0")) -> 1 | AZ151: =IF(RC[-1]>60%;"Completo";IF(RC[-3]>RC[-2]+RC[-1];"No Cumplio";"Incompleto")) -> Completo
C152: IF758ACI | D152: METODOS NUMERICOS | E152: 3 | F152: P | G152: 2 | H152: 2 | I152: 2 | J152: 2 | O152: 2 | P152: 2 | AG152: 2 | AH152: 2 | AO152: 2 | AV152: =IF(COUNTIF(RC7:RC45;2)=0;" ";COUNTIF(RC7:RC45;2)) -> 9 | AW152: =IF(RC[-3]=" ";0%;RC[-3]/COUNTIF(RC7:RC45;">=0")) -> 0 | AX152: =IF(RC[-3]=" ";0%;RC[-3]/COUNTIF(RC7:RC45;">=0")) -> 0 | AY152: =IF(RC[-3]=" ";0%;RC[-3]/COUNTIF(RC7:RC45;">=0")) -> 1 | AZ152: =IF(RC[-1]>60%;"Completo";IF(RC[-3]>RC[-2]+RC[-1];"No Cumplio";"Incompleto")) -> Completo
C153: IF758ACI | D153: METODOS NUMERICOS | E153: 3 | F153: P | G153: 2 | H153: 2 | I153: 2 | J153: 2 | O153: 2 | P153: 2 | AG153: 2 | AH153: 2 | AO153: 2 | AV153: =IF(COUNTIF(RC7:RC45;2)=0;" ";COUNTIF(RC7:RC45;2)) -> 9 | AW153: =IF(RC[-3]=" ";0%;RC[-3]/COUNTIF(RC7:RC45;">=0")) -> 0 | AX153: =IF(RC[-3]=" ";0%;RC[-3]/COUNTIF(RC7:RC45;">=0")) -> 0 | AY153: =IF(RC[-3]=" ";0%;RC[-3]/COUNTIF(RC7:RC45;">=0")) -> 1 | AZ153: =IF(RC[-1]>60%;"Completo";IF(RC[-3]>RC[-2]+RC[-1];"No Cumplio";"Incompleto")) -> Completo
C154: IF902DEU | D154: TECNOLOGIAS DE LA INFORMACION Y LA COMUNICACIÓN | E154: 3 | F154: P | G154: 2 | H154: 2 | I154: 2 | J154: 2 | O154: 2 | P154: 2 | AG154: 2 | AH154: 2 | AO154: 2 | AV154: =IF(COUNTIF(RC7:RC45;2)=0;" ";COUNTIF(RC7:RC45;2)) -> 9 | AW154: =IF(RC[-3]=" ";0%;RC[-3]/COUNTIF(RC7:RC45;">=0")) -> 0 | AX154: =IF(RC[-3]=" ";0%;RC[-3]/COUNTIF(RC7:RC45;">=0")) -> 0 | AY154: =IF(RC[-3]=" ";0%;RC[-3]/COUNTIF(RC7:RC45;">=0")) -> 1 | AZ154: =IF(RC[-1]>60%;"Completo";IF(RC[-3]>RC[-2]+RC[-1];"No Cumplio";"Incompleto")) -> Completo
C155: IF902AEI / IF902BIN | D155: TECNOLOGIAS DE LA INFORMACION Y LA COMUNICACIÓN | E155: 3 | F155: P | G155: 2 | H155: 2 | I155: 2 | J155: 2 | O155: 2 | P155: 2 | AG155: 2 | AH155: 2 | AO155: 2 | AV155: =IF(COUNTIF(RC7:RC45;2)=0;" ";COUNTIF(RC7:RC45;2)) -> 9 | AW155: =IF(RC[-3]=" ";0%;RC[-3]/COUNTIF(RC7:RC45;">=0")) -> 0 | AX155: =IF(RC[-3]=" ";0%;RC[-3]/COUNTIF(RC7:RC45;">=0")) -> 0 | AY155: =IF(RC[-3]=" ";0%;RC[-3]/COUNTIF(RC7:RC45;">=0")) -> 1 | AZ155: =IF(RC[-1]>60%;"Completo";IF(RC[-3]>RC[-2]+RC[-1];"No Cumplio";"Incompleto")) -> Completo
C156: IF902ALI / IF902AIN | D156: TECNOLOGIAS DE LA INFORMACION Y LA COMUNICACIÓN | E156: 3 | F156: P | G156: 2 | H156: 2 | I156: 2 | J156: 2 | O156: 2 | P156: 2 | AG156: 2 | AH156: 2 | AO156: 2 | AV156: =IF(COUNTIF(RC7:RC45;2)=0;" ";COUNTIF(RC7:RC45;2)) -> 9 | AW156: =IF(RC[-3]=" ";0%;RC[-3]/COUNTIF(RC7:RC45;">=0")) -> 0 | AX156: =IF(RC[-3]=" ";0%;RC[-3]/COUNTIF(RC7:RC45;">=0")) -> 0 | AY156: =IF(RC[-3]=" ";0%;RC[-3]/COUNTIF(RC7:RC45;">=0")) -> 1 | AZ156: =IF(RC[-1]>60%;"Completo";IF(RC[-3]>RC[-2]+RC[-1];"No Cumplio";"Incompleto")) -> Completo
C157: IF902ATU | D157: TECNOLOGIAS DE LA INFORMACION Y LA COMUNICACIÓN | E157: 3 | F157: P | G157: 2 | H157: 2 | I157: 2 | J157: 2 | O157: 2 | P157: 2 | AG157: 2 | AH157: 2 | AO157: 2 | AV157: =IF(COUNTIF(RC7:RC45;2)=0;" ";COUNTIF(RC7:RC45;2)) -> 9 | AW157: =IF(RC[-3]=" ";0%;RC[-3]/COUNTIF(RC7:RC45;">=0")) -> 0 | AX157: =IF(RC[-3]=" ";0%;RC[-3]/COUNTIF(RC7:RC45;">=0")) -> 0 | AY157: =IF(RC[-3]=" ";0%;RC[-3]/COUNTIF(RC7:RC45;">=0")) -> 1 | AZ157: =IF(RC[-1]>60%;"Completo";IF(RC[-3]>RC[-2]+RC[-1];"No Cumplio";"Incompleto")) -> Completo
A158: 50 | B158: LISHA SABAH DÍAZ CACERES | C158: IF063BIN | D158: QUECHUA | E158: 2 | F158: T | G158: 2 | H158: 2 | I158: 2 | J158: 2 | K158: 2 | L158: 2 | M158: 2 | N158: 2 | O158: 2 | P158: 2 | Q158: 2 | R158: 1 | S158: 2 | T158: 2 | V158: 1 | W158: 2 | X158: 2 | Z158: 2 | AA158: 1 | AC158: 2 | AD158: 2 | AO158: 2 | AS158: 2 | AV158: =IF(COUNTIF(RC7:RC45;2)=0;" ";COUNTIF(RC7:RC45;2)) -> 20 | AW158: =IF(RC[-3]=" ";0%;RC[-3]/COUNTIF(RC7:RC45;">=0")) -> 0 | AX158: =IF(RC[-3]=" ";0%;RC[-3]/COUNTIF(RC7:RC45;">=0")) -> 0 | AY158: =IF(RC[-3]=" ";0%;RC[-3]/COUNTIF(RC7:RC45;">=0")) -> 0.869565217391304 | AZ158: =IF(RC[-1]>60%;"Completo";IF(RC[-3]>RC[-2]+RC[-1];"No Cumplio";"Incompleto")) -> Completo | BA158: =IF(AND(RC[-1]=R[1]C[-1];RC[-1]=R[2]C[-1];RC[-1]=R[3]C[-1];RC[-1]=R[5]C[-1]);RC[-1];"Incompleto") -> Completo
C159: IF902AAT | D159: TECNOLOGIAS DE LA INFORMACION Y LA COMUNICACIÓN | E159: 3 | F159: P | G159: 2 | H159: 2 | I159: 2 | J159: 2 | K159: 2 | L159: 2 | M159: 2 | O159: 2 | P159: 2 | W159: 2 | X159: 2 | AG159: 2 | AH159: 2 | AO159: 2 | AP159: 2 | AQ159: 2 | AR159: 2 | AS159: 2 | AV159: =IF(COUNTIF(RC7:RC45;2)=0;" ";COUNTIF(RC7:RC45;2)) -> 18 | AW159: =IF(RC[-3]=" ";0%;RC[-3]/COUNTIF(RC7:RC45;">=0")) -> 0 | AX159: =IF(RC[-3]=" ";0%;RC[-3]/COUNTIF(RC7:RC45;">=0")) -> 0 | AY159: =IF(RC[-3]=" ";0%;RC[-3]/COUNTIF(RC7:RC45;">=0")) -> 1 | AZ159: =IF(RC[-1]>60%;"Completo";IF(RC[-3]>RC[-2]+RC[-1];"No Cumplio";"Incompleto")) -> Completo
C160: IF902ACO | D160: TECNOLOGIAS DE LA INFORMACION Y LA COMUNICACIÓN | E160: 3 | F160: P | G160: 2 | H160: 2 | I160: 2 | J160: 2 | K160: 2 | L160: 2 | M160: 2 | O160: 2 | P160: 2 | W160: 2 | X160: 2 | AG160: 2 | AH160: 2 | AO160: 2 | AP160: 2 | AQ160: 2 | AR160: 2 | AS160: 2 | AV160: =IF(COUNTIF(RC7:RC45;2)=0;" ";COUNTIF(RC7:RC45;2)) -> 18 | AW160: =IF(RC[-3]=" ";0%;RC[-3]/COUNTIF(RC7:RC45;">=0")) -> 0 | AX160: =IF(RC[-3]=" ";0%;RC[-3]/COUNTIF(RC7:RC45;">=0")) -> 0 | AY160: =IF(RC[-3]=" ";0%;RC[-3]/COUNTIF(RC7:RC45;">=0")) -> 1 | AZ160: =IF(RC[-1]>60%;"Completo";IF(RC[-3]>RC[-2]+RC[-1];"No Cumplio";"Incompleto")) -> Completo
C161: IF902CEU | D161: TECNOLOGIAS DE LA INFORMACION Y LA COMUNICACIÓN | E161: 3 | F161: P | G161: 2 | H161: 2 | I161: 2 | J161: 2 | K161: 2 | L161: 2 | M161: 2 | O161: 2 | P161: 2 | W161: 2 | X161: 2 | AG161: 2 | AH161: 2 | AO161: 2 | AP161: 2 | AQ161: 2 | AR161: 2 | AS161: 2 | AV161: =IF(COUNTIF(RC7:RC45;2)=0;" ";COUNTIF(RC7:RC45;2)) -> 18 | AW161: =IF(RC[-3]=" ";0%;RC[-3]/COUNTIF(RC7:RC45;">=0")) -> 0 | AX161: =IF(RC[-3]=" ";0%;RC[-3]/COUNTIF(RC7:RC45;">=0")) -> 0 | AY161: =IF(RC[-3]=" ";0%;RC[-3]/COUNTIF(RC7:RC45;">=0")) -> 1 | AZ161: =IF(RC[-1]>60%;"Completo";IF(RC[-3]>RC[-2]+RC[-1];"No Cumplio";"Incompleto")) -> Completo
C162: IF902AIA / IF902AVS | D162: TECNOLOGIAS DE LA INFORMACION Y LA COMUNICACIÓN | E162: 4 | F162: P | G162: 2 | H162: 2 | I162: 2 | J162: 2 | K162: 2 | L162: 2 | M162: 2 | O162: 2 | P162: 2 | W162: 2 | X162: 2 | AG162: 2 | AH162: 2 | AO162: 2 | AP162: 2 | AQ162: 2 | AR162: 2 | AS162: 2 | AV162: =IF(COUNTIF(RC7:RC45;2)=0;" ";COUNTIF(RC7:RC45;2)) -> 18 | AW162: =IF(RC[-3]=" ";0%;RC[-3]/COUNTIF(RC7:RC45;">=0")) -> 0 | AX162: =IF(RC[-3]=" ";0%;RC[-3]/COUNTIF(RC7:RC45;">=0")) -> 0 | AY162: =IF(RC[-3]=" ";0%;RC[-3]/COUNTIF(RC7:RC45;">=0")) -> 1 | AZ162: =IF(RC[-1]>60%;"Completo";IF(RC[-3]>RC[-2]+RC[-1];"No Cumplio";"Incompleto")) -> Completo
C163: IF902AGI / IF902APQ | D163: TECNOLOGIAS DE LA INFORMACION Y LA COMUNICACIÓN | E163: 3 | F163: P | G163: 2 | H163: 2 | I163: 2 | J163: 2 | K163: 2 | L163: 2 | M163: 2 | O163: 2 | P163: 2 | W163: 2 | X163: 2 | AG163: 2 | AH163: 2 | AO163: 2 | AP163: 2 | AQ163: 2 | AR163: 2 | AS163: 2 | AV163: =IF(COUNTIF(RC7:RC45;2)=0;" ";COUNTIF(RC7:RC45;2)) -> 18 | AW163: =IF(RC[-3]=" ";0%;RC[-3]/COUNTIF(RC7:RC45;">=0")) -> 0 | AX163: =IF(RC[-3]=" ";0%;RC[-3]/COUNTIF(RC7:RC45;">=0")) -> 0 | AY163: =IF(RC[-3]=" ";0%;RC[-3]/COUNTIF(RC7:RC45;">=0")) -> 1 | AZ163: =IF(RC[-1]>60%;"Completo";IF(RC[-3]>RC[-2]+RC[-1];"No Cumplio";"Incompleto")) -> Completo
A164: 51 | B164: MARCIO FERNANDO MERMA QUISPE | C164: IF467AEI | D164: PROGRAMACION DIGITAL | E164: 4 | F164: P | G164: 2 | H164: 2 | I164: 2 | J164: 2 | K164: 2 | L164: 0 | M164: 0 | O164: 2 | P164: 0 | AG164: 2 | AH164: 2 | AO164: 2 | AV164: =IF(COUNTIF(RC7:RC45;2)=0;" ";COUNTIF(RC7:RC45;2)) -> 9 | AW164: =IF(RC[-3]=" ";0%;RC[-3]/COUNTIF(RC7:RC45;">=0")) -> 0 | AX164: =IF(RC[-3]=" ";0%;RC[-3]/COUNTIF(RC7:RC45;">=0")) -> 0 | AY164: =IF(RC[-3]=" ";0%;RC[-3]/COUNTIF(RC7:RC45;">=0")) -> 0.75 | AZ164: =IF(RC[-1]>60%;"Completo";IF(RC[-3]>RC[-2]+RC[-1];"No Cumplio";"Incompleto")) -> Completo | BA164: =IF(AND(RC[-1]=R[1]C[-1];RC[-1]=R[2]C[-1];RC[-1]=R[3]C[-1]);RC[-1];"Incompleto") -> Completo
C165: IF902ADR | D165: TECNOLOGIAS DE LA INFORMACION Y LA COMUNICACIÓN | E165: 3 | F165: P | G165: 2 | H165: 2 | I165: 2 | J165: 2 | K165: 2 | L165: 2 | M165: 2 | O165: 2 | P165: 2 | AG165: 2 | AH165: 2 | AO165: 2 | AV165: =IF(COUNTIF(RC7:RC45;2)=0;" ";COUNTIF(RC7:RC45;2)) -> 12 | AW165: =IF(RC[-3]=" ";0%;RC[-3]/COUNTIF(RC7:RC45;">=0")) -> 0 | AX165: =IF(RC[-3]=" ";0%;RC[-3]/COUNTIF(RC7:RC45;">=0")) -> 0 | AY165: =IF(RC[-3]=" ";0%;RC[-3]/COUNTIF(RC7:RC45;">=0")) -> 1 | AZ165: =IF(RC[-1]>60%;"Completo";IF(RC[-3]>RC[-2]+RC[-1];"No Cumplio";"Incompleto")) -> Completo
C166: IF902AHI | D166: TECNOLOGIAS DE LA INFORMACION Y LA COMUNICACIÓN | E166: 3 | F166: P | G166: 2 | H166: 2 | I166: 2 | J166: 2 | K166: 2 | L166: 2 | M166: 2 | O166: 2 | P166: 2 | AG166: 2 | AH166: 2 | AO166: 2 | AV166: =IF(COUNTIF(RC7:RC45;2)=0;" ";COUNTIF(RC7:RC45;2)) -> 12 | AW166: =IF(RC[-3]=" ";0%;RC[-3]/COUNTIF(RC7:RC45;">=0")) -> 0 | AX166: =IF(RC[-3]=" ";0%;RC[-3]/COUNTIF(RC7:RC45;">=0")) -> 0 | AY166: =IF(RC[-3]=" ";0%;RC[-3]/COUNTIF(RC7:RC45;">=0")) -> 1 | AZ166: =IF(RC[-1]>60%;"Completo";IF(RC[-3]>RC[-2]+RC[-1];"No Cumplio";"Incompleto")) -> Completo
C167: IF902AFO / IF902AVE | D167: TECNOLOGIAS DE LA INFORMACION Y LA COMUNICACIÓN | E167: 3 | F167: P | G167: 2 | H167: 2 | I167: 2 | J167: 2 | K167: 2 | L167: 2 | M167: 2 | O167: 2 | P167: 2 | AG167: 2 | AH167: 2 | AV167: =IF(COUNTIF(RC7:RC45;2)=0;" ";COUNTIF(RC7:RC45;2)) -> 11 | AW167: =IF(RC[-3]=" ";0%;RC[-3]/COUNTIF(RC7:RC45;">=0")) -> 0 | AX167: =IF(RC[-3]=" ";0%;RC[-3]/COUNTIF(RC7:RC45;">=0")) -> 0 | AY167: =IF(RC[-3]=" ";0%;RC[-3]/COUNTIF(RC7:RC45;">=0")) -> 1 | AZ167: =IF(RC[-1]>60%;"Completo";IF(RC[-3]>RC[-2]+RC[-1];"No Cumplio";"Incompleto")) -> Completo
A168: 52 | B168: OLMER CLAUDIO VILLENA LEON | C168: IF060AIN | D168: MUSICA | E168: 2 | F168: P | G168: 2 | H168: 2 | I168: 2 | J168: 2 | K168: 2 | L168: 2 | M168: 0 | O168: 0 | P168: 0 | Z168: 2 | AA168: 2 | AC168: 2 | AD168: 2 | AG168: 1 | AH168: 0 | AV168: =IF(COUNTIF(RC7:RC45;2)=0;" ";COUNTIF(RC7:RC45;2)) -> 10 | AW168: =IF(RC[-3]=" ";0%;RC[-3]/COUNTIF(RC7:RC45;">=0")) -> 0 | AX168: =IF(RC[-3]=" ";0%;RC[-3]/COUNTIF(RC7:RC45;">=0")) -> 0 | AY168: =IF(RC[-3]=" ";0%;RC[-3]/COUNTIF(RC7:RC45;">=0")) -> 0.666666666666667 | AZ168: =IF(RC[-1]>60%;"Completo";IF(AND(RC[-3]>RC[-2]+RC[-1];RC[-1]<20%);"No Cumplio";"Incompleto")) -> Completo | BA168: =IF(AND(RC[-1]=R[1]C[-1];R[2]C[-1]=R[10]C[-1];R[1]C[-1]=R[2]C[-1]);RC[-1];"Incompleto") -> Completo
C169: IF902AAQ | D169: TECNOLOGIAS DE LA INFORMACION Y LA COMUNICACIÓN | E169: 3 | F169: P | G169: 2 | H169: 2 | I169: 2 | J169: 2 | K169: 2 | L169: 2 | M169: 2 | O169: 0 | P169: 2 | AG169: 2 | AH169: 2 | AQ169: 2 | AV169: =IF(COUNTIF(RC7:RC45;2)=0;" ";COUNTIF(RC7:RC45;2)) -> 11 | AW169: =IF(RC[-3]=" ";0%;RC[-3]/COUNTIF(RC7:RC45;">=0")) -> 0 | AX169: =IF(RC[-3]=" ";0%;RC[-3]/COUNTIF(RC7:RC45;">=0")) -> 0 | AY169: =IF(RC[-3]=" ";0%;RC[-3]/COUNTIF(RC7:RC45;">=0")) -> 0.916666666666667 | AZ169: =IF(RC[-1]>60%;"Completo";IF(AND(RC[-3]>RC[-2]+RC[-1];RC[-1]<20%);"No Cumplio";"Incompleto")) -> Completo
C170: IF902AAE / IF902CHI | D170: TECNOLOGIAS DE LA INFORMACION Y LA COMUNICACIÓN | E170: 3 | F170: P | G170: 2 | H170: 2 | I170: 2 | J170: 2 | K170: 2 | L170: 2 | M170: 2 | O170: 0 | P170: 2 | AG170: 2 | AH170: 2 | AQ170: 2 | AV170: =IF(COUNTIF(RC7:RC45;2)=0;" ";COUNTIF(RC7:RC45;2)) -> 11 | AW170: =IF(RC[-3]=" ";0%;RC[-3]/COUNTIF(RC7:RC45;">=0")) -> 0 | AX170: =IF(RC[-3]=" ";0%;RC[-3]/COUNTIF(RC7:RC45;">=0")) -> 0 | AY170: =IF(RC[-3]=" ";0%;RC[-3]/COUNTIF(RC7:RC45;">=0")) -> 0.916666666666667 | AZ170: =IF(RC[-1]>60%;"Completo";IF(AND(RC[-3]>RC[-2]+RC[-1];RC[-1]<20%);"No Cumplio";"Incompleto")) -> Completo
C171: IF902AEE | D171: TECNOLOGIAS DE LA INFORMACION Y LA COMUNICACIÓN | E171: 3 | F171: P | G171: 2 | H171: 2 | I171: 2 | J171: 2 | K171: 2 | L171: 2 | M171: 2 | O171: 0 | P171: 2 | AG171: 2 | AH171: 2 | AQ171: 2 | AV171: =IF(COUNTIF(RC7:RC45;2)=0;" ";COUNTIF(RC7:RC45;2)) -> 11 | AW171: =IF(RC[-3]=" ";0%;RC[-3]/COUNTIF(RC7:RC45;">=0")) -> 0 | AX171: =IF(RC[-3]=" ";0%;RC[-3]/COUNTIF(RC7:RC45;">=0")) -> 0 | AY171: =IF(RC[-3]=" ";0%;RC[-3]/COUNTIF(RC7:RC45;">=0")) -> 0.916666666666667 | AZ171: =IF(RC[-1]>60%;"Completo";IF(AND(RC[-3]>RC[-2]+RC[-1];RC[-1]<20%);"No Cumplio";"Incompleto")) -> Completo
A172: 53 | B172: RAIMAR ABARCA MORA | C172: IF063AIN | D172: QUECHUA | E172: 2 | F172: P | G172: 2 | H172: 2 | I172: 2 | J172: 2 | K172: 2 | L172: 1 | M172: 2 | N172: 2 | O172: 2 | P172: 2 | Q172: 2 | R172: 2 | S172: 2 | T172: 2 | W172: 2 | X172: 2 | Z172: 2 | AA172: 2 | AC172: 2 | AD172: 2 | AG172: 0 | AH172: 0 | AO172: 2 | AS172: 2 | AV172: =IF(COUNTIF(RC7:RC45;2)=0;" ";COUNTIF(RC7:RC45;2)) -> 21 | AW172: =IF(RC[-3]=" ";0%;RC[-3]/COUNTIF(RC7:RC45;">=0")) -> 0 | AX172: =IF(RC[-3]=" ";0%;RC[-3]/COUNTIF(RC7:RC45;">=0")) -> 0 | AY172: =IF(RC[-3]=" ";0%;RC[-3]/COUNTIF(RC7:RC45;">=0")) -> 0.875 | AZ172: =IF(RC[-1]>60%;"Completo";IF(AND(RC[-3]>RC[-2]+RC[-1];RC[-1]<20%);"No Cumplio";"Incompleto")) -> Completo | BA172: =IF(AND(R[-4]C[-1]=R[-3]C[-1];R[-2]C[-1]=R[6]C[-1];R[-3]C[-1]=R[-2]C[-1]);R[-4]C[-1];"Incompleto") -> Completo
A173: 54 | B173: GERAR FRANCIS QUISPE TORRES | C173: IF456AIN | D173: ALGORITMOS AVANZADOS | E173: 4 | F173: T/P | G173: 2 | H173: 2 | I173: 2 | J173: 2 | K173: 2 | L173: 2 | M173: 2 | N173: 2 | O173: 2 | P173: 2 | Q173: 2 | R173: 2 | S173: 2 | T173: 2 | U173: 0 | V173: 0 | W173: 2 | X173: 0 | Y173: 0 | Z173: 2 | AA173: 2 | AB173: 2 | AC173: 2 | AD173: 2 | AE173: 2 | AF173: 2 | AG173: 0 | AH173: 0 | AI173: 0 | AO173: 2 | AV173: =IF(COUNTIF(RC7:RC45;2)=0;" ";COUNTIF(RC7:RC45;2)) -> 23 | AW173: =IF(RC[-3]=" ";0%;RC[-3]/COUNTIF(RC7:RC45;">=0")) -> 0 | AX173: =IF(RC[-3]=" ";0%;RC[-3]/COUNTIF(RC7:RC45;">=0")) -> 0 | AY173: =IF(RC[-3]=" ";0%;RC[-3]/COUNTIF(RC7:RC45;">=0")) -> 0.766666666666667 | AZ173: =IF(RC[-1]>60%;"Completo";IF(AND(RC[-3]>RC[-2]+RC[-1];RC[-1]<20%);"No Cumplio";"Incompleto")) -> Completo | BA173: =IF(AND(R[-5]C[-1]=R[-4]C[-1];R[-3]C[-1]=R[5]C[-1];R[-4]C[-1]=R[-3]C[-1]);R[-5]C[-1];"Incompleto") -> Completo
C174: IF614AIN | D174: INGENIERIA DE SOFTWARE I | E174: 4 | F174: P | G174: 2 | H174: 2 | I174: 2 | J174: 2 | K174: 2 | L174: 2 | M174: 2 | N174: 0 | O174: 0 | P174: 2 | Q174: 2 | R174: 0 | S174: 0 | T174: 0 | U174: 0 | V174: 0 | W174: 0 | X174: 0 | Y174: 0 | Z174: 0 | AA174: 0 | AB174: 0 | AC174: 2 | AD174: 2 | AG174: 0 | AH174: 0 | AO174: 2 | AV174: =IF(COUNTIF(RC7:RC45;2)=0;" ";COUNTIF(RC7:RC45;2)) -> 12 | AW174: =IF(RC[-3]=" ";0%;RC[-3]/COUNTIF(RC7:RC45;">=0")) -> 0 | AX174: =IF(RC[-3]=" ";0%;RC[-3]/COUNTIF(RC7:RC45;">=0")) -> 0 | AY174: =IF(RC[-3]=" ";0%;RC[-3]/COUNTIF(RC7:RC45;">=0")) -> 0.444444444444444 | AZ174: =IF(RC[-1]>60%;"Completo";IF(AND(RC[-3]>RC[-2]+RC[-1];RC[-1]<20%);"No Cumplio";"Incompleto")) -> Incompleto
C175: IF902BEU | D175: TECNOLOGIAS DE LA INFORMACION Y LA COMUNICACIÓN | E175: 3 | F175: P | G175: 2 | H175: 2 | I175: 2 | J175: 2 | K175: 0 | L175: 2 | M175: 2 | N175: 0 | O175: 2 | P175: 2 | Q175: 0 | R175: 0 | S175: 0 | T175: 0 | U175: 0 | V175: 0 | W175: 0 | X175: 0 | Y175: 0 | Z175: 0 | AA175: 0 | AB175: 0 | AC175: 2 | AD175: 2 | AG175: 0 | AH175: 0 | AO175: 0 | AV175: =IF(COUNTIF(RC7:RC45;2)=0;" ";COUNTIF(RC7:RC45;2)) -> 10 | AW175: =IF(RC[-3]=" ";0%;RC[-3]/COUNTIF(RC7:RC45;">=0")) -> 0 | AX175: =IF(RC[-3]=" ";0%;RC[-3]/COUNTIF(RC7:RC45;">=0")) -> 0 | AY175: =IF(RC[-3]=" ";0%;RC[-3]/COUNTIF(RC7:RC45;">=0")) -> 0.37037037037037 | AZ175: =IF(RC[-1]>60%;"Completo";IF(AND(RC[-3]>RC[-2]+RC[-1];RC[-1]<20%);"No Cumplio";"Incompleto")) -> Incompleto
A176: 55 | B176: JONEL CCENTE ZUZUNAGA | C176: IF902BEN / IF902AQF | D176: TECNOLOGIAS DE LA INFORMACION Y LA COMUNICACIÓN | E176: 3 | F176: P | G176: 2 | H176: 2 | I176: 2 | J176: 2 | M176: 2 | O176: 2 | AG176: 2 | AH176: 2 | AV176: =IF(COUNTIF(RC7:RC45;2)=0;" ";COUNTIF(RC7:RC45;2)) -> 8 | AW176: =IF(RC[-3]=" ";0%;RC[-3]/COUNTIF(RC7:RC45;">=0")) -> 0 | AX176: =IF(RC[-3]=" ";0%;RC[-3]/COUNTIF(RC7:RC45;">=0")) -> 0 | AY176: =IF(RC[-3]=" ";0%;RC[-3]/COUNTIF(RC7:RC45;">=0")) -> 1 | AZ176: =IF(RC[-1]>60%;"Completo";IF(AND(RC[-3]>RC[-2]+RC[-1];RC[-1]<20%);"No Cumplio";"Incompleto")) -> Completo | BA176: =IF(AND(R[-8]C[-1]=R[-7]C[-1];R[-6]C[-1]=R[2]C[-1];R[-7]C[-1]=R[-6]C[-1]);R[-8]C[-1];"Incompleto") -> Completo
C177: IF902AMT / IF902BQM | D177: TECNOLOGIAS DE LA INFORMACION Y LA COMUNICACIÓN | E177: 3 | F177: T | G177: 2 | H177: 2 | I177: 2 | J177: 2 | K177: 2 | L177: 2 | M177: 2 | N177: 2 | O177: 2 | Q177: 2 | R177: 1 | S177: 2 | T177: 2 | W177: 2 | X177: 2 | Z177: 2 | AA177: 2 | AC177: 2 | AD177: 2 | AO177: 2 | AV177: =IF(COUNTIF(RC7:RC45;2)=0;" ";COUNTIF(RC7:RC45;2)) -> 19 | AW177: =IF(RC[-3]=" ";0%;RC[-3]/COUNTIF(RC7:RC45;">=0")) -> 0 | AX177: =IF(RC[-3]=" ";0%;RC[-3]/COUNTIF(RC7:RC45;">=0")) -> 0 | AY177: =IF(RC[-3]=" ";0%;RC[-3]/COUNTIF(RC7:RC45;">=0")) -> 0.95 | AZ177: =IF(RC[-1]>60%;"Completo";IF(AND(RC[-3]>RC[-2]+RC[-1];RC[-1]<20%);"No Cumplio";"Incompleto")) -> Completo
A178: 56 | B178: STEPHAN JHOEL COSIO LOAIZA | C178: IF483BIN | D178: FORMULACION DE PROYECTOS DE TECNOLOGIAS DE LA INFORMACION | E178: 3 | F178: T/P | G178: 2 | H178: 2 | I178: 2 | J178: 2 | K178: 2 | L178: 2 | M178: 2 | N178: 2 | O178: 2 | P178: 2 | R178: 2 | S178: 2 | T178: 2 | W178: 2 | X178: 2 | Z178: 2 | AA178: 2 | AC178: 2 | AD178: 2 | AO178: 2 | AV178: =IF(COUNTIF(RC7:RC45;2)=0;" ";COUNTIF(RC7:RC45;2)) -> 20 | AW178: =IF(RC[-3]=" ";0%;RC[-3]/COUNTIF(RC7:RC45;">=0")) -> 0 | AX178: =IF(RC[-3]=" ";0%;RC[-3]/COUNTIF(RC7:RC45;">=0")) -> 0 | AY178: =IF(RC[-3]=" ";0%;RC[-3]/COUNTIF(RC7:RC45;">=0")) -> 1 | AZ178: =IF(RC[-1]>60%;"Completo";IF(AND(RC[-3]>RC[-2]+RC[-1];RC[-1]<20%);"No Cumplio";"Incompleto")) -> Completo | BA178: =IF(AND(R[-10]C[-1]=R[-9]C[-1];R[-8]C[-1]=RC[-1];R[-9]C[-1]=R[-8]C[-1]);R[-10]C[-1];"Incompleto") -> Completo
A179: 57 | B179: LUZ INDIRA TICONA FÉLIX | C179: IF470AME | D179: LENGUAJE DE PROGRAMACION | E179: 4 | F179: P | G179: 2 | H179: 2 | I179: 2 | J179: 2 | K179: 2 | L179: 2 | M179: 2 | O179: 2 | P179: 2 | AG179: 2 | AH179: 2 | AI179: 2 | AO179: 2 | AV179: =IF(COUNTIF(RC7:RC45;2)=0;" ";COUNTIF(RC7:RC45;2)) -> 13 | AW179: =IF(RC[-3]=" ";0%;RC[-3]/COUNTIF(RC7:RC45;">=0")) -> 0 | AX179: =IF(RC[-3]=" ";0%;RC[-3]/COUNTIF(RC7:RC45;">=0")) -> 0 | AY179: =IF(RC[-3]=" ";0%;RC[-3]/COUNTIF(RC7:RC45;">=0")) -> 1 | AZ179: =IF(RC[-1]>60%;"Completo";IF(AND(RC[-3]>RC[-2]+RC[-1];RC[-1]<20%);"No Cumplio";"Incompleto")) -> Completo | BA179: =IF(AND(R[-11]C[-1]=R[-10]C[-1];R[-9]C[-1]=R[-1]C[-1];R[-10]C[-1]=R[-9]C[-1]);R[-11]C[-1];"Incompleto") -> Completo
C180: IF656AIN | D180: PROCESAMIENTO DE LENGUAJE NATURAL | E180: 4 | F180: P | G180: 2 | H180: 2 | I180: 2 | J180: 2 | K180: 2 | L180: 2 | M180: 2 | O180: 2 | P180: 2 | AG180: 2 | AH180: 2 | AI180: 2 | AO180: 2 | AV180: =IF(COUNTIF(RC7:RC45;2)=0;" ";COUNTIF(RC7:RC45;2)) -> 13 | AW180: =IF(RC[-3]=" ";0%;RC[-3]/COUNTIF(RC7:RC45;">=0")) -> 0 | AX180: =IF(RC[-3]=" ";0%;RC[-3]/COUNTIF(RC7:RC45;">=0")) -> 0 | AY180: =IF(RC[-3]=" ";0%;RC[-3]/COUNTIF(RC7:RC45;">=0")) -> 1 | AZ180: =IF(RC[-1]>60%;"Completo";IF(AND(RC[-3]>RC[-2]+RC[-1];RC[-1]<20%);"No Cumplio";"Incompleto")) -> Completo
C181: IF902AAO / IF902AZO | D181: TECNOLOGIAS DE LA INFORMACION Y LA COMUNICACIÓN | E181: 3 | F181: P | G181: 2 | H181: 2 | I181: 2 | J181: 2 | K181: 2 | L181: 2 | M181: 2 | O181: 2 | P181: 2 | AG181: 2 | AH181: 2 | AO181: 2 | AV181: =IF(COUNTIF(RC7:RC45;2)=0;" ";COUNTIF(RC7:RC45;2)) -> 12 | AW181: =IF(RC[-3]=" ";0%;RC[-3]/COUNTIF(RC7:RC45;">=0")) -> 0 | AX181: =IF(RC[-3]=" ";0%;RC[-3]/COUNTIF(RC7:RC45;">=0")) -> 0 | AY181: =IF(RC[-3]=" ";0%;RC[-3]/COUNTIF(RC7:RC45;">=0")) -> 1 | AZ181: =IF(RC[-1]>60%;"Completo";IF(AND(RC[-3]>RC[-2]+RC[-1];RC[-1]<20%);"No Cumplio";"Incompleto")) -> Completo
C182: IF902AEI / IF902BIN | D182: TECNOLOGIAS DE LA INFORMACION Y LA COMUNICACIÓN | E182: 3 | F182: P | G182: 2 | H182: 2 | I182: 2 | J182: 2 | K182: 2 | L182: 2 | M182: 2 | O182: 2 | P182: 2 | AG182: 2 | AH182: 2 | AO182: 2 | AV182: =IF(COUNTIF(RC7:RC45;2)=0;" ";COUNTIF(RC7:RC45;2)) -> 12 | AW182: =IF(RC[-3]=" ";0%;RC[-3]/COUNTIF(RC7:RC45;">=0")) -> 0 | AX182: =IF(RC[-3]=" ";0%;RC[-3]/COUNTIF(RC7:RC45;">=0")) -> 0 | AY182: =IF(RC[-3]=" ";0%;RC[-3]/COUNTIF(RC7:RC45;">=0")) -> 1 | AZ182: =IF(RC[-1]>60%;"Completo";IF(AND(RC[-3]>RC[-2]+RC[-1];RC[-1]<20%);"No Cumplio";"Incompleto")) -> Completo
A183: 58 | B183: EDELMIRA DAVILA ANDRADE | C183: IF471AME | D183: METODOS NUMERICOS | E183: 3 | F183: P | G183: 2 | H183: 2 | I183: 2 | J183: 2 | K183: 2 | L183: 2 | M183: 2 | O183: 2 | P183: 2 | AG183: 2 | AH183: 2 | AV183: =IF(COUNTIF(RC7:RC45;2)=0;" ";COUNTIF(RC7:RC45;2)) -> 11 | AW183: =IF(R[-7]C[-3]=" ";0%;R[-7]C[-3]/COUNTIF(R[-7]C7:R[-7]C45;">=0")) -> 0 | AX183: =IF(R[-7]C[-3]=" ";0%;R[-7]C[-3]/COUNTIF(R[-7]C7:R[-7]C45;">=0")) -> 0 | AY183: =IF(R[-7]C[-3]=" ";0%;R[-7]C[-3]/COUNTIF(R[-7]C7:R[-7]C45;">=0")) -> 1 | AZ183: =IF(RC[-1]>60%;"Completo";IF(AND(RC[-3]>RC[-2]+RC[-1];RC[-1]<20%);"No Cumplio";"Incompleto")) -> Completo | BA183: =IF(AND(R[-15]C[-1]=R[-14]C[-1];R[-13]C[-1]=R[-5]C[-1];R[-14]C[-1]=R[-13]C[-1]);R[-15]C[-1];"Incompleto") -> Completo
C184: IF556AIN | D184: SISTEMAS EMBEBIDOS | E184: 4 | F184: P | G184: 2 | H184: 2 | I184: 2 | J184: 2 | K184: 2 | L184: 2 | M184: 2 | O184: 2 | P184: 2 | AG184: 2 | AH184: 2 | AI184: 2 | AV184: =IF(COUNTIF(RC7:RC45;2)=0;" ";COUNTIF(RC7:RC45;2)) -> 12 | AW184: =IF(R[-7]C[-3]=" ";0%;R[-7]C[-3]/COUNTIF(R[-7]C7:R[-7]C45;">=0")) -> 0 | AX184: =IF(R[-7]C[-3]=" ";0%;R[-7]C[-3]/COUNTIF(R[-7]C7:R[-7]C45;">=0")) -> 0 | AY184: =IF(R[-7]C[-3]=" ";0%;R[-7]C[-3]/COUNTIF(R[-7]C7:R[-7]C45;">=0")) -> 0.95 | AZ184: =IF(RC[-1]>60%;"Completo";IF(AND(RC[-3]>RC[-2]+RC[-1];RC[-1]<20%);"No Cumplio";"Incompleto")) -> Completo
C185: IF902AIA / IF902AVS | D185: TECNOLOGIAS DE LA INFORMACION Y LA COMUNICACIÓN | E185: 3 | F185: P | G185: 2 | H185: 2 | I185: 2 | J185: 2 | K185: 2 | L185: 2 | M185: 2 | O185: 2 | P185: 2 | AG185: 2 | AH185: 2 | AV185: =IF(COUNTIF(RC7:RC45;2)=0;" ";COUNTIF(RC7:RC45;2)) -> 11 | AW185: =IF(R[-7]C[-3]=" ";0%;R[-7]C[-3]/COUNTIF(R[-7]C7:R[-7]C45;">=0")) -> 0 | AX185: =IF(R[-7]C[-3]=" ";0%;R[-7]C[-3]/COUNTIF(R[-7]C7:R[-7]C45;">=0")) -> 0 | AY185: =IF(R[-7]C[-3]=" ";0%;R[-7]C[-3]/COUNTIF(R[-7]C7:R[-7]C45;">=0")) -> 1 | AZ185: =IF(RC[-1]>60%;"Completo";IF(AND(RC[-3]>RC[-2]+RC[-1];RC[-1]<20%);"No Cumplio";"Incompleto")) -> Completo
C186: IF902AMT / IF902BQM | D186: TECNOLOGIAS DE LA INFORMACION Y LA COMUNICACIÓN | E186: 3 | F186: P | G186: 2 | H186: 2 | I186: 2 | J186: 2 | K186: 2 | L186: 2 | M186: 2 | O186: 2 | P186: 2 | AG186: 2 | AH186: 2 | AV186: =IF(COUNTIF(RC7:RC45;2)=0;" ";COUNTIF(RC7:RC45;2)) -> 11 | AW186: =IF(R[-7]C[-3]=" ";0%;R[-7]C[-3]/COUNTIF(R[-7]C7:R[-7]C45;">=0")) -> 0 | AX186: =IF(R[-7]C[-3]=" ";0%;R[-7]C[-3]/COUNTIF(R[-7]C7:R[-7]C45;">=0")) -> 0 | AY186: =IF(R[-7]C[-3]=" ";0%;R[-7]C[-3]/COUNTIF(R[-7]C7:R[-7]C45;">=0")) -> 1 | AZ186: =IF(RC[-1]>60%;"Completo";IF(AND(RC[-3]>RC[-2]+RC[-1];RC[-1]<20%);"No Cumplio";"Incompleto")) -> Completo
AV187: =IF(COUNTIF(RC7:RC45;2)=0;" ";COUNTIF(RC7:RC45;2)) -> 
B190: Calificación | C190: Cursos | D190: Docentes
B191: Completo | C191: =COUNTIF(R[-185]C52:R[-4]C52;"Completo") -> 163 | D191: =COUNTIF(R[-185]C53:R[-4]C53;"Completo") -> 52 | E191: =RC[-1]/58 -> 0.896551724137931
B192: Incompleto () | C192: =COUNTIF(R[-186]C52:R[-5]C52;"Incompleto") -> 13 | D192: =COUNTIF(R[-186]C53:R[-5]C53;"Incompleto") -> 2 | E192: =RC[-1]/58 -> 0.0344827586206897
B193: No cumplio | C193: =COUNTIF(R[-187]C52:R[-6]C52;"No Cumplio") -> 2 | D193: =COUNTIF(R[-187]C53:R[-6]C53;"No Cumplio") -> 1 | E193: =RC[-1]/58 -> 0.0172413793103448

Sheet: Carga docente 2022-2
D1: CARGA ACADÉMICA DEFINITIVA 2022-II POR DOCENTES
A3: CARRERA | D3: PR-DE | E3: LAURO ENCISO RODAS | F3: CRED. | G3: TIPO | H3: GPO | I3: HT | J3: HP | K3: DIA | L3: HR-INICIO | M3: HR-FIN | N3: AULA | O3: MATRICULADOS
A4: INGENIERIA INFORMATICA | C4: 60 | D4: IF456BIN | E4: ALGORITMOS AVANZADOS | F4: 4 | G4: T | H4: B | I4: 2 | J4: 0 | K4: MIÉRCOLES | L4: 18 | M4: 20 | N4: IN202 | O4: 8 | P4: 2 | Q4: 0
A5: INGENIERIA INFORMATICA | C5: 61 | D5: IF456BIN | E5: ALGORITMOS AVANZADOS | F5: 4 | G5: T | H5: B | I5: 1 | J5: 0 | K5: VIERNES | L5: 18 | M5: 19 | N5: IN202 | O5: 8 | P5: 1 | Q5: 0
A6: INGENIERIA INFORMATICA | C6: 62 | D6: IF456BIN | E6: ALGORITMOS AVANZADOS | F6: 4 | G6: P | H6: A | I6: 0 | J6: 2 | K6: LUNES | L6: 18 | M6: 20 | N6: LAB301 | O6: 8 | P6: 0 | Q6: 2
A7: INGENIERIA INFORMATICA | C7: 184 | D7: IF650AIN | E7: MODELOS PROBABILISTICOS | F7: 4 | G7: T | H7: A | I7: 2 | J7: 0 | K7: MARTES | L7: 9 | M7: 11 | N7: IN108 | O7: 31 | P7: 2 | Q7: 0
A8: INGENIERIA INFORMATICA | C8: 185 | D8: IF650AIN | E8: MODELOS PROBABILISTICOS | F8: 4 | G8: T | H8: A | I8: 1 | J8: 0 | K8: VIERNES | L8: 10 | M8: 11 | N8: IN108 | O8: 31 | P8: 1 | Q8: 0
A9: INGENIERIA INFORMATICA | C9: 186 | D9: IF650AIN | E9: MODELOS PROBABILISTICOS | F9: 4 | G9: P | H9: A | I9: 0 | J9: 2 | K9: JUEVES | L9: 9 | M9: 11 | N9: IN108 | O9: 31 | P9: 0 | Q9: 2
G10: SUBTOTAL: | I10: 6 | J10: 4 | L10: TOTAL HRS: | M10: 10 | P10: 6 | Q10: 4
P11: 0 | Q11: 0
A12: CARRERA | D12: PR-DE | E12: JULIO CÉSAR CARBAJAL LUNA | F12: CRED. | G12: TIPO | H12: GPO | I12: HT | J12: HP | K12: DIA | L12: HR-INICIO | M12: HR-FIN | N12: AULA | O12: MATRICULADOS | P12: HT | Q12: HP
A13: INGENIERIA INFORMATICA | C13: 204 | D13: IF653AIN | E13: MINERIA DE DATOS | F13: 4 | G13: T | H13: A | I13: 2 | J13: 0 | K13: MARTES | L13: 7 | M13: 9 | N13: IN206 | O13: 23 | P13: 2 | Q13: 0
A14: INGENIERIA INFORMATICA | C14: 205 | D14: IF653AIN | E14: MINERIA DE DATOS | F14: 4 | G14: T | H14: A | I14: 1 | J14: 0 | K14: VIERNES | L14: 7 | M14: 8 | N14: IN206 | O14: 23 | P14: 1 | Q14: 0
A15: INGENIERIA INFORMATICA | C15: 206 | D15: IF653AIN | E15: MINERIA DE DATOS | F15: 4 | G15: P | H15: A | I15: 0 | J15: 2 | K15: JUEVES | L15: 7 | M15: 9 | N15: LAB303 | O15: 23 | P15: 0 | Q15: 2
A16: INGENIERIA INFORMATICA | C16: 228 | D16: IF664AIN | E16: BIOINFORMATICA | F16: 4 | G16: T | H16: A | I16: 2 | J16: 0 | K16: MARTES | L16: 9 | M16: 11 | N16: IN202 | O16: 13 | P16: 2 | Q16: 0
A17: INGENIERIA INFORMATICA | C17: 229 | D17: IF664AIN | E17: BIOINFORMATICA | F17: 4 | G17: T | H17: A | I17: 1 | J17: 0 | K17: VIERNES | L17: 9 | M17: 10 | N17: IN203 | O17: 13 | P17: 1 | Q17: 0
A18: INGENIERIA INFORMATICA | C18: 230 | D18: IF664AIN | E18: BIOINFORMATICA | F18: 4 | G18: P | H18: A | I18: 0 | J18: 2 | K18: JUEVES | L18: 9 | M18: 11 | N18: LAB303 | O18: 13 | P18: 0 | Q18: 2
G19: SUBTOTAL: | I19: 6 | J19: 4 | L19: TOTAL HRS: | M19: 10 | P19: 6 | Q19: 4
P20: 0 | Q20: 0
A21: CARRERA | D21: PR-DE | E21: NILA ZONIA ACURIO USCA | F21: CRED. | G21: TIPO | H21: GPO | I21: HT | J21: HP | K21: DIA | L21: HR-INICIO | M21: HR-FIN | N21: AULA | O21: MATRICULADOS | P21: HT | Q21: HP
A22: INGENIERIA INFORMATICA | C22: 27 | D22: IF450BIN | E22: ABSTRACCION DE DATOS Y OBJETOS | F22: 4 | G22: T | H22: B | I22: 2 | J22: 0 | K22: LUNES | L22: 16 | M22: 18 | N22: LAB305 | O22: 16 | P22: 2 | Q22: 0
A23: INGENIERIA INFORMATICA | C23: 28 | D23: IF450BIN | E23: ABSTRACCION DE DATOS Y OBJETOS | F23: 4 | G23: T | H23: B | I23: 1 | J23: 0 | K23: VIERNES | L23: 17 | M23: 18 | N23: LAB305 | O23: 16 | P23: 1 | Q23: 0
A24: INGENIERIA INFORMATICA | C24: 29 | D24: IF450BIN | E24: ABSTRACCION DE DATOS Y OBJETOS | F24: 4 | G24: P | H24: A | I24: 0 | J24: 2 | K24: MIÉRCOLES | L24: 16 | M24: 18 | N24: LAB305 | O24: 16 | P24: 0 | Q24: 2
A25: INGENIERIA INFORMATICA | C25: 87 | D25: IF468AIN | E25: FUNDAMENTOS DE LA PROGRAMACION | F25: 4 | G25: T | H25: A | I25: 2 | J25: 0 | K25: LUNES | L25: 9 | M25: 11 | N25: IN102 | O25: 35 | P25: 2 | Q25: 0
A26: INGENIERIA INFORMATICA | C26: 88 | D26: IF468AIN | E26: FUNDAMENTOS DE LA PROGRAMACION | F26: 4 | G26: T | H26: A | I26: 1 | J26: 0 | K26: VIERNES | L26: 9 | M26: 10 | N26: IN102 | O26: 35 | P26: 1 | Q26: 0
A27: INGENIERIA INFORMATICA | C27: 89 | D27: IF468AIN | E27: FUNDAMENTOS DE LA PROGRAMACION | F27: 4 | G27: P | H27: A | I27: 0 | J27: 2 | K27: MIÉRCOLES | L27: 9 | M27: 11 | N27: LAB301 | O27: 35 | P27: 0 | Q27: 2
G28: SUBTOTAL: | I28: 6 | J28: 4 | L28: TOTAL HRS: | M28: 10 | P28: 6 | Q28: 4
P29: 0 | Q29: 0
A30: CARRERA | D30: PR-DE | E30: JAVIER ARTURO ROZAS HUACHO | F30: CRED. | G30: TIPO | H30: GPO | I30: HT | J30: HP | K30: DIA | L30: HR-INICIO | M30: HR-FIN | N30: AULA | O30: MATRICULADOS | P30: HT | Q30: HP
A31: INGENIERIA INFORMATICA | C31: 24 | D31: IF450AIN | E31: ABSTRACCION DE DATOS Y OBJETOS | F31: 4 | G31: T | H31: A | I31: 2 | J31: 0 | K31: MARTES | L31: 9 | M31: 11 | N31: IN103 | O31: 39 | P31: 2 | Q31: 0
A32: INGENIERIA INFORMATICA | C32: 25 | D32: IF450AIN | E32: ABSTRACCION DE DATOS Y OBJETOS | F32: 4 | G32: T | H32: A | I32: 1 | J32: 0 | K32: VIERNES | L32: 9 | M32: 10 | N32: IN103 | O32: 39 | P32: 1 | Q32: 0
A33: INGENIERIA INFORMATICA | C33: 26 | D33: IF450AIN | E33: ABSTRACCION DE DATOS Y OBJETOS | F33: 4 | G33: P | H33: A | I33: 0 | J33: 2 | K33: JUEVES | L33: 9 | M33: 11 | N33: IN103 | O33: 39 | P33: 0 | Q33: 2
A34: INGENIERIA INFORMATICA | C34: 190 | D34: IF651AIN | E34: INTELIGENCIA ARTIFICIAL | F34: 4 | G34: T | H34: A | I34: 2 | J34: 0 | K34: MIÉRCOLES | L34: 9 | M34: 11 | N34: IN202 | O34: 35 | P34: 2 | Q34: 0
A35: INGENIERIA INFORMATICA | C35: 191 | D35: IF651AIN | E35: INTELIGENCIA ARTIFICIAL | F35: 4 | G35: T | H35: A | I35: 1 | J35: 0 | K35: VIERNES | L35: 10 | M35: 11 | N35: IN202 | O35: 35 | P35: 1 | Q35: 0
A36: INGENIERIA INFORMATICA | C36: 192 | D36: IF651AIN | E36: INTELIGENCIA ARTIFICIAL | F36: 4 | G36: P | H36: A | I36: 0 | J36: 2 | K36: LUNES | L36: 9 | M36: 11 | N36: LAB301 | O36: 18 | P36: 0 | Q36: 2
G37: SUBTOTAL: | I37: 6 | J37: 4 | L37: TOTAL HRS: | M37: 10 | P37: 6 | Q37: 4
P38: 0 | Q38: 0
A39: CARRERA | D39: PR-TC | E39: LINO PRISCILIANO FLORES PACHECO | F39: CRED. | G39: TIPO | H39: GPO | I39: HT | J39: HP | K39: DIA | L39: HR-INICIO | M39: HR-FIN | N39: AULA | O39: MATRICULADOS | P39: HT | Q39: HP
A40: INGENIERIA INFORMATICA | C40: 197 | D40: IF652AIN | E40: APRENDIZAJE AUTOMATICO | F40: 4 | G40: T | H40: A | I40: 2 | J40: 0 | K40: LUNES | L40: 9 | M40: 11 | N40: IN203 | O40: 28 | P40: 2 | Q40: 0
A41: INGENIERIA INFORMATICA | C41: 198 | D41: IF652AIN | E41: APRENDIZAJE AUTOMATICO | F41: 4 | G41: T | H41: A | I41: 1 | J41: 0 | K41: VIERNES | L41: 10 | M41: 11 | N41: IN203 | O41: 28 | P41: 1 | Q41: 0
A42: INGENIERIA INFORMATICA | C42: 199 | D42: IF652AIN | E42: APRENDIZAJE AUTOMATICO | F42: 4 | G42: P | H42: A | I42: 0 | J42: 2 | K42: MIÉRCOLES | L42: 9 | M42: 11 | N42: LAB305 | O42: 14 | P42: 0 | Q42: 2
A43: INGENIERIA INFORMATICA | C43: 201 | D43: IF652BIN | E43: APRENDIZAJE AUTOMATICO | F43: 4 | G43: T | H43: B | I43: 2 | J43: 0 | K43: MARTES | L43: 16 | M43: 18 | N43: IN203 | O43: 29 | P43: 2 | Q43: 0
A44: INGENIERIA INFORMATICA | C44: 202 | D44: IF652BIN | E44: APRENDIZAJE AUTOMATICO | F44: 4 | G44: T | H44: B | I44: 1 | J44: 0 | K44: VIERNES | L44: 17 | M44: 18 | N44: IN203 | O44: 29 | P44: 1 | Q44: 0
A45: INGENIERIA INFORMATICA | C45: 203 | D45: IF652BIN | E45: APRENDIZAJE AUTOMATICO | F45: 4 | G45: P | H45: A | I45: 0 | J45: 2 | K45: JUEVES | L45: 16 | M45: 18 | N45: LAB302 | O45: 29 | P45: 0 | Q45: 2
G46: SUBTOTAL: | I46: 6 | J46: 4 | L46: TOTAL HRS: | M46: 10 | P46: 6 | Q46: 4
P47: 0 | Q47: 0
A48: CARRERA | D48: PR-TC | E48: EDWIN CARRASCO POBLETE | F48: CRED. | G48: TIPO | H48: GPO | I48: HT | J48: HP | K48: DIA | L48: HR-INICIO | M48: HR-FIN | N48: AULA | O48: MATRICULADOS | P48: HT | Q48: HP
A49: INGENIERIA INFORMATICA | C49: 116 | D49: IF550AIN | E49: ORGANIZACION Y ARQUITECTURA DEL COMPUTADOR | F49: 4 | G49: T | H49: A | I49: 2 | J49: 0 | K49: LUNES | L49: 9 | M49: 11 | N49: IN108 | O49: 35 | P49: 2 | Q49: 0
A50: INGENIERIA INFORMATICA | C50: 117 | D50: IF550AIN | E50: ORGANIZACION Y ARQUITECTURA DEL COMPUTADOR | F50: 4 | G50: T | H50: A | I50: 1 | J50: 0 | K50: VIERNES | L50: 9 | M50: 10 | N50: IN108 | O50: 35 | P50: 1 | Q50: 0
A51: INGENIERIA INFORMATICA | C51: 118 | D51: IF550AIN | E51: ORGANIZACION Y ARQUITECTURA DEL COMPUTADOR | F51: 4 | G51: P | H51: A | I51: 0 | J51: 2 | K51: MIÉRCOLES | L51: 9 | M51: 11 | N51: LAB309 | O51: 20 | P51: 0 | Q51: 2
A52: INGENIERIA INFORMATICA | C52: 120 | D52: IF551AIN | E52: SISTEMAS OPERATIVOS | F52: 4 | G52: T | H52: A | I52: 2 | J52: 0 | K52: LUNES | L52: 7 | M52: 9 | N52: IN201 | O52: 9 | P52: 2 | Q52: 0
A53: INGENIERIA INFORMATICA | C53: 121 | D53: IF551AIN | E53: SISTEMAS OPERATIVOS | F53: 4 | G53: T | H53: A | I53: 1 | J53: 0 | K53: VIERNES | L53: 8 | M53: 9 | N53: IN201 | O53: 9 | P53: 1 | Q53: 0
A54: INGENIERIA INFORMATICA | C54: 122 | D54: IF551AIN | E54: SISTEMAS OPERATIVOS | F54: 4 | G54: P | H54: A | I54: 0 | J54: 2 | K54: MIÉRCOLES | L54: 7 | M54: 9 | N54: LAB301 | O54: 9 | P54: 0 | Q54: 2
G55: SUBTOTAL: | I55: 6 | J55: 4 | L55: TOTAL HRS: | M55: 10 | P55: 6 | Q55: 4
P56: 0 | Q56: 0
A57: CARRERA | D57: PR-TC | E57: EMILIO PALOMINO OLIVERA | F57: CRED. | G57: TIPO | H57: GPO | I57: HT | J57: HP | K57: DIA | L57: HR-INICIO | M57: HR-FIN | N57: AULA | O57: MATRICULADOS | P57: HT | Q57: HP
A58: INGENIERIA INFORMATICA | C58: 110 | D58: IF483AIN | E58: FORMULACION DE PROYECTOS DE TECNOLOGIAS DE LA INFORMACION | F58: 3 | G58: T | H58: A | I58: 2 | J58: 0 | K58: LUNES | L58: 7 | M58: 9 | N58: IN206 | O58: 45 | P58: 2 | Q58: 0
A59: INGENIERIA INFORMATICA | C59: 111 | D59: IF483AIN | E59: FORMULACION DE PROYECTOS DE TECNOLOGIAS DE LA INFORMACION | F59: 3 | G59: P | H59: A | I59: 0 | J59: 2 | K59: MIÉRCOLES | L59: 7 | M59: 9 | N59: IN206 | O59: 45 | P59: 0 | Q59: 2
A60: INGENIERIA INFORMATICA | C60: 133 | D60: IF553AIN | E60: LENGUAJE ENSAMBLADOR | F60: 3 | G60: T | H60: A | I60: 2 | J60: 0 | K60: MIÉRCOLES | L60: 11 | M60: 13 | N60: IN201 | O60: 39 | P60: 2 | Q60: 0
A61: INGENIERIA INFORMATICA | C61: 134 | D61: IF553AIN | E61: LENGUAJE ENSAMBLADOR | F61: 3 | G61: P | H61: A | I61: 0 | J61: 2 | K61: LUNES | L61: 11 | M61: 13 | N61: LAB303 | O61: 20 | P61: 0 | Q61: 2
A62: TURISMO | C62: 338 | D62: IF902ATU | E62: TECNOLOGIAS DE LA INFORMACION Y LA COMUNICACIÓN | F62: 3 | G62: T | H62: A | I62: 2 | J62: 0 | K62: MIÉRCOLES | L62: 9 | M62: 11 | N62: VIRTUAL | O62: 55 | P62: 2 | Q62: 0
G63: SUBTOTAL: | I63: 6 | J63: 4 | L63: TOTAL HRS: | M63: 10 | P63: 6 | Q63: 4
P64: 0 | Q64: 0
A65: CARRERA | D65: PR-TC | E65: ENRIQUE GAMARRA SALDIVAR | F65: CRED. | G65: TIPO | H65: GPO | I65: HT | J65: HP | K65: DIA | L65: HR-INICIO | M65: HR-FIN | N65: AULA | O65: MATRICULADOS | P65: HT | Q65: HP
A66: INGENIERIA DE MINAS | C66: 22 | D66: IF401BMI | E66: PROGRAMACION DIGITAL | F66: 2 | G66: P | H66: A | I66: 0 | J66: 1 | K66: LUNES | L66: 16 | M66: 17 | N66: LAB311 | O66: 24 | P66: 0 | Q66: 1
A67: INGENIERIA DE MINAS | C67: 23 | D67: IF401BMI | E67: PROGRAMACION DIGITAL | F67: 2 | G67: P | H67: A | I67: 0 | J67: 3 | K67: LUNES | L67: 17 | M67: 20 | N67: LAB311 | O67: 24 | P67: 0 | Q67: 3
A68: INGENIERIA INFORMATICA | C68: 63 | D68: IF457AIN | E68: METODOS NUMERICOS | F68: 3 | G68: T | H68: A | I68: 2 | J68: 0 | K68: MARTES | L68: 18 | M68: 20 | N68: IN201 | O68: 21 | P68: 2 | Q68: 0
A69: INGENIERIA CIVIL | C69: 253 | D69: IF758BCI | E69: METODOS NUMERICOS | F69: 3 | G69: T | H69: B | I69: 1 | J69: 0 | K69: MIÉRCOLES | L69: 13 | M69: 14 | N69: LAB310 | O69: 29 | P69: 1 | Q69: 0
A70: INGENIERIA CIVIL | C70: 254 | D70: IF758BCI | E70: METODOS NUMERICOS | F70: 3 | G70: P | H70: B | I70: 0 | J70: 2 | K70: MARTES | L70: 7 | M70: 9 | N70: LAB310 | O70: 29 | P70: 0 | Q70: 2
A71: INGENIERIA CIVIL | C71: 255 | D71: IF758BCI | E71: METODOS NUMERICOS | F71: 3 | G71: P | H71: B | I71: 0 | J71: 2 | K71: JUEVES | L71: 7 | M71: 9 | N71: LAB310 | O71: 29 | P71: 0 | Q71: 2
G72: SUBTOTAL: | I72: 3 | J72: 8 | L72: TOTAL HRS: | M72: 11 | P72: 3 | Q72: 8
P73: 0 | Q73: 0
A74: CARRERA | D74: PR-TC | E74: DENNIS IVÁN CANDIA OVIEDO | F74: CRED. | G74: TIPO | H74: GPO | I74: HT | J74: HP | K74: DIA | L74: HR-INICIO | M74: HR-FIN | N74: AULA | O74: MATRICULADOS | P74: HT | Q74: HP
A75: INGENIERIA DE MINAS | C75: 18 | D75: IF391AMI | E75: SISTEMA DE BASE DE DATOS | F75: 2 | G75: P | H75: A | I75: 0 | J75: 1 | K75: JUEVES | L75: 16 | M75: 17 | N75: IM-204 | O75: 46 | P75: 0 | Q75: 1
A76: INGENIERIA INFORMATICA | C76: 99 | D76: IF480AIN | E76: ADMINISTRACION DE TECNOLOGÍAS DE LA INFORMACIÓN | F76: 3 | G76: T | H76: A | I76: 2 | J76: 0 | K76: LUNES | L76: 11 | M76: 13 | N76: IN107 | O76: 40 | P76: 2 | Q76: 0
A77: INGENIERIA INFORMATICA | C77: 100 | D77: IF480AIN | E77: ADMINISTRACION DE TECNOLOGÍAS DE LA INFORMACIÓN | F77: 3 | G77: P | H77: A | I77: 0 | J77: 2 | K77: MIÉRCOLES | L77: 11 | M77: 13 | N77: IN107 | O77: 40 | P77: 0 | Q77: 2
A78: INGENIERIA INFORMATICA | C78: 140 | D78: IF610AIN | E78: ANALISIS Y DISEÑO DE SISTEMAS DE INFORMACION | F78: 4 | G78: T | H78: A | I78: 2 | J78: 0 | K78: MARTES | L78: 7 | M78: 9 | N78: IN108 | O78: 40 | P78: 2 | Q78: 0
A79: INGENIERIA INFORMATICA | C79: 141 | D79: IF610AIN | E79: ANALISIS Y DISEÑO DE SISTEMAS DE INFORMACION | F79: 4 | G79: T | H79: A | I79: 1 | J79: 0 | K79: VIERNES | L79: 8 | M79: 9 | N79: IN108 | O79: 40 | P79: 1 | Q79: 0
A80: INGENIERIA INFORMATICA | C80: 142 | D80: IF610AIN | E80: ANALISIS Y DISEÑO DE SISTEMAS DE INFORMACION | F80: 4 | G80: P | H80: A | I80: 0 | J80: 2 | K80: JUEVES | L80: 7 | M80: 9 | N80: LAB311 | O80: 40 | P80: 0 | Q80: 2
G82: SUBTOTAL: | I82: 5 | J82: 5 | L82: TOTAL HRS: | M82: 10 | P82: 5 | Q82: 5
P83: 0 | Q83: 0
A84: CARRERA | D84: PR-TC | E84: RONY VILLAFUERTE SERNA | F84: CRED. | G84: TIPO | H84: GPO | I84: HT | J84: HP | K84: DIA | L84: HR-INICIO | M84: HR-FIN | N84: AULA | O84: MATRICULADOS | P84: HT | Q84: HP
A85: INGENIERIA INFORMATICA | C85: 73 | D85: IF459BIN | E85: COMPUTACION GRAFICA II | F85: 4 | G85: T | H85: B | I85: 2 | J85: 0 | K85: JUEVES | L85: 14 | M85: 16 | N85: IN206 | O85: 40 | P85: 2 | Q85: 0
A86: INGENIERIA INFORMATICA | C86: 74 | D86: IF459BIN | E86: COMPUTACION GRAFICA II | F86: 4 | G86: T | H86: B | I86: 1 | J86: 0 | K86: VIERNES | L86: 15 | M86: 16 | N86: IN206 | O86: 40 | P86: 1 | Q86: 0
A87: INGENIERIA INFORMATICA | C87: 75 | D87: IF459BIN | E87: COMPUTACION GRAFICA II | F87: 4 | G87: P | H87: A | I87: 0 | J87: 2 | K87: MARTES | L87: 14 | M87: 16 | N87: LAB303 | O87: 20 | P87: 0 | Q87: 2
A88: INGENIERIA INFORMATICA | C88: 129 | D88: IF552BIN | E88: REDES DE COMPUTADORAS I | F88: 4 | G88: T | H88: B | I88: 2 | J88: 0 | K88: JUEVES | L88: 16 | M88: 18 | N88: IN202 | O88: 41 | P88: 2 | Q88: 0
A89: INGENIERIA INFORMATICA | C89: 130 | D89: IF552BIN | E89: REDES DE COMPUTADORAS I | F89: 4 | G89: T | H89: B | I89: 1 | J89: 0 | K89: VIERNES | L89: 16 | M89: 17 | N89: IN202 | O89: 41 | P89: 1 | Q89: 0
A90: INGENIERIA INFORMATICA | C90: 131 | D90: IF552BIN | E90: REDES DE COMPUTADORAS I | F90: 4 | G90: P | H90: A | I90: 0 | J90: 2 | K90: MARTES | L90: 16 | M90: 18 | N90: LAB309 | O90: 41 | P90: 0 | Q90: 2
G91: SUBTOTAL: | I91: 6 | J91: 4 | L91: TOTAL HRS: | M91: 10 | P91: 6 | Q91: 4
P92: 0 | Q92: 0
A93: CARRERA | D93: AS-DE | E93: GUZMÁN TICONA PARI | F93: CRED. | G93: TIPO | H93: GPO | I93: HT | J93: HP | K93: DIA | L93: HR-INICIO | M93: HR-FIN | N93: AULA | O93: MATRICULADOS | P93: HT | Q93: HP
A94: INGENIERIA ELECTRICA | C94: 79 | D94: IF467AEI | E94: PROGRAMACION DIGITAL | F94: 4 | G94: T | H94: A | I94: 2 | J94: 0 | K94: MARTES | L94: 18 | M94: 20 | N94: IE-101 | O94: 43 | P94: 2 | Q94: 0
A95: INGENIERIA ELECTRICA | C95: 80 | D95: IF467AEI | E95: PROGRAMACION DIGITAL | F95: 4 | G95: T | H95: A | I95: 1 | J95: 0 | K95: VIERNES | L95: 19 | M95: 20 | N95: IE-101 | O95: 43 | P95: 1 | Q95: 0
A96: INGENIERIA ELECTRICA | C96: 81 | D96: IF467AEI | E96: PROGRAMACION DIGITAL | F96: 4 | G96: P | H96: A | I96: 0 | J96: 2 | K96: JUEVES | L96: 18 | M96: 20 | N96: LAB305 | O96: 22 | P96: 0 | Q96: 2
A97: INGENIERIA INFORMATICA | C97: 149 | D97: IF612AIN | E97: FUNDAMENTOS Y DISEÑO DE BASE DE DATOS | F97: 4 | G97: T | H97: A | I97: 2 | J97: 0 | K97: MARTES | L97: 9 | M97: 11 | N97: IN201 | O97: 35 | P97: 2 | Q97: 0
A98: INGENIERIA INFORMATICA | C98: 150 | D98: IF612AIN | E98: FUNDAMENTOS Y DISEÑO DE BASE DE DATOS | F98: 4 | G98: T | H98: A | I98: 1 | J98: 0 | K98: VIERNES | L98: 9 | M98: 10 | N98: IN201 | O98: 35 | P98: 1 | Q98: 0
A99: INGENIERIA INFORMATICA | C99: 151 | D99: IF612AIN | E99: FUNDAMENTOS Y DISEÑO DE BASE DE DATOS | F99: 4 | G99: P | H99: A | I99: 0 | J99: 2 | K99: JUEVES | L99: 9 | M99: 11 | N99: LAB301 | O99: 18 | P99: 0 | Q99: 2
G100: SUBTOTAL: | I100: 6 | J100: 4 | L100: TOTAL HRS: | M100: 10 | P100: 6 | Q100: 4
P101: 0 | Q101: 0
A102: CARRERA | D102: AS-DE | E102: YESHICA ISELA ORMEÑO AYALA | F102: CRED. | G102: TIPO | H102: GPO | I102: HT | J102: HP | K102: DIA | L102: HR-INICIO | M102: HR-FIN | N102: AULA | O102: MATRICULADOS | P102: HT | Q102: HP
A103: INGENIERIA INFORMATICA | C103: 242 | D103: IF710AIN | E103: SEMINARIO DE INVESTIGACION I | F103: 3 | G103: T | H103: A | I103: 2 | J103: 0 | K103: LUNES | L103: 11 | M103: 13 | N103: IN203 | O103: 28 | P103: 2 | Q103: 0
A104: INGENIERIA INFORMATICA | C104: 243 | D104: IF710AIN | E104: SEMINARIO DE INVESTIGACION I | F104: 3 | G104: P | H104: A | I104: 0 | J104: 2 | K104: MIÉRCOLES | L104: 11 | M104: 13 | N104: IN203 | O104: 28 | P104: 0 | Q104: 2
A105: INGENIERIA INFORMATICA | C105: 246 | D105: IF711AIN | E105: SEMINARIO DE INVESTIGACION II | F105: 3 | G105: T | H105: A | I105: 2 | J105: 0 | K105: VIERNES | L105: 12 | M105: 14 | N105: IN206 | O105: 25 | P105: 2 | Q105: 0
A106: INGENIERIA INFORMATICA | C106: 247 | D106: IF711AIN | E106: SEMINARIO DE INVESTIGACION II | F106: 3 | G106: P | H106: A | I106: 0 | J106: 2 | K106: SABADO | L106: 9 | M106: 11 | N106: IN206 | O106: 25 | P106: 0 | Q106: 2
A107: ING. FORESTAL (PTO MDO.) / MEDICINA VETERINARIA (ESP) | C107: 328 | D107: IF902AFO / IF902AVE | E107: TECNOLOGIAS DE LA INFORMACION Y LA COMUNICACIÓN | F107: 3 | G107: T | H107: A | I107: 2 | J107: 0 | K107: MARTES | L107: 14 | M107: 16 | N107: VIRTUAL | O107: 42 | P107: 2 | Q107: 0
G108: SUBTOTAL: | I108: 6 | J108: 4 | L108: TOTAL HRS: | M108: 10 | P108: 6 | Q108: 4
P109: 0 | Q109: 0
A110: CARRERA | D110: AS-TC | E110: IVÁN CÉSAR MEDRANO VALENCIA | F110: CRED. | G110: TIPO | H110: GPO | I110: HT | J110: HP | K110: DIA | L110: HR-INICIO | M110: HR-FIN | N110: AULA | O110: MATRICULADOS | P110: HT | Q110: HP
A111: INGENIERIA INFORMATICA | C111: 218 | D111: IF657AIN | E111: VISION COMPUTACIONAL | F111: 4 | G111: T | H111: A | I111: 2 | J111: 0 | K111: JUEVES | L111: 9 | M111: 11 | N111: IN206 | O111: 41 | P111: 2 | Q111: 0
A112: INGENIERIA INFORMATICA | C112: 219 | D112: IF657AIN | E112: VISION COMPUTACIONAL | F112: 4 | G112: T | H112: A | I112: 1 | J112: 0 | K112: VIERNES | L112: 9 | M112: 10 | N112: IN206 | O112: 41 | P112: 1 | Q112: 0
A113: INGENIERIA INFORMATICA | C113: 220 | D113: IF657AIN | E113: VISION COMPUTACIONAL | F113: 4 | G113: P | H113: A | I113: 0 | J113: 2 | K113: MARTES | L113: 9 | M113: 11 | N113: LAB301 | O113: 41 | P113: 0 | Q113: 2
A114: INGENIERIA INFORMATICA | C114: 225 | D114: IF662AIN | E114: DEEP LEARNING | F114: 4 | G114: T | H114: A | I114: 2 | J114: 0 | K114: LUNES | L114: 9 | M114: 11 | N114: IN101 | O114: 31 | P114: 2 | Q114: 0
A115: INGENIERIA INFORMATICA | C115: 226 | D115: IF662AIN | E115: DEEP LEARNING | F115: 4 | G115: T | H115: A | I115: 1 | J115: 0 | K115: VIERNES | L115: 10 | M115: 11 | N115: IN101 | O115: 31 | P115: 1 | Q115: 0
A116: INGENIERIA INFORMATICA | C116: 227 | D116: IF662AIN | E116: DEEP LEARNING | F116: 4 | G116: P | H116: A | I116: 0 | J116: 2 | K116: MIÉRCOLES | L116: 9 | M116: 11 | N116: LAB208 | O116: 31 | P116: 0 | Q116: 2
G117: SUBTOTAL: | I117: 6 | J117: 4 | L117: TOTAL HRS: | M117: 10 | P117: 6 | Q117: 4
P118: 0 | Q118: 0
A119: CARRERA | D119: AS-TC | E119: LUIS BELTRÁN PALMA TTITO | F119: CRED. | G119: TIPO | H119: GPO | I119: HT | J119: HP | K119: DIA | L119: HR-INICIO | M119: HR-FIN | N119: AULA | O119: MATRICULADOS | P119: HT | Q119: HP
A120: INGENIERIA INFORMATICA | C120: 222 | D120: IF658AIN | E120: REDES NEURONALES ARTIFICIALES | F120: 4 | G120: T | H120: A | I120: 2 | J120: 0 | K120: MARTES | L120: 9 | M120: 11 | N120: IN101 | O120: 25 | P120: 2 | Q120: 0
A121: INGENIERIA INFORMATICA | C121: 223 | D121: IF658AIN | E121: REDES NEURONALES ARTIFICIALES | F121: 4 | G121: T | H121: A | I121: 1 | J121: 0 | K121: VIERNES | L121: 9 | M121: 10 | N121: IN101 | O121: 25 | P121: 1 | Q121: 0
A122: INGENIERIA INFORMATICA | C122: 224 | D122: IF658AIN | E122: REDES NEURONALES ARTIFICIALES | F122: 4 | G122: P | H122: A | I122: 0 | J122: 2 | K122: JUEVES | L122: 9 | M122: 11 | N122: IN101 | O122: 25 | P122: 0 | Q122: 2
A123: INGENIERIA INFORMATICA | C123: 235 | D123: IF669AIN | E123: MODELADO Y SIMULACION | F123: 4 | G123: T | H123: A | I123: 2 | J123: 0 | K123: LUNES | L123: 7 | M123: 9 | N123: IN203 | O123: 18 | P123: 2 | Q123: 0
A124: INGENIERIA INFORMATICA | C124: 236 | D124: IF669AIN | E124: MODELADO Y SIMULACION | F124: 4 | G124: T | H124: A | I124: 1 | J124: 0 | K124: VIERNES | L124: 7 | M124: 8 | N124: IN203 | O124: 18 | P124: 1 | Q124: 0
A125: INGENIERIA INFORMATICA | C125: 237 | D125: IF669AIN | E125: MODELADO Y SIMULACION | F125: 4 | G125: P | H125: A | I125: 0 | J125: 2 | K125: MIÉRCOLES | L125: 7 | M125: 9 | N125: LAB305 | O125: 18 | P125: 0 | Q125: 2
G126: SUBTOTAL: | I126: 6 | J126: 4 | L126: TOTAL HRS: | M126: 10 | P126: 6 | Q126: 4
P127: 0 | Q127: 0
A128: CARRERA | D128: AS-TC | E128: ROBERT WILBERT ALZAMORA PAREDES | F128: CRED. | G128: TIPO | H128: GPO | I128: HT | J128: HP | K128: DIA | L128: HR-INICIO | M128: HR-FIN | N128: AULA | O128: MATRICULADOS | P128: HT | Q128: HP
A129: INGENIERIA INFORMATICA | C129: 36 | D129: IF452AIN | E129: ALGORITMOS Y ESTRUCTURAS DE DATOS | F129: 4 | G129: T | H129: A | I129: 2 | J129: 0 | K129: LUNES | L129: 9 | M129: 11 | N129: IN107 | O129: 40 | P129: 2 | Q129: 0
A130: INGENIERIA INFORMATICA | C130: 37 | D130: IF452AIN | E130: ALGORITMOS Y ESTRUCTURAS DE DATOS | F130: 4 | G130: T | H130: A | I130: 1 | J130: 0 | K130: VIERNES | L130: 10 | M130: 11 | N130: IN107 | O130: 40 | P130: 1 | Q130: 0
A131: INGENIERIA INFORMATICA | C131: 38 | D131: IF452AIN | E131: ALGORITMOS Y ESTRUCTURAS DE DATOS | F131: 4 | G131: P | H131: A | I131: 0 | J131: 2 | K131: MIÉRCOLES | L131: 9 | M131: 11 | N131: IN107 | O131: 40 | P131: 0 | Q131: 2
A132: INGENIERIA INFORMATICA | C132: 210 | D132: IF656AIN | E132: PROCESAMIENTO DE LENGUAJE NATURAL | F132: 4 | G132: T | H132: A | I132: 2 | J132: 0 | K132: MIÉRCOLES | L132: 11 | M132: 13 | N132: IN206 | O132: 55 | P132: 2 | Q132: 0
A133: INGENIERIA INFORMATICA | C133: 211 | D133: IF656AIN | E133: PROCESAMIENTO DE LENGUAJE NATURAL | F133: 4 | G133: T | H133: A | I133: 1 | J133: 0 | K133: VIERNES | L133: 11 | M133: 12 | N133: IN206 | O133: 55 | P133: 1 | Q133: 0
A134: INGENIERIA INFORMATICA | C134: 212 | D134: IF656AIN | E134: PROCESAMIENTO DE LENGUAJE NATURAL | F134: 4 | G134: P | H134: A | I134: 0 | J134: 2 | K134: LUNES | L134: 11 | M134: 13 | N134: LAB301 | O134: 15 | P134: 0 | Q134: 2
G135: SUBTOTAL: | I135: 6 | J135: 4 | L135: TOTAL HRS: | M135: 10 | P135: 6 | Q135: 4
P136: 0 | Q136: 0
A137: CARRERA | D137: AS-TC | E137: WALDO ELIO IBARRA ZAMBRANO | F137: CRED. | G137: TIPO | H137: GPO | I137: HT | J137: HP | K137: DIA | L137: HR-INICIO | M137: HR-FIN | N137: AULA | O137: MATRICULADOS | P137: HT | Q137: HP
A138: FISICA | C138: 13 | D138: IF167AFI | E138: PROGRAMACION CIENTIFICA | F138: 4 | G138: T | H138: A | I138: 2 | J138: 0 | K138: LUNES | L138: 7 | M138: 9 | N138: C-122 | O138: 15 | P138: 2 | Q138: 0
A139: FISICA | C139: 14 | D139: IF167AFI | E139: PROGRAMACION CIENTIFICA | F139: 4 | G139: T | H139: A | I139: 1 | J139: 0 | K139: VIERNES | L139: 7 | M139: 8 | N139: C-122 | O139: 15 | P139: 1 | Q139: 0
A140: FISICA | C140: 15 | D140: IF167AFI | E140: PROGRAMACION CIENTIFICA | F140: 4 | G140: P | H140: A | I140: 0 | J140: 2 | K140: MIÉRCOLES | L140: 7 | M140: 9 | N140: C-122 | O140: 15 | P140: 0 | Q140: 2
A141: INGENIERIA INFORMATICA | C141: 91 | D141: IF468BIN | E141: FUNDAMENTOS DE LA PROGRAMACION | F141: 4 | G141: T | H141: B | I141: 2 | J141: 0 | K141: LUNES | L141: 18 | M141: 20 | N141: IN102 | O141: 19 | P141: 2 | Q141: 0
A142: INGENIERIA INFORMATICA | C142: 92 | D142: IF468BIN | E142: FUNDAMENTOS DE LA PROGRAMACION | F142: 4 | G142: T | H142: B | I142: 1 | J142: 0 | K142: VIERNES | L142: 18 | M142: 19 | N142: IN102 | O142: 19 | P142: 1 | Q142: 0
A143: INGENIERIA INFORMATICA | C143: 93 | D143: IF468BIN | E143: FUNDAMENTOS DE LA PROGRAMACION | F143: 4 | G143: P | H143: A | I143: 0 | J143: 2 | K143: MIÉRCOLES | L143: 18 | M143: 20 | N143: LAB301 | O143: 19 | P143: 0 | Q143: 2
G144: SUBTOTAL: | I144: 6 | J144: 4 | L144: TOTAL HRS: | M144: 10 | P144: 6 | Q144: 4
P145: 0 | Q145: 0
A146: CARRERA | D146: AS-TC | E146: KARELIA MEDINA MIRANDA | F146: CRED. | G146: TIPO | H146: GPO | I146: HT | J146: HP | K146: DIA | L146: HR-INICIO | M146: HR-FIN | N146: AULA | O146: MATRICULADOS | P146: HT | Q146: HP
A147: INGENIERIA INFORMATICA | C147: 39 | D147: IF452BIN | E147: ALGORITMOS Y ESTRUCTURAS DE DATOS | F147: 4 | G147: T | H147: B | I147: 2 | J147: 0 | K147: LUNES | L147: 16 | M147: 18 | N147: IN107 | O147: 20 | P147: 2 | Q147: 0
A148: INGENIERIA INFORMATICA | C148: 40 | D148: IF452BIN | E148: ALGORITMOS Y ESTRUCTURAS DE DATOS | F148: 4 | G148: T | H148: B | I148: 1 | J148: 0 | K148: VIERNES | L148: 16 | M148: 17 | N148: IN107 | O148: 20 | P148: 1 | Q148: 0
A149: INGENIERIA INFORMATICA | C149: 41 | D149: IF452BIN | E149: ALGORITMOS Y ESTRUCTURAS DE DATOS | F149: 4 | G149: P | H149: A | I149: 0 | J149: 2 | K149: MIÉRCOLES | L149: 16 | M149: 18 | N149: IN107 | O149: 20 | P149: 0 | Q149: 2
A150: INGENIERIA INFORMATICA | C150: 153 | D150: IF612BIN | E150: FUNDAMENTOS Y DISEÑO DE BASE DE DATOS | F150: 4 | G150: T | H150: B | I150: 2 | J150: 0 | K150: MARTES | L150: 16 | M150: 18 | N150: IN201 | O150: 20 | P150: 2 | Q150: 0
A151: INGENIERIA INFORMATICA | C151: 154 | D151: IF612BIN | E151: FUNDAMENTOS Y DISEÑO DE BASE DE DATOS | F151: 4 | G151: T | H151: B | I151: 1 | J151: 0 | K151: VIERNES | L151: 17 | M151: 18 | N151: IN201 | O151: 20 | P151: 1 | Q151: 0
A152: INGENIERIA INFORMATICA | C152: 155 | D152: IF612BIN | E152: FUNDAMENTOS Y DISEÑO DE BASE DE DATOS | F152: 4 | G152: P | H152: A | I152: 0 | J152: 2 | K152: JUEVES | L152: 16 | M152: 18 | N152: LAB305 | O152: 20 | P152: 0 | Q152: 2
G153: SUBTOTAL: | I153: 6 | J153: 4 | L153: TOTAL HRS: | M153: 10 | P153: 6 | Q153: 4
P154: 0 | Q154: 0
A155: CARRERA | D155: AS-DE | E155: JAVIER DAVID CHAVEZ CENTENO | F155: CRED. | G155: TIPO | H155: GPO | I155: HT | J155: HP | K155: DIA | L155: HR-INICIO | M155: HR-FIN | N155: AULA | O155: MATRICULADOS | P155: HT | Q155: HP
A156: INGENIERIA INFORMATICA | C156: 114 | D156: IF484AIN | E156: EMPRENDIMIENTO E INNOVACION | F156: 3 | G156: T | H156: A | I156: 2 | J156: 0 | K156: LUNES | L156: 14 | M156: 16 | N156: IN202 | O156: 30 | P156: 2 | Q156: 0
A157: INGENIERIA INFORMATICA | C157: 115 | D157: IF484AIN | E157: EMPRENDIMIENTO E INNOVACION | F157: 3 | G157: P | H157: A | I157: 0 | J157: 2 | K157: MIÉRCOLES | L157: 14 | M157: 16 | N157: IN202 | O157: 30 | P157: 0 | Q157: 2
A158: CIENCIAS ADMINISTRATIVAS / HISTORIA(C) | C158: 270 | D158: IF902AAE / IF902CHI | E158: TECNOLOGIAS DE LA INFORMACION Y LA COMUNICACIÓN | F158: 3 | G158: T | H158: A | I158: 2 | J158: 0 | K158: MARTES | L158: 7 | M158: 9 | N158: VIRTUAL | O158: 65 | P158: 2 | Q158: 0
A159: EDUCACION | C159: 290 | D159: IF902AEU | E159: TECNOLOGIAS DE LA INFORMACION Y LA COMUNICACIÓN | F159: 3 | G159: T | H159: A | I159: 2 | J159: 0 | K159: JUEVES | L159: 9 | M159: 11 | N159: VIRTUAL | O159: 66 | P159: 2 | Q159: 0
A160: EDUCACION | C160: 291 | D160: IF902AEU | E160: TECNOLOGIAS DE LA INFORMACION Y LA COMUNICACIÓN | F160: 3 | G160: P | H160: A | I160: 0 | J160: 2 | K160: MARTES | L160: 9 | M160: 11 | N160: VIRTUAL | O160: 33 | P160: 0 | Q160: 2
G161: SUBTOTAL: | I161: 6 | J161: 4 | L161: TOTAL HRS: | M161: 10 | P161: 6 | Q161: 4
P162: 0 | Q162: 0
A163: CARRERA | D163: AS-DE | E163: ROXANA LISETTE QUINTANILLA PORTUGAL | F163: CRED. | G163: TIPO | H163: GPO | I163: HT | J163: HP | K163: DIA | L163: HR-INICIO | M163: HR-FIN | N163: AULA | O163: MATRICULADOS | P163: HT | Q163: HP
A164: EDUCACION | C164: 296 | D164: IF902CEU | E164: TECNOLOGIAS DE LA INFORMACION Y LA COMUNICACIÓN | F164: 3 | G164: T | H164: C | I164: 2 | J164: 0 | K164: LUNES | L164: 14 | M164: 16 | N164: VIRTUAL | O164: 66 | P164: 2 | Q164: 0
A165: EDUCACION | C165: 297 | D165: IF902CEU | E165: TECNOLOGIAS DE LA INFORMACION Y LA COMUNICACIÓN | F165: 3 | G165: P | H165: A | I165: 0 | J165: 2 | K165: MIÉRCOLES | L165: 14 | M165: 16 | N165: VIRTUAL | O165: 33 | P165: 0 | Q165: 2
A166: FILOSOFÍA / PSICOLOGÍA | C166: 307 | D166: IF902AFL / IF902APS | E166: TECNOLOGIAS DE LA INFORMACION Y LA COMUNICACIÓN | F166: 3 | G166: T | H166: A | I166: 2 | J166: 0 | K166: LUNES | L166: 7 | M166: 9 | N166: VIRTUAL | O166: 58 | P166: 2 | Q166: 0
A167: FILOSOFÍA / PSICOLOGÍA | C167: 308 | D167: IF902AFL / IF902APS | E167: TECNOLOGIAS DE LA INFORMACION Y LA COMUNICACIÓN | F167: 3 | G167: P | H167: A | I167: 0 | J167: 2 | K167: MIÉRCOLES | L167: 7 | M167: 9 | N167: VIRTUAL | O167: 58 | P167: 0 | Q167: 2
A168: INGENIERIA CIVIL | C168: 316 | D168: IF902ACI | E168: TECNOLOGIAS DE LA INFORMACION Y LA COMUNICACIÓN | F168: 3 | G168: P | H168: B | I168: 0 | J168: 2 | K168: JUEVES | L168: 14 | M168: 16 | N168: VIRTUAL | O168: 34 | P168: 0 | Q168: 2
G170: SUBTOTAL: | I170: 4 | J170: 6 | L170: TOTAL HRS: | M170: 10 | P170: 4 | Q170: 6
P171: 0 | Q171: 0
A172: CARRERA | D172: AS-TC | E172: VANESSA MARIBEL CHOQUE SOTO | F172: CRED. | G172: TIPO | H172: GPO | I172: HT | J172: HP | K172: DIA | L172: HR-INICIO | M172: HR-FIN | N172: AULA | O172: MATRICULADOS | P172: HT | Q172: HP
A173: INGENIERIA INFORMATICA | C173: 103 | D173: IF481AIN | E173: INGENIERIA ECONOMICA | F173: 3 | G173: T | H173: A | I173: 2 | J173: 0 | K173: MIÉRCOLES | L173: 11 | M173: 13 | N173: IN108 | O173: 40 | P173: 2 | Q173: 0
A174: INGENIERIA INFORMATICA | C174: 104 | D174: IF481AIN | E174: INGENIERIA ECONOMICA | F174: 3 | G174: P | H174: A | I174: 0 | J174: 2 | K174: LUNES | L174: 11 | M174: 13 | N174: LAB311 | O174: 20 | P174: 0 | Q174: 2
A175: INGENIERIA INFORMATICA | C175: 106 | D175: IF482AIN | E175: PLANEAMIENTO Y DIRECCION ESTRATEGICA DE TECNOLOGIA DE INFORMACION | F175: 3 | G175: T | H175: A | I175: 2 | J175: 0 | K175: VIERNES | L175: 11 | M175: 13 | N175: IN203 | O175: 29 | P175: 2 | Q175: 0
A176: INGENIERIA INFORMATICA | C176: 107 | D176: IF482AIN | E176: PLANEAMIENTO Y DIRECCION ESTRATEGICA DE TECNOLOGIA DE INFORMACION | F176: 3 | G176: P | H176: A | I176: 0 | J176: 2 | K176: SÁBADO | L176: 7 | M176: 9 | N176: IN203 | O176: 29 | P176: 0 | Q176: 2
A177: ANTROPOLOGÍA / CS. DE LA COMUNICACIÓN(B) | C177: 259 | D177: IF902AAN / IF902BCC | E177: TECNOLOGIAS DE LA INFORMACION Y LA COMUNICACIÓN | F177: 3 | G177: T | H177: A | I177: 2 | J177: 0 | K177: JUEVES | L177: 9 | M177: 11 | N177: VIRTUAL | O177: 56 | P177: 2 | Q177: 0
G179: SUBTOTAL: | I179: 6 | J179: 4 | L179: TOTAL HRS: | M179: 10 | P179: 6 | Q179: 4
P180: 0 | Q180: 0
A181: CARRERA | D181: AS-TP | E181: MANUEL AURELIO PEÑALOZA FIGUEROA | F181: CRED. | G181: TIPO | H181: GPO | I181: HT | J181: HP | K181: DIA | L181: HR-INICIO | M181: HR-FIN | N181: AULA | O181: MATRICULADOS | P181: HT | Q181: HP
A182: INGENIERIA INFORMATICA | C182: 108 | D182: IF482BIN | E182: PLANEAMIENTO Y DIRECCION ESTRATEGICA DE TECNOLOGIA DE INFORMACION | F182: 3 | G182: T | H182: B | I182: 2 | J182: 0 | K182: MARTES | L182: 18 | M182: 20 | N182: IN203 | O182: 14 | P182: 2 | Q182: 0
A183: INGENIERIA INFORMATICA | C183: 109 | D183: IF482BIN | E183: PLANEAMIENTO Y DIRECCION ESTRATEGICA DE TECNOLOGIA DE INFORMACION | F183: 3 | G183: P | H183: A | I183: 0 | J183: 2 | K183: JUEVES | L183: 18 | M183: 20 | N183: IN203 | O183: 14 | P183: 0 | Q183: 2
A184: INGENIERIA INFORMATICA | C184: 123 | D184: IF551BIN | E184: SISTEMAS OPERATIVOS | F184: 4 | G184: T | H184: B | I184: 2 | J184: 0 | K184: LUNES | L184: 16 | M184: 18 | N184: IN201 | O184: 24 | P184: 2 | Q184: 0
A185: INGENIERIA INFORMATICA | C185: 124 | D185: IF551BIN | E185: SISTEMAS OPERATIVOS | F185: 4 | G185: T | H185: B | I185: 1 | J185: 0 | K185: VIERNES | L185: 16 | M185: 17 | N185: IN201 | O185: 24 | P185: 1 | Q185: 0
A186: INGENIERIA INFORMATICA | C186: 125 | D186: IF551BIN | E186: SISTEMAS OPERATIVOS | F186: 4 | G186: P | H186: A | I186: 0 | J186: 2 | K186: MIÉRCOLES | L186: 16 | M186: 18 | N186: LAB301 | O186: 24 | P186: 0 | Q186: 2
A187: INGENIERIA QUIMICA | C187: 334 | D187: IF902AQI | E187: TECNOLOGIAS DE LA INFORMACION Y LA COMUNICACIÓN | F187: 3 | G187: T | H187: A | I187: 2 | J187: 0 | K187: JUEVES | L187: 16 | M187: 18 | N187: VIRTUAL | O187: 59 | P187: 2 | Q187: 0
G188: SUBTOTAL: | I188: 7 | J188: 4 | L188: TOTAL HRS: | M188: 11 | P188: 7 | Q188: 4
P189: 0 | Q189: 0
A190: CARRERA | D190: AUX-TC | E190: JOSÉ MAURO PILLCO QUISPE | F190: CRED. | G190: TIPO | H190: GPO | I190: HT | J190: HP | K190: DIA | L190: HR-INICIO | M190: HR-FIN | N190: AULA | O190: MATRICULADOS | P190: HT | Q190: HP
A191: INGENIERIA INFORMATICA | C191: 66 | D191: IF458AIN | E191: COMPUTACION GRAFICA I | F191: 4 | G191: T | H191: A | I191: 2 | J191: 0 | K191: LUNES | L191: 11 | M191: 13 | N191: IN201 | O191: 36 | P191: 2 | Q191: 0
A192: INGENIERIA INFORMATICA | C192: 67 | D192: IF458AIN | E192: COMPUTACION GRAFICA I | F192: 4 | G192: T | H192: A | I192: 1 | J192: 0 | K192: VIERNES | L192: 11 | M192: 12 | N192: IN201 | O192: 36 | P192: 1 | Q192: 0
A193: INGENIERIA INFORMATICA | C193: 68 | D193: IF458AIN | E193: COMPUTACION GRAFICA I | F193: 4 | G193: P | H193: A | I193: 0 | J193: 2 | K193: MIÉRCOLES | L193: 11 | M193: 13 | N193: LAB301 | O193: 36 | P193: 0 | Q193: 2
A194: INGENIERIA INFORMATICA | C194: 207 | D194: IF654AIN | E194: ROBOTICA | F194: 4 | G194: T | H194: A | I194: 2 | J194: 0 | K194: MIÉRCOLES | L194: 9 | M194: 11 | N194: IN206 | O194: 23 | P194: 2 | Q194: 0
A195: INGENIERIA INFORMATICA | C195: 208 | D195: IF654AIN | E195: ROBOTICA | F195: 4 | G195: T | H195: A | I195: 1 | J195: 0 | K195: VIERNES | L195: 10 | M195: 11 | N195: IN206 | O195: 23 | P195: 1 | Q195: 0
A196: INGENIERIA INFORMATICA | C196: 209 | D196: IF654AIN | E196: ROBOTICA | F196: 4 | G196: P | H196: A | I196: 0 | J196: 2 | K196: LUNES | L196: 9 | M196: 11 | N196: LAB207 | O196: 23 | P196: 0 | Q196: 2
G198: SUBTOTAL: | I198: 6 | J198: 4 | L198: TOTAL HRS: | M198: 10 | P198: 6 | Q198: 4
P199: 0 | Q199: 0
A200: CARRERA | D200: AUX-TC | E200: LINO AQUILES BACA CARDENAS | F200: CRED. | G200: TIPO | H200: GPO | I200: HT | J200: HP | K200: DIA | L200: HR-INICIO | M200: HR-FIN | N200: AULA | O200: MATRICULADOS | P200: HT | Q200: HP
A201: INGENIERIA INFORMATICA | C201: 64 | D201: IF457AIN | E201: METODOS NUMERICOS | F201: 3 | G201: P | H201: A | I201: 0 | J201: 2 | K201: JUEVES | L201: 18 | M201: 20 | N201: LAB301 | O201: 21 | P201: 0 | Q201: 2
A202: INGENIERIA CIVIL | C202: 250 | D202: IF758ACI | E202: METODOS NUMERICOS | F202: 3 | G202: T | H202: A | I202: 1 | J202: 0 | K202: MIÉRCOLES | L202: 13 | M202: 14 | N202: CIPRO-301 | O202: 33 | P202: 1 | Q202: 0
A203: CIENCIAS DE LA COMUNICACIÓN | C203: 275 | D203: IF902ACC | E203: TECNOLOGIAS DE LA INFORMACION Y LA COMUNICACIÓN | F203: 3 | G203: T | H203: A | I203: 2 | J203: 0 | K203: JUEVES | L203: 9 | M203: 11 | N203: VIRTUAL | O203: 56 | P203: 2 | Q203: 0
A204: CIENCIAS DE LA COMUNICACIÓN | C204: 276 | D204: IF902ACC | E204: TECNOLOGIAS DE LA INFORMACION Y LA COMUNICACIÓN | F204: 3 | G204: P | H204: A | I204: 0 | J204: 2 | K204: MARTES | L204: 9 | M204: 11 | N204: VIRTUAL | O204: 56 | P204: 0 | Q204: 2
A205: ECONOMÍA(A) / HISTORIA(B) | C205: 287 | D205: IF902AEO / IF902BHI | E205: TECNOLOGIAS DE LA INFORMACION Y LA COMUNICACIÓN | F205: 3 | G205: P | H205: B | I205: 0 | J205: 2 | K205: JUEVES | L205: 7 | M205: 9 | N205: VIRTUAL | O205: 33 | P205: 0 | Q205: 2
A206: INGENIERIA CIVIL | C206: 315 | D206: IF902ACI | E206: TECNOLOGIAS DE LA INFORMACION Y LA COMUNICACIÓN | F206: 3 | G206: P | H206: A | I206: 0 | J206: 2 | K206: JUEVES | L206: 14 | M206: 16 | N206: VIRTUAL | O206: 35 | P206: 0 | Q206: 2
G208: SUBTOTAL: | I208: 3 | J208: 8 | L208: TOTAL HRS: | M208: 11 | P208: 3 | Q208: 8
P209: 0 | Q209: 0
A210: CARRERA | D210: AUX-TC | E210: ESTHER CRISTINA PACHECO VASQUEZ | F210: CRED. | G210: TIPO | H210: GPO | I210: HT | J210: HP | K210: DIA | L210: HR-INICIO | M210: HR-FIN | N210: AULA | O210: MATRICULADOS | P210: HT | Q210: HP
A211: MATEMATICA | C211: 94 | D211: IF470AME | E211: LENGUAJE DE PROGRAMACION | F211: 4 | G211: T | H211: A | I211: 2 | J211: 0 | K211: MARTES | L211: 7 | M211: 9 | N211: C-121 | O211: 27 | P211: 2 | Q211: 0
A212: MATEMATICA | C212: 95 | D212: IF470AME | E212: LENGUAJE DE PROGRAMACION | F212: 4 | G212: T | H212: A | I212: 1 | J212: 0 | K212: VIERNES | L212: 12 | M212: 13 | N212: C-121 | O212: 27 | P212: 1 | Q212: 0
A213: CONTABILIDAD(B) / ECONOMIA(C) | C213: 280 | D213: IF902BCO / IF902CEO | E213: TECNOLOGIAS DE LA INFORMACION Y LA COMUNICACIÓN | F213: 3 | G213: T | H213: A | I213: 2 | J213: 0 | K213: MIÉRCOLES | L213: 18 | M213: 20 | N213: VIRTUAL | O213: 52 | P213: 2 | Q213: 0
A214: CONTABILIDAD(B) / ECONOMIA(C) | C214: 281 | D214: IF902BCO / IF902CEO | E214: TECNOLOGIAS DE LA INFORMACION Y LA COMUNICACIÓN | F214: 3 | G214: P | H214: A | I214: 0 | J214: 2 | K214: LUNES | L214: 18 | M214: 20 | N214: VIRTUAL | O214: 52 | P214: 0 | Q214: 2
A215: EDUCACION | C215: 293 | D215: IF902BEU | E215: TECNOLOGIAS DE LA INFORMACION Y LA COMUNICACIÓN | F215: 3 | G215: T | H215: B | I215: 2 | J215: 0 | K215: JUEVES | L215: 9 | M215: 11 | N215: VIRTUAL | O215: 67 | P215: 2 | Q215: 0
A216: EDUCACION | C216: 294 | D216: IF902BEU | E216: TECNOLOGIAS DE LA INFORMACION Y LA COMUNICACIÓN | F216: 3 | G216: P | H216: A | I216: 0 | J216: 2 | K216: MARTES | L216: 9 | M216: 11 | N216: VIRTUAL | O216: 34 | P216: 0 | Q216: 2
G217: SUBTOTAL: | I217: 7 | J217: 4 | L217: TOTAL HRS: | M217: 11 | P217: 7 | Q217: 4
P218: 0 | Q218: 0
A219: CARRERA | D219: AUX-TC | E219: WILLIAN ZAMALLOA PARO | F219: CRED. | G219: TIPO | H219: GPO | I219: HT | J219: HP | K219: DIA | L219: HR-INICIO | M219: HR-FIN | N219: AULA | O219: MATRICULADOS | P219: HT | Q219: HP
A220: INGENIERIA INFORMATICA | C220: 170 | D220: IF616AIN | E220: DESARROLLO DE SOFTWARE II | F220: 2 | G220: P | H220: A | I220: 0 | J220: 2 | K220: MARTES | L220: 9 | M220: 11 | N220: LAB305 | O220: 21 | P220: 0 | Q220: 2
A221: INGENIERIA INFORMATICA | C221: 171 | D221: IF616AIN | E221: DESARROLLO DE SOFTWARE II | F221: 2 | G221: P | H221: A | I221: 0 | J221: 2 | K221: JUEVES | L221: 9 | M221: 11 | N221: LAB305 | O221: 21 | P221: 0 | Q221: 2
A222: INGENIERIA INFORMATICA | C222: 172 | D222: IF617AIN | E222: INGENIERIA DE SOFTWARE II | F222: 4 | G222: T | H222: A | I222: 2 | J222: 0 | K222: MIÉRCOLES | L222: 9 | M222: 11 | N222: IN103 | O222: 44 | P222: 2 | Q222: 0
A223: INGENIERIA INFORMATICA | C223: 173 | D223: IF617AIN | E223: INGENIERIA DE SOFTWARE II | F223: 4 | G223: T | H223: A | I223: 1 | J223: 0 | K223: VIERNES | L223: 10 | M223: 11 | N223: IN103 | O223: 44 | P223: 1 | Q223: 0
A224: INGENIERIA INFORMATICA | C224: 174 | D224: IF617AIN | E224: INGENIERIA DE SOFTWARE II | F224: 4 | G224: P | H224: A | I224: 0 | J224: 2 | K224: LUNES | L224: 9 | M224: 11 | N224: LAB303 | O224: 22 | P224: 0 | Q224: 2
A225: ARQUEOLOGIA | C225: 261 | D225: IF902AAQ | E225: TECNOLOGIAS DE LA INFORMACION Y LA COMUNICACIÓN | F225: 3 | G225: T | H225: A | I225: 2 | J225: 0 | K225: MARTES | L225: 11 | M225: 13 | N225: VIRTUAL | O225: 34 | P225: 2 | Q225: 0
G226: SUBTOTAL: | I226: 5 | J226: 6 | L226: TOTAL HRS: | M226: 11 | P226: 5 | Q226: 6
P227: 0 | Q227: 0
A228: CARRERA | D228: AUX-TC | E228: HARLEY VERA OLIVERA | F228: CRED. | G228: TIPO | H228: GPO | I228: HT | J228: HP | K228: DIA | L228: HR-INICIO | M228: HR-FIN | N228: AULA | O228: MATRICULADOS | P228: HT | Q228: HP
A229: INGENIERIA INFORMATICA | C229: 244 | D229: IF710BIN | E229: SEMINARIO DE INVESTIGACION I | F229: 3 | G229: T | H229: B | I229: 2 | J229: 0 | K229: LUNES | L229: 18 | M229: 20 | N229: IN203 | O229: 42 | P229: 2 | Q229: 0
A230: INGENIERIA INFORMATICA | C230: 245 | D230: IF710BIN | E230: SEMINARIO DE INVESTIGACION I | F230: 3 | G230: P | H230: A | I230: 0 | J230: 2 | K230: MIÉRCOLES | L230: 18 | M230: 20 | N230: IN203 | O230: 42 | P230: 0 | Q230: 2
G231: SUBTOTAL: | I231: 2 | J231: 2 | L231: TOTAL HRS: | M231: 4 | P231: 2 | Q231: 2
P232: 0 | Q232: 0
A233: CARRERA | D233: AUX-TC | E233: MARITZA KATHERINE IRPANOCCA CUSIMAYTA | F233: CRED. | G233: TIPO | H233: GPO | I233: HT | J233: HP | K233: DIA | L233: HR-INICIO | M233: HR-FIN | N233: AULA | O233: MATRICULADOS | P233: HT | Q233: HP
A234: INGENIERIA ELECTRICA | C234: 16 | D234: IF212AEI | E234: ANALISIS NUMERICO | F234: 3 | G234: T | H234: A | I234: 2 | J234: 0 | K234: MARTES | L234: 9 | M234: 11 | N234: IE-101 | O234: 29 | P234: 2 | Q234: 0
A235: INGENIERIA ELECTRICA | C235: 17 | D235: IF212AEI | E235: ANALISIS NUMERICO | F235: 3 | G235: P | H235: A | I235: 0 | J235: 2 | K235: JUEVES | L235: 9 | M235: 11 | N235: IE-101 | O235: 29 | P235: 0 | Q235: 2
A236: MATEMATICA | C236: 97 | D236: IF471AME | E236: METODOS NUMERICOS | F236: 3 | G236: T | H236: A | I236: 2 | J236: 0 | K236: MARTES | L236: 11 | M236: 13 | N236: LAB-1 | O236: 6 | P236: 2 | Q236: 0
A237: BIOLOGIA | C237: 266 | D237: IF902ABI | E237: TECNOLOGIAS DE LA INFORMACION Y LA COMUNICACIÓN | F237: 3 | G237: T | H237: A | I237: 2 | J237: 0 | K237: MARTES | L237: 18 | M237: 20 | N237: VIRTUAL | O237: 55 | P237: 2 | Q237: 0
A238: BIOLOGIA(B) / ING. MECÁNICA | C238: 269 | D238: IF902BBI / IF902AMC | E238: TECNOLOGIAS DE LA INFORMACION Y LA COMUNICACIÓN | F238: 3 | G238: P | H238: A | I238: 0 | J238: 2 | K238: JUEVES | L238: 18 | M238: 20 | N238: VIRTUAL | O238: 55 | P238: 0 | Q238: 2
A239: ING. DE MINAS / QUÍMICA(A) | C239: 320 | D239: IF902AMI / IF902AQM | E239: TECNOLOGIAS DE LA INFORMACION Y LA COMUNICACIÓN | F239: 3 | G239: T | H239: A | I239: 2 | J239: 0 | K239: JUEVES | L239: 16 | M239: 18 | N239: VIRTUAL | O239: 54 | P239: 2 | Q239: 0
G240: SUBTOTAL: | I240: 8 | J240: 4 | L240: TOTAL HRS: | M240: 12 | P240: 8 | Q240: 4
P241: 0 | Q241: 0
A242: CARRERA | D242: AUX-TC | E242: EFRAINA GLADYS CUTIPA ARAPA | F242: CRED. | G242: TIPO | H242: GPO | I242: HT | J242: HP | K242: DIA | L242: HR-INICIO | M242: HR-FIN | N242: AULA | O242: MATRICULADOS | P242: HT | Q242: HP
A243: INGENIERIA INFORMATICA | C243: 30 | D243: IF451AIN | E243: PROGRAMACION I | F243: 2 | G243: P | H243: A | I243: 0 | J243: 2 | K243: LUNES | L243: 9 | M243: 11 | N243: LAB311 | O243: 21 | P243: 0 | Q243: 2
A244: INGENIERIA INFORMATICA | C244: 31 | D244: IF451AIN | E244: PROGRAMACION I | F244: 2 | G244: P | H244: A | I244: 0 | J244: 2 | K244: MIÉRCOLES | L244: 9 | M244: 11 | N244: LAB311 | O244: 21 | P244: 0 | Q244: 2
A245: INGENIERIA INFORMATICA | C245: 126 | D245: IF552AIN | E245: REDES DE COMPUTADORAS I | F245: 4 | G245: T | H245: A | I245: 2 | J245: 0 | K245: JUEVES | L245: 9 | M245: 11 | N245: IN202 | O245: 16 | P245: 2 | Q245: 0
A246: INGENIERIA INFORMATICA | C246: 127 | D246: IF552AIN | E246: REDES DE COMPUTADORAS I | F246: 4 | G246: T | H246: A | I246: 1 | J246: 0 | K246: VIERNES | L246: 9 | M246: 10 | N246: IN202 | O246: 16 | P246: 1 | Q246: 0
A247: INGENIERIA INFORMATICA | C247: 128 | D247: IF552AIN | E247: REDES DE COMPUTADORAS I | F247: 4 | G247: P | H247: A | I247: 0 | J247: 2 | K247: MARTES | L247: 9 | M247: 11 | N247: LAB309 | O247: 16 | P247: 0 | Q247: 2
A248: FÍSICA / MATEMÁTICAS | C248: 309 | D248: IF902AFI / IF902AME | E248: TECNOLOGIAS DE LA INFORMACION Y LA COMUNICACIÓN | F248: 3 | G248: T | H248: A | I248: 2 | J248: 0 | K248: MARTES | L248: 18 | M248: 20 | N248: VIRTUAL | O248: 58 | P248: 2 | Q248: 0
G249: SUBTOTAL: | I249: 5 | J249: 6 | L249: TOTAL HRS: | M249: 11 | P249: 5 | Q249: 6
P250: 0 | Q250: 0
A251: CARRERA | D251: AUX-TP 10H | E251: DARIO FRANCISCO DUEÑAS BUSTINZA | F251: CRED. | G251: TIPO | H251: GPO | I251: HT | J251: HP | K251: DIA | L251: HR-INICIO | M251: HR-FIN | N251: AULA | O251: MATRICULADOS | P251: HT | Q251: HP
A252: INGENIERIA INFORMATICA | C252: 101 | D252: IF480BIN | E252: ADMINISTRACION DE TECNOLOGÍAS DE LA INFORMACIÓN | F252: 3 | G252: T | H252: B | I252: 2 | J252: 0 | K252: LUNES | L252: 18 | M252: 20 | N252: IN107 | O252: 9 | P252: 2 | Q252: 0
A253: INGENIERIA INFORMATICA | C253: 102 | D253: IF480BIN | E253: ADMINISTRACION DE TECNOLOGÍAS DE LA INFORMACIÓN | F253: 3 | G253: P | H253: A | I253: 0 | J253: 2 | K253: MIÉRCOLES | L253: 18 | M253: 20 | N253: IN107 | O253: 9 | P253: 0 | Q253: 2
A254: INGENIERIA INFORMATICA | C254: 105 | D254: IF481AIN | E254: INGENIERIA ECONOMICA | F254: 3 | G254: P | H254: B | I254: 0 | J254: 2 | K254: LUNES | L254: 11 | M254: 13 | N254: LAB312 | O254: 20 | P254: 0 | Q254: 2
A255: BIOLOGIA(B) / ING. MECÁNICA | C255: 268 | D255: IF902BBI / IF902AMC | E255: TECNOLOGIAS DE LA INFORMACION Y LA COMUNICACIÓN | F255: 3 | G255: T | H255: A | I255: 2 | J255: 0 | K255: MARTES | L255: 18 | M255: 20 | N255: VIRTUAL | O255: 55 | P255: 2 | Q255: 0
A256: ING. GEOLÓGICA / ING. PETROQUÍMICA | C256: 330 | D256: IF902AGI / IF902APQ | E256: TECNOLOGIAS DE LA INFORMACION Y LA COMUNICACIÓN | F256: 3 | G256: T | H256: A | I256: 2 | J256: 0 | K256: JUEVES | L256: 16 | M256: 18 | N256: VIRTUAL | O256: 53 | P256: 2 | Q256: 0
G257: SUBTOTAL: | I257: 6 | J257: 4 | L257: TOTAL HRS: | M257: 10 | P257: 6 | Q257: 4
P258: 0 | Q258: 0
A259: CARRERA | D259: AUX-TP 10H | E259: DORIS SABINA AGUIRRE CARBAJAL | F259: CRED. | G259: TIPO | H259: GPO | I259: HT | J259: HP | K259: DIA | L259: HR-INICIO | M259: HR-FIN | N259: AULA | O259: MATRICULADOS | P259: HT | Q259: HP
A260: INGENIERIA INFORMATICA | C260: 76 | D260: IF459BIN | E260: COMPUTACION GRAFICA II | F260: 4 | G260: P | H260: B | I260: 0 | J260: 2 | K260: MARTES | L260: 14 | M260: 16 | N260: LAB304 | O260: 20 | P260: 0 | Q260: 2
A261: CONTABILIDAD | C261: 277 | D261: IF902ACO | E261: TECNOLOGIAS DE LA INFORMACION Y LA COMUNICACIÓN | F261: 3 | G261: T | H261: A | I261: 2 | J261: 0 | K261: MIÉRCOLES | L261: 18 | M261: 20 | N261: VIRTUAL | O261: 60 | P261: 2 | Q261: 0
A262: EDUCACION | C262: 299 | D262: IF902DEU | E262: TECNOLOGIAS DE LA INFORMACION Y LA COMUNICACIÓN | F262: 3 | G262: T | H262: D | I262: 2 | J262: 0 | K262: LUNES | L262: 14 | M262: 16 | N262: VIRTUAL | O262: 69 | P262: 2 | Q262: 0
A263: ENFERMERIA | C263: 302 | D263: IF902AEN | E263: TECNOLOGIAS DE LA INFORMACION Y LA COMUNICACIÓN | F263: 3 | G263: T | H263: A | I263: 2 | J263: 0 | K263: MIÉRCOLES | L263: 16 | M263: 18 | N263: VIRTUAL | O263: 54 | P263: 2 | Q263: 0
A264: FÍSICA / MATEMÁTICAS | C264: 310 | D264: IF902AFI / IF902AME | E264: TECNOLOGIAS DE LA INFORMACION Y LA COMUNICACIÓN | F264: 3 | G264: P | H264: A | I264: 0 | J264: 2 | K264: JUEVES | L264: 18 | M264: 20 | N264: VIRTUAL | O264: 58 | P264: 0 | Q264: 2
G265: SUBTOTAL: | I265: 6 | J265: 4 | L265: TOTAL HRS: | M265: 10 | P265: 6 | Q265: 4
P266: 0 | Q266: 0
A267: CARRERA | D267: AUX-TP 10H | E267: TANY VILLALBA VILLALBA | F267: CRED. | G267: TIPO | H267: GPO | I267: HT | J267: HP | K267: DIA | L267: HR-INICIO | M267: HR-FIN | N267: AULA | O267: MATRICULADOS | P267: HT | Q267: HP
A268: INGENIERIA INFORMATICA | C268: 136 | D268: IF556AIN | E268: SISTEMAS EMBEBIDOS | F268: 4 | G268: T | H268: A | I268: 2 | J268: 0 | K268: MARTES | L268: 9 | M268: 11 | N268: IN107 | O268: 52 | P268: 2 | Q268: 0
A269: INGENIERIA INFORMATICA | C269: 137 | D269: IF556AIN | E269: SISTEMAS EMBEBIDOS | F269: 4 | G269: T | H269: A | I269: 1 | J269: 0 | K269: VIERNES | L269: 9 | M269: 10 | N269: IN107 | O269: 52 | P269: 1 | Q269: 0
A270: INGENIERIA INFORMATICA | C270: 138 | D270: IF556AIN | E270: SISTEMAS EMBEBIDOS | F270: 4 | G270: P | H270: A | I270: 0 | J270: 2 | K270: JUEVES | L270: 9 | M270: 11 | N270: LAB309 | O270: 26 | P270: 0 | Q270: 2
A271: CIENCIAS ADMINISTRATIVAS(B) / ECONOMÍA(B) | C271: 273 | D271: IF902BAE / IF902BEO | E271: TECNOLOGIAS DE LA INFORMACION Y LA COMUNICACIÓN | F271: 3 | G271: T | H271: A | I271: 2 | J271: 0 | K271: MIÉRCOLES | L271: 18 | M271: 20 | N271: VIRTUAL | O271: 53 | P271: 2 | Q271: 0
A272: ENFERMERÍA(B) / FARMACIA Y BIOQUIMICA | C272: 304 | D272: IF902BEN / IF902AQF | E272: TECNOLOGIAS DE LA INFORMACION Y LA COMUNICACIÓN | F272: 3 | G272: T | H272: A | I272: 2 | J272: 0 | K272: MIÉRCOLES | L272: 16 | M272: 18 | N272: VIRTUAL | O272: 70 | P272: 2 | Q272: 0
A273: ENFERMERÍA(B) / FARMACIA Y BIOQUIMICA | C273: 305 | D273: IF902BEN / IF902AQF | E273: TECNOLOGIAS DE LA INFORMACION Y LA COMUNICACIÓN | F273: 3 | G273: P | H273: A | I273: 0 | J273: 2 | K273: LUNES | L273: 16 | M273: 18 | N273: VIRTUAL | O273: 35 | P273: 0 | Q273: 2
G274: SUBTOTAL: | I274: 7 | J274: 4 | L274: TOTAL HRS: | M274: 11 | P274: 7 | Q274: 4
P275: 0 | Q275: 0
A276: CARRERA | D276: A1 | E276: CARLOS FERNANDO MONTOYA CUBAS | F276: CRED. | G276: TIPO | H276: GPO | I276: HT | J276: HP | K276: DIA | L276: HR-INICIO | M276: HR-FIN | N276: AULA | O276: MATRICULADOS | P276: HT | Q276: HP
A277: INGENIERIA INFORMATICA | C277: 46 | D277: IF453CIN | E277: PROGRAMACION II | F277: 2 | G277: P | H277: C | I277: 0 | J277: 2 | K277: MARTES | L277: 16 | M277: 18 | N277: LAB312 | O277: 19 | P277: 0 | Q277: 2
A278: INGENIERIA INFORMATICA | C278: 47 | D278: IF453CIN | E278: PROGRAMACION II | F278: 2 | G278: P | H278: C | I278: 0 | J278: 2 | K278: JUEVES | L278: 16 | M278: 18 | N278: LAB312 | O278: 19 | P278: 0 | Q278: 2
A279: INGENIERIA INFORMATICA | C279: 77 | D279: IF466AIN | E279: COMPILADORES | F279: 3 | G279: T | H279: A | I279: 2 | J279: 0 | K279: MARTES | L279: 18 | M279: 20 | N279: IN202 | O279: 30 | P279: 2 | Q279: 0
A280: INGENIERIA INFORMATICA | C280: 187 | D280: IF650BIN | E280: MODELOS PROBABILISTICOS | F280: 4 | G280: T | H280: B | I280: 2 | J280: 0 | K280: MARTES | L280: 14 | M280: 16 | N280: IN108 | O280: 27 | P280: 2 | Q280: 0
A281: INGENIERIA INFORMATICA | C281: 188 | D281: IF650BIN | E281: MODELOS PROBABILISTICOS | F281: 4 | G281: T | H281: B | I281: 1 | J281: 0 | K281: VIERNES | L281: 15 | M281: 16 | N281: IN108 | O281: 27 | P281: 1 | Q281: 0
A282: INGENIERIA INFORMATICA | C282: 189 | D282: IF650BIN | E282: MODELOS PROBABILISTICOS | F282: 4 | G282: P | H282: A | I282: 0 | J282: 2 | K282: JUEVES | L282: 14 | M282: 16 | N282: IN108 | O282: 27 | P282: 0 | Q282: 2
A283: INGENIERIA INFORMATICA | C283: 194 | D283: IF651BIN | E283: INTELIGENCIA ARTIFICIAL | F283: 4 | G283: T | H283: B | I283: 2 | J283: 0 | K283: MIÉRCOLES | L283: 16 | M283: 18 | N283: IN202 | O283: 27 | P283: 2 | Q283: 0
A284: INGENIERIA INFORMATICA | C284: 195 | D284: IF651BIN | E284: INTELIGENCIA ARTIFICIAL | F284: 4 | G284: T | H284: B | I284: 1 | J284: 0 | K284: VIERNES | L284: 17 | M284: 18 | N284: IN202 | O284: 27 | P284: 1 | Q284: 0
A285: INGENIERIA INFORMATICA | C285: 196 | D285: IF651BIN | E285: INTELIGENCIA ARTIFICIAL | F285: 4 | G285: P | H285: A | I285: 0 | J285: 2 | K285: LUNES | L285: 16 | M285: 18 | N285: LAB301 | O285: 27 | P285: 0 | Q285: 2
G286: SUBTOTAL: | I286: 8 | J286: 8 | L286: TOTAL HRS: | M286: 16 | P286: 8 | Q286: 8
P287: 0 | Q287: 0
A288: CARRERA | D288: B1 | E288: CARLOS RAMÓN QUISPE ONOFRE | F288: CRED. | G288: TIPO | H288: GPO | I288: HT | J288: HP | K288: DIA | L288: HR-INICIO | M288: HR-FIN | N288: AULA | O288: MATRICULADOS | P288: HT | Q288: HP
A289: INGENIERIA DE MINAS | C289: 20 | D289: IF401AMI | E289: PROGRAMACION DIGITAL | F289: 2 | G289: T | H289: A | I289: 0 | J289: 1 | K289: LUNES | L289: 16 | M289: 17 | N289: IM-204 | O289: 45 | P289: 0 | Q289: 1
A290: INGENIERIA DE MINAS | C290: 21 | D290: IF401AMI | E290: PROGRAMACION DIGITAL | F290: 2 | G290: P | H290: A | I290: 0 | J290: 3 | K290: LUNES | L290: 17 | M290: 20 | N290: LAB309 | O290: 45 | P290: 0 | Q290: 3
A291: INGENIERIA INFORMATICA | C291: 239 | D291: IF669BIN | E291: MODELADO Y SIMULACION | F291: 4 | G291: T | H291: B | I291: 2 | J291: 0 | K291: LUNES | L291: 14 | M291: 16 | N291: IN203 | O291: 22 | P291: 2 | Q291: 0
A292: INGENIERIA INFORMATICA | C292: 240 | D292: IF669BIN | E292: MODELADO Y SIMULACION | F292: 4 | G292: T | H292: B | I292: 1 | J292: 0 | K292: VIERNES | L292: 14 | M292: 15 | N292: IN203 | O292: 22 | P292: 1 | Q292: 0
A293: INGENIERIA INFORMATICA | C293: 241 | D293: IF669BIN | E293: MODELADO Y SIMULACION | F293: 4 | G293: P | H293: A | I293: 0 | J293: 2 | K293: MIÉRCOLES | L293: 14 | M293: 16 | N293: LAB303 | O293: 22 | P293: 0 | Q293: 2
A294: BIOLOGIA | C294: 267 | D294: IF902ABI | E294: TECNOLOGIAS DE LA INFORMACION Y LA COMUNICACIÓN | F294: 3 | G294: P | H294: A | I294: 0 | J294: 2 | K294: JUEVES | L294: 18 | M294: 20 | N294: VIRTUAL | O294: 55 | P294: 0 | Q294: 2
A295: EDUCACION (ESPINAR) | C295: 288 | D295: IF902AEE | E295: TECNOLOGIAS DE LA INFORMACION Y LA COMUNICACIÓN | F295: 3 | G295: T | H295: A | I295: 2 | J295: 0 | K295: MARTES | L295: 14 | M295: 16 | N295: VIRTUAL | O295: 59 | P295: 2 | Q295: 0
A296: HISTORIA | C296: 311 | D296: IF902AHI | E296: TECNOLOGIAS DE LA INFORMACION Y LA COMUNICACIÓN | F296: 3 | G296: T | H296: A | I296: 2 | J296: 0 | K296: MARTES | L296: 7 | M296: 9 | N296: VIRTUAL | O296: 67 | P296: 2 | Q296: 0
A297: HISTORIA | C297: 312 | D297: IF902AHI | E297: TECNOLOGIAS DE LA INFORMACION Y LA COMUNICACIÓN | F297: 3 | G297: P | H297: A | I297: 0 | J297: 2 | K297: JUEVES | L297: 7 | M297: 9 | N297: VIRTUAL | O297: 34 | P297: 0 | Q297: 2
G298: SUBTOTAL: | I298: 7 | J298: 10 | L298: TOTAL HRS: | M298: 17 | P298: 7 | Q298: 10
P299: 0 | Q299: 0
A300: CARRERA | D300: B1 | E300: BORIS CHULLO LLAVE | F300: CRED. | G300: TIPO | H300: GPO | I300: HT | J300: HP | K300: DIA | L300: HR-INICIO | M300: HR-FIN | N300: AULA | O300: MATRICULADOS | P300: HT | Q300: HP
A301: INGENIERIA INFORMATICA | C301: 44 | D301: IF453BIN | E301: PROGRAMACION II | F301: 2 | G301: P | H301: B | I301: 0 | J301: 2 | K301: MARTES | L301: 9 | M301: 11 | N301: LAB312 | O301: 19 | P301: 0 | Q301: 2
A302: INGENIERIA INFORMATICA | C302: 45 | D302: IF453BIN | E302: PROGRAMACION II | F302: 2 | G302: P | H302: B | I302: 0 | J302: 2 | K302: JUEVES | L302: 9 | M302: 11 | N302: LAB312 | O302: 19 | P302: 0 | Q302: 2
A303: INGENIERIA INFORMATICA | C303: 50 | D303: IF455AIN | E303: ALGORITMOS PARALELOS Y DISTRIBUIDOS | F303: 4 | G303: T | H303: A | I303: 2 | J303: 0 | K303: LUNES | L303: 9 | M303: 11 | N303: IN201 | O303: 30 | P303: 2 | Q303: 0
A304: INGENIERIA INFORMATICA | C304: 51 | D304: IF455AIN | E304: ALGORITMOS PARALELOS Y DISTRIBUIDOS | F304: 4 | G304: T | H304: A | I304: 1 | J304: 0 | K304: VIERNES | L304: 10 | M304: 11 | N304: IN201 | O304: 30 | P304: 1 | Q304: 0
A305: INGENIERIA INFORMATICA | C305: 52 | D305: IF455AIN | E305: ALGORITMOS PARALELOS Y DISTRIBUIDOS | F305: 4 | G305: P | H305: A | I305: 0 | J305: 2 | K305: MIÉRCOLES | L305: 9 | M305: 11 | N305: LAB303 | O305: 30 | P305: 0 | Q305: 2
A306: INGENIERIA INFORMATICA | C306: 85 | D306: IF467BIN | E306: ANALISIS Y DISEÑO DE ALGORITMOS | F306: 3 | G306: T | H306: B | I306: 2 | J306: 0 | K306: JUEVES | L306: 14 | M306: 16 | N306: IN202 | O306: 20 | P306: 2 | Q306: 0
A307: INGENIERIA INFORMATICA | C307: 86 | D307: IF467BIN | E307: ANALISIS Y DISEÑO DE ALGORITMOS | F307: 3 | G307: P | H307: A | I307: 0 | J307: 2 | K307: MARTES | L307: 14 | M307: 16 | N307: LAB301 | O307: 20 | P307: 0 | Q307: 2
A308: AGRONOMÍA / ZOOTÉCNIA | C308: 258 | D308: IF902AAO / IF902AZO | E308: TECNOLOGIAS DE LA INFORMACION Y LA COMUNICACIÓN | F308: 3 | G308: P | H308: B | I308: 0 | J308: 2 | K308: MIÉRCOLES | L308: 14 | M308: 16 | N308: VIRTUAL | O308: 37 | P308: 0 | Q308: 2
A309: DERECHO | C309: 283 | D309: IF902ADR | E309: TECNOLOGIAS DE LA INFORMACION Y LA COMUNICACIÓN | F309: 3 | G309: P | H309: A | I309: 0 | J309: 2 | K309: JUEVES | L309: 11 | M309: 13 | N309: VIRTUAL | O309: 30 | P309: 0 | Q309: 2
G310: SUBTOTAL: | I310: 5 | J310: 12 | L310: TOTAL HRS: | M310: 17 | P310: 5 | Q310: 12
P311: 0 | Q311: 0
A312: CARRERA | D312: B1 | E312: RAY DUEÑAS JIMÉNEZ | F312: CRED. | G312: TIPO | H312: GPO | I312: HT | J312: HP | K312: DIA | L312: HR-INICIO | M312: HR-FIN | N312: AULA | O312: MATRICULADOS | P312: HT | Q312: HP
A313: INGENIERIA ELECTRONICA | C313: 11 | D313: IF109ALI | E313: PROGRAMACION DIGITAL II | F313: 3 | G313: T | H313: A | I313: 2 | J313: 0 | K313: MARTES | L313: 17 | M313: 19 | N313: IN102 | O313: 36 | P313: 2 | Q313: 0
A314: INGENIERIA ELECTRONICA | C314: 12 | D314: IF109ALI | E314: PROGRAMACION DIGITAL II | F314: 3 | G314: P | H314: A | I314: 0 | J314: 2 | K314: JUEVES | L314: 17 | M314: 19 | N314: LAB311 | O314: 36 | P314: 0 | Q314: 2
A315: INGENIERIA INFORMATICA | C315: 183 | D315: IF619BIN | E315: ANÁLISIS DE DATOS EMPRESARIALES | F315: 3 | G315: P | H315: B | I315: 0 | J315: 2 | K315: JUEVES | L315: 14 | M315: 16 | N315: LAB305 | O315: 24 | P315: 0 | Q315: 2
A316: INGENIERIA INFORMATICA | C316: 248 | D316: IF711BIN | E316: SEMINARIO DE INVESTIGACION II | F316: 3 | G316: T | H316: B | I316: 2 | J316: 0 | K316: LUNES | L316: 7 | M316: 9 | N316: IN102 | O316: 40 | P316: 2 | Q316: 0
A317: INGENIERIA INFORMATICA | C317: 249 | D317: IF711BIN | E317: SEMINARIO DE INVESTIGACION II | F317: 3 | G317: P | H317: A | I317: 0 | J317: 2 | K317: MIÉRCOLES | L317: 7 | M317: 9 | N317: IN102 | O317: 40 | P317: 0 | Q317: 2
A318: CONTABILIDAD | C318: 278 | D318: IF902ACO | E318: TECNOLOGIAS DE LA INFORMACION Y LA COMUNICACIÓN | F318: 3 | G318: P | H318: A | I318: 0 | J318: 2 | K318: LUNES | L318: 18 | M318: 20 | N318: VIRTUAL | O318: 30 | P318: 0 | Q318: 2
A319: DERECHO | C319: 282 | D319: IF902ADR | E319: TECNOLOGIAS DE LA INFORMACION Y LA COMUNICACIÓN | F319: 3 | G319: T | H319: A | I319: 2 | J319: 0 | K319: MARTES | L319: 11 | M319: 13 | N319: VIRTUAL | O319: 60 | P319: 2 | Q319: 0
A320: ING. AGROINDUSTRIAL (SIC) / MEDICINA VETERINARIA (SIC) | C320: 317 | D320: IF902AIA / IF902AVS | E320: TECNOLOGIAS DE LA INFORMACION Y LA COMUNICACIÓN | F320: 3 | G320: T | H320: A | I320: 2 | J320: 0 | K320: MARTES | L320: 14 | M320: 16 | N320: VIRTUAL | O320: 71 | P320: 2 | Q320: 0
G322: SUBTOTAL: | I322: 8 | J322: 8 | L322: TOTAL HRS: | M322: 16 | P322: 8 | Q322: 8
P323: 0 | Q323: 0
A324: CARRERA | D324: B1 | E324: HÉCTOR EDUARDO UGARTE ROJAS | F324: CRED. | G324: TIPO | H324: GPO | I324: HT | J324: HP | K324: DIA | L324: HR-INICIO | M324: HR-FIN | N324: AULA | O324: MATRICULADOS | P324: HT | Q324: HP
A325: INGENIERIA INFORMATICA | C325: 42 | D325: IF453AIN | E325: PROGRAMACION II | F325: 2 | G325: P | H325: A | I325: 0 | J325: 2 | K325: MARTES | L325: 9 | M325: 11 | N325: LAB311 | O325: 24 | P325: 0 | Q325: 2
A326: INGENIERIA INFORMATICA | C326: 43 | D326: IF453AIN | E326: PROGRAMACION II | F326: 2 | G326: P | H326: A | I326: 0 | J326: 2 | K326: JUEVES | L326: 9 | M326: 11 | N326: LAB311 | O326: 24 | P326: 0 | Q326: 2
A327: INGENIERIA INFORMATICA | C327: 48 | D327: IF454AIN | E327: TEORIA DE LA COMPUTACION | F327: 3 | G327: T | H327: A | I327: 2 | J327: 0 | K327: LUNES | L327: 7 | M327: 9 | N327: IN108 | O327: 44 | P327: 2 | Q327: 0
A328: INGENIERIA INFORMATICA | C328: 49 | D328: IF454AIN | E328: TEORIA DE LA COMPUTACION | F328: 3 | G328: P | H328: A | I328: 0 | J328: 2 | K328: MIÉRCOLES | L328: 7 | M328: 9 | N328: IN108 | O328: 44 | P328: 0 | Q328: 2
A329: INGENIERIA INFORMATICA | C329: 144 | D329: IF611AIN | E329: METODOLOGIA DE DESARROLLO DE SOFTWARE | F329: 3 | G329: T | H329: A | I329: 2 | J329: 0 | K329: MARTES | L329: 7 | M329: 9 | N329: IN201 | O329: 24 | P329: 2 | Q329: 0
A330: INGENIERIA INFORMATICA | C330: 145 | D330: IF611AIN | E330: METODOLOGIA DE DESARROLLO DE SOFTWARE | F330: 3 | G330: P | H330: A | I330: 0 | J330: 2 | K330: JUEVES | L330: 7 | M330: 9 | N330: LAB301 | O330: 24 | P330: 0 | Q330: 2
A331: AGRONOMÍA / ZOOTÉCNIA | C331: 256 | D331: IF902AAO / IF902AZO | E331: TECNOLOGIAS DE LA INFORMACION Y LA COMUNICACIÓN | F331: 3 | G331: T | H331: A | I331: 2 | J331: 0 | K331: LUNES | L331: 14 | M331: 16 | N331: VIRTUAL | O331: 75 | P331: 2 | Q331: 0
A332: ING. ELÉCTRICA / ING. INFORMÁTICA(B) | C332: 322 | D332: IF902AEI / IF902BIN | E332: TECNOLOGIAS DE LA INFORMACION Y LA COMUNICACIÓN | F332: 3 | G332: T | H332: A | I332: 2 | J332: 0 | K332: MARTES | L332: 14 | M332: 16 | N332: VIRTUAL | O332: 71 | P332: 2 | Q332: 0
G333: SUBTOTAL: | I333: 8 | J333: 8 | L333: TOTAL HRS: | M333: 16 | P333: 8 | Q333: 8
P334: 0 | Q334: 0
A335: CARRERA | D335: B1 | E335: LISETH URPY SEGUNDO CARPIO | F335: CRED. | G335: TIPO | H335: GPO | I335: HT | J335: HP | K335: DIA | L335: HR-INICIO | M335: HR-FIN | N335: AULA | O335: MATRICULADOS | P335: HT | Q335: HP
A336: INGENIERIA INFORMATICA | C336: 7 | D336: IF064AIN | E336: TALLER DE DEBATE | F336: 2 | G336: P | H336: A | I336: 0 | J336: 2 | K336: JUEVES | L336: 11 | M336: 13 | N336: IN206 | O336: 39 | P336: 0 | Q336: 2
A337: INGENIERIA INFORMATICA | C337: 8 | D337: IF064AIN | E337: TALLER DE DEBATE | F337: 2 | G337: P | H337: A | I337: 0 | J337: 2 | K337: SÁBADO | L337: 7 | M337: 9 | N337: IN206 | O337: 39 | P337: 0 | Q337: 2
A338: INGENIERIA INFORMATICA | C338: 156 | D338: IF613AIN | E338: DESARROLLO DE SOFTWARE I | F338: 2 | G338: P | H338: A | I338: 0 | J338: 2 | K338: LUNES | L338: 7 | M338: 9 | N338: LAB303 | O338: 24 | P338: 0 | Q338: 2
A339: INGENIERIA INFORMATICA | C339: 157 | D339: IF613AIN | E339: DESARROLLO DE SOFTWARE I | F339: 2 | G339: P | H339: A | I339: 0 | J339: 2 | K339: MIÉRCOLES | L339: 7 | M339: 9 | N339: LAB303 | O339: 24 | P339: 0 | Q339: 2
A340: INGENIERIA INFORMATICA | C340: 179 | D340: IF619AIN | E340: ANÁLISIS DE DATOS EMPRESARIALES | F340: 3 | G340: T | H340: A | I340: 2 | J340: 0 | K340: MARTES | L340: 7 | M340: 9 | N340: IN202 | O340: 49 | P340: 2 | Q340: 0
A341: INGENIERIA INFORMATICA | C341: 180 | D341: IF619AIN | E341: ANÁLISIS DE DATOS EMPRESARIALES | F341: 3 | G341: P | H341: A | I341: 0 | J341: 2 | K341: JUEVES | L341: 7 | M341: 9 | N341: LAB303 | O341: 49 | P341: 0 | Q341: 2
A342: MEDICINA HUMANA / ODONTOLOGÍA | C342: 336 | D342: IF902AMD / IF902AOD | E342: TECNOLOGIAS DE LA INFORMACION Y LA COMUNICACIÓN | F342: 3 | G342: T | H342: A | I342: 2 | J342: 0 | K342: MIÉRCOLES | L342: 16 | M342: 18 | N342: VIRTUAL | O342: 52 | P342: 2 | Q342: 0
A343: MEDICINA HUMANA / ODONTOLOGÍA | C343: 337 | D343: IF902AMD / IF902AOD | E343: TECNOLOGIAS DE LA INFORMACION Y LA COMUNICACIÓN | F343: 3 | G343: P | H343: A | I343: 0 | J343: 2 | K343: LUNES | L343: 16 | M343: 18 | N343: VIRTUAL | O343: 52 | P343: 0 | Q343: 2
G344: SUBTOTAL: | I344: 4 | J344: 12 | L344: TOTAL HRS: | M344: 16 | P344: 4 | Q344: 12
P345: 0 | Q345: 0
A346: CARRERA | D346: B1 | E346: LUIS ALVARO MONZÓN CONDORI | F346: CRED. | G346: TIPO | H346: GPO | I346: HT | J346: HP | K346: DIA | L346: HR-INICIO | M346: HR-FIN | N346: AULA | O346: MATRICULADOS | P346: HT | Q346: HP
A347: INGENIERIA INFORMATICA | C347: 32 | D347: IF451BIN | E347: PROGRAMACION I | F347: 2 | G347: P | H347: B | I347: 0 | J347: 2 | K347: LUNES | L347: 9 | M347: 11 | N347: LAB312 | O347: 24 | P347: 0 | Q347: 2
A348: INGENIERIA INFORMATICA | C348: 33 | D348: IF451BIN | E348: PROGRAMACION I | F348: 2 | G348: P | H348: B | I348: 0 | J348: 2 | K348: MIÉRCOLES | L348: 9 | M348: 11 | N348: LAB312 | O348: 24 | P348: 0 | Q348: 2
A349: INGENIERIA INFORMATICA | C349: 158 | D349: IF613BIN | E349: DESARROLLO DE SOFTWARE I | F349: 2 | G349: P | H349: B | I349: 0 | J349: 2 | K349: LUNES | L349: 7 | M349: 9 | N349: LAB304 | O349: 12 | P349: 0 | Q349: 2
A350: INGENIERIA INFORMATICA | C350: 159 | D350: IF613BIN | E350: DESARROLLO DE SOFTWARE I | F350: 2 | G350: P | H350: B | I350: 0 | J350: 2 | K350: MIÉRCOLES | L350: 7 | M350: 9 | N350: LAB304 | O350: 12 | P350: 0 | Q350: 2
A351: INGENIERIA INFORMATICA | C351: 160 | D351: IF613CIN | E351: DESARROLLO DE SOFTWARE I | F351: 2 | G351: P | H351: C | I351: 0 | J351: 2 | K351: LUNES | L351: 14 | M351: 16 | N351: LAB302 | O351: 23 | P351: 0 | Q351: 2
A352: INGENIERIA INFORMATICA | C352: 161 | D352: IF613CIN | E352: DESARROLLO DE SOFTWARE I | F352: 2 | G352: P | H352: C | I352: 0 | J352: 2 | K352: MIÉRCOLES | L352: 14 | M352: 16 | N352: LAB302 | O352: 23 | P352: 0 | Q352: 2
A353: INGENIERIA CIVIL | C353: 314 | D353: IF902ACI | E353: TECNOLOGIAS DE LA INFORMACION Y LA COMUNICACIÓN | F353: 3 | G353: T | H353: A | I353: 2 | J353: 0 | K353: MARTES | L353: 14 | M353: 16 | N353: VIRTUAL | O353: 69 | P353: 2 | Q353: 0
A354: INGENIERIA QUIMICA | C354: 335 | D354: IF902AQI | E354: TECNOLOGIAS DE LA INFORMACION Y LA COMUNICACIÓN | F354: 3 | G354: P | H354: A | I354: 0 | J354: 2 | K354: MARTES | L354: 16 | M354: 18 | N354: VIRTUAL | O354: 59 | P354: 0 | Q354: 2
G356: SUBTOTAL: | I356: 2 | J356: 14 | L356: TOTAL HRS: | M356: 16 | P356: 2 | Q356: 14
P357: 0 | Q357: 0
A358: CARRERA | D358: B2 | E358: JISBAJ GAMARRA SALAS | F358: CRED. | G358: TIPO | H358: GPO | I358: HT | J358: HP | K358: DIA | L358: HR-INICIO | M358: HR-FIN | N358: AULA | O358: MATRICULADOS | P358: HT | Q358: HP
A359: INGENIERIA INFORMATICA | C359: 147 | D359: IF611BIN | E359: METODOLOGIA DE DESARROLLO DE SOFTWARE | F359: 3 | G359: T | H359: B | I359: 2 | J359: 0 | K359: MARTES | L359: 14 | M359: 16 | N359: IN201 | O359: 18 | P359: 2 | Q359: 0
A360: INGENIERIA INFORMATICA | C360: 148 | D360: IF611BIN | E360: METODOLOGIA DE DESARROLLO DE SOFTWARE | F360: 3 | G360: P | H360: A | I360: 0 | J360: 2 | K360: JUEVES | L360: 14 | M360: 16 | N360: LAB306 | O360: 18 | P360: 0 | Q360: 2
A361: ECONOMÍA(A) / HISTORIA(B) | C361: 285 | D361: IF902AEO / IF902BHI | E361: TECNOLOGIAS DE LA INFORMACION Y LA COMUNICACIÓN | F361: 3 | G361: T | H361: A | I361: 2 | J361: 0 | K361: MARTES | L361: 7 | M361: 9 | N361: VIRTUAL | O361: 66 | P361: 2 | Q361: 0
A362: ECONOMÍA(A) / HISTORIA(B) | C362: 286 | D362: IF902AEO / IF902BHI | E362: TECNOLOGIAS DE LA INFORMACION Y LA COMUNICACIÓN | F362: 3 | G362: P | H362: A | I362: 0 | J362: 2 | K362: JUEVES | L362: 7 | M362: 9 | N362: VIRTUAL | O362: 33 | P362: 0 | Q362: 2
G363: SUBTOTAL: | I363: 4 | J363: 4 | L363: TOTAL HRS: | M363: 8 | P363: 4 | Q363: 4
P364: 0 | Q364: 0
A365: CARRERA | D365: B2 | E365: HENRY SAMUEL DUEÑAS DE LA CRUZ | F365: CRED. | G365: TIPO | H365: GPO | I365: HT | J365: HP | K365: DIA | L365: HR-INICIO | M365: HR-FIN | N365: AULA | O365: MATRICULADOS | P365: HT | Q365: HP
A366: INGENIERIA INFORMATICA | C366: 166 | D366: IF614BIN | E366: INGENIERIA DE SOFTWARE I | F366: 4 | G366: T | H366: B | I366: 2 | J366: 0 | K366: LUNES | L366: 16 | M366: 18 | N366: IN203 | O366: 29 | P366: 2 | Q366: 0
A367: INGENIERIA INFORMATICA | C367: 167 | D367: IF614BIN | E367: INGENIERIA DE SOFTWARE I | F367: 4 | G367: T | H367: B | I367: 1 | J367: 0 | K367: VIERNES | L367: 16 | M367: 17 | N367: IN203 | O367: 29 | P367: 1 | Q367: 0
A368: INGENIERIA INFORMATICA | C368: 168 | D368: IF614BIN | E368: INGENIERIA DE SOFTWARE I | F368: 4 | G368: P | H368: A | I368: 0 | J368: 2 | K368: MIÉRCOLES | L368: 16 | M368: 18 | N368: LAB302 | O368: 29 | P368: 0 | Q368: 2
A369: ING. ELECTRÓNICA / ING. INFORMÁTICA(A) | C369: 325 | D369: IF902ALI / IF902AIN | E369: TECNOLOGIAS DE LA INFORMACION Y LA COMUNICACIÓN | F369: 3 | G369: T | H369: A | I369: 2 | J369: 0 | K369: MARTES | L369: 14 | M369: 16 | N369: VIRTUAL | O369: 65 | P369: 2 | Q369: 0
A370: ING. ELECTRÓNICA / ING. INFORMÁTICA(A) | C370: 326 | D370: IF902ALI / IF902AIN | E370: TECNOLOGIAS DE LA INFORMACION Y LA COMUNICACIÓN | F370: 3 | G370: P | H370: A | I370: 0 | J370: 2 | K370: JUEVES | L370: 14 | M370: 16 | N370: VIRTUAL | O370: 33 | P370: 0 | Q370: 2
G371: SUBTOTAL: | I371: 5 | J371: 4 | L371: TOTAL HRS: | M371: 9 | P371: 5 | Q371: 4
P372: 0 | Q372: 0
A373: CARRERA | D373: B3 | E373: ANA ROCIO CARDENAS MAITA | F373: CRED. | G373: TIPO | H373: GPO | I373: HT | J373: HP | K373: DIA | L373: HR-INICIO | M373: HR-FIN | N373: AULA | O373: MATRICULADOS | P373: HT | Q373: HP
A374: ARQUITECTURA | C374: 263 | D374: IF902AAT | E374: TECNOLOGIAS DE LA INFORMACION Y LA COMUNICACIÓN | F374: 3 | G374: T | H374: A | I374: 2 | J374: 0 | K374: MARTES | L374: 14 | M374: 16 | N374: VIRTUAL | O374: 64 | P374: 2 | Q374: 0
A375: ARQUITECTURA | C375: 264 | D375: IF902AAT | E375: TECNOLOGIAS DE LA INFORMACION Y LA COMUNICACIÓN | F375: 3 | G375: P | H375: A | I375: 0 | J375: 2 | K375: JUEVES | L375: 14 | M375: 16 | N375: VIRTUAL | O375: 32 | P375: 0 | Q375: 2
G376: SUBTOTAL: | I376: 2 | J376: 2 | L376: TOTAL HRS: | M376: 4 | P376: 2 | Q376: 2
P377: 0 | Q377: 0
A378: CARRERA | D378: B3 | E378: RAUL HUILLCA HUALLPARIMACHI | F378: CRED. | G378: TIPO | H378: GPO | I378: HT | J378: HP | K378: DIA | L378: HR-INICIO | M378: HR-FIN | N378: AULA | O378: MATRICULADOS | P378: HT | Q378: HP
A379: INGENIERIA INFORMATICA | C379: 83 | D379: IF467AIN | E379: ANALISIS Y DISEÑO DE ALGORITMOS | F379: 3 | G379: T | H379: A | I379: 2 | J379: 0 | K379: JUEVES | L379: 7 | M379: 9 | N379: IN202 | O379: 18 | P379: 2 | Q379: 0
A380: INGENIERIA INFORMATICA | C380: 84 | D380: IF467AIN | E380: ANALISIS Y DISEÑO DE ALGORITMOS | F380: 3 | G380: P | H380: A | I380: 0 | J380: 2 | K380: MARTES | L380: 7 | M380: 9 | N380: LAB301 | O380: 18 | P380: 0 | Q380: 2
G381: SUBTOTAL: | I381: 2 | J381: 2 | L381: TOTAL HRS: | M381: 4 | P381: 2 | Q381: 2
P382: 0 | Q382: 0
A383: CARRERA | D383: JP-TC | E383: GABRIELA ZÚÑIGA ROJAS | F383: CRED. | G383: TIPO | H383: GPO | I383: HT | J383: HP | K383: DIA | L383: HR-INICIO | M383: HR-FIN | N383: AULA | O383: MATRICULADOS | P383: HT | Q383: HP
A384: INGENIERIA INFORMATICA | C384: 193 | D384: IF651AIN | E384: INTELIGENCIA ARTIFICIAL | F384: 4 | G384: P | H384: B | I384: 0 | J384: 2 | K384: LUNES | L384: 9 | M384: 11 | N384: LAB302 | O384: 17 | P384: 0 | Q384: 2
A385: INGENIERIA INFORMATICA | C385: 200 | D385: IF652AIN | E385: APRENDIZAJE AUTOMATICO | F385: 4 | G385: P | H385: B | I385: 0 | J385: 2 | K385: MIÉRCOLES | L385: 9 | M385: 11 | N385: LAB306 | O385: 14 | P385: 0 | Q385: 2
A386: INGENIERIA INFORMATICA | C386: 213 | D386: IF656AIN | E386: PROCESAMIENTO DE LENGUAJE NATURAL | F386: 4 | G386: P | H386: B | I386: 0 | J386: 2 | K386: LUNES | L386: 11 | M386: 13 | N386: LAB302 | O386: 14 | P386: 0 | Q386: 2
A387: ANTROPOLOGÍA / CS. DE LA COMUNICACIÓN(B) | C387: 260 | D387: IF902AAN / IF902BCC | E387: TECNOLOGIAS DE LA INFORMACION Y LA COMUNICACIÓN | F387: 3 | G387: P | H387: A | I387: 0 | J387: 2 | K387: MARTES | L387: 9 | M387: 11 | N387: VIRTUAL | O387: 56 | P387: 0 | Q387: 2
A388: CIENCIAS ADMINISTRATIVAS / HISTORIA(C) | C388: 272 | D388: IF902AAE / IF902CHI | E388: TECNOLOGIAS DE LA INFORMACION Y LA COMUNICACIÓN | F388: 3 | G388: P | H388: B | I388: 0 | J388: 2 | K388: JUEVES | L388: 7 | M388: 9 | N388: VIRTUAL | O388: 32 | P388: 0 | Q388: 2
A389: CIENCIAS ADMINISTRATIVAS(B) / ECONOMÍA(B) | C389: 274 | D389: IF902BAE / IF902BEO | E389: TECNOLOGIAS DE LA INFORMACION Y LA COMUNICACIÓN | F389: 3 | G389: P | H389: A | I389: 0 | J389: 2 | K389: LUNES | L389: 18 | M389: 20 | N389: VIRTUAL | O389: 53 | P389: 0 | Q389: 2
A390: ENFERMERIA | C390: 303 | D390: IF902AEN | E390: TECNOLOGIAS DE LA INFORMACION Y LA COMUNICACIÓN | F390: 3 | G390: P | H390: A | I390: 0 | J390: 2 | K390: LUNES | L390: 16 | M390: 18 | N390: VIRTUAL | O390: 54 | P390: 0 | Q390: 2
A391: ING. DE MINAS / QUÍMICA(A) | C391: 321 | D391: IF902AMI / IF902AQM | E391: TECNOLOGIAS DE LA INFORMACION Y LA COMUNICACIÓN | F391: 3 | G391: P | H391: A | I391: 0 | J391: 2 | K391: MARTES | L391: 16 | M391: 18 | N391: VIRTUAL | O391: 54 | P391: 0 | Q391: 2
G392: SUBTOTAL: | I392: 0 | J392: 16 | L392: TOTAL HRS: | M392: 16 | P392: 0 | Q392: 16
P393: 0 | Q393: 0
A394: CARRERA | D394: B2 | E394: MARÍA DEL PILAR VENEGAS VERGARA | F394: CRED. | G394: TIPO | H394: GPO | I394: HT | J394: HP | K394: DIA | L394: HR-INICIO | M394: HR-FIN | N394: AULA | O394: MATRICULADOS | P394: HT | Q394: HP
A395: INGENIERIA DE MINAS | C395: 19 | D395: IF391AMI | E395: SISTEMA DE BASE DE DATOS | F395: 2 | G395: P | H395: A | I395: 0 | J395: 3 | K395: JUEVES | L395: 17 | M395: 20 | N395: IM-204 | O395: 46 | P395: 0 | Q395: 3
A396: INGENIERIA INFORMATICA | C396: 162 | D396: IF614AIN | E396: INGENIERIA DE SOFTWARE I | F396: 4 | G396: T | H396: A | I396: 2 | J396: 0 | K396: MARTES | L396: 7 | M396: 9 | N396: IN203 | O396: 31 | P396: 2 | Q396: 0
A397: INGENIERIA INFORMATICA | C397: 163 | D397: IF614AIN | E397: INGENIERIA DE SOFTWARE I | F397: 4 | G397: T | H397: A | I397: 1 | J397: 0 | K397: VIERNES | L397: 8 | M397: 9 | N397: IN203 | O397: 31 | P397: 1 | Q397: 0
A398: INGENIERIA INFORMATICA | C398: 164 | D398: IF614AIN | E398: INGENIERIA DE SOFTWARE I | F398: 4 | G398: P | H398: A | I398: 0 | J398: 2 | K398: JUEVES | L398: 7 | M398: 9 | N398: LAB305 | O398: 16 | P398: 0 | Q398: 2
G399: SUBTOTAL: | I399: 3 | J399: 5 | L399: TOTAL HRS: | M399: 8 | P399: 3 | Q399: 5
P400: 0 | Q400: 0
A401: CARRERA | D401: B2 | E401: VÍCTOR DARIO SOSA JAUREGUI | F401: CRED. | G401: TIPO | H401: GPO | I401: HT | J401: HP | K401: DIA | L401: HR-INICIO | M401: HR-FIN | N401: AULA | O401: MATRICULADOS | P401: HT | Q401: HP
A402: INGENIERIA INFORMATICA | C402: 152 | D402: IF612AIN | E402: FUNDAMENTOS Y DISEÑO DE BASE DE DATOS | F402: 4 | G402: P | H402: B | I402: 0 | J402: 2 | K402: JUEVES | L402: 9 | M402: 11 | N402: LAB302 | O402: 17 | P402: 0 | Q402: 2
A403: INGENIERIA INFORMATICA | C403: 175 | D403: IF617AIN | E403: INGENIERIA DE SOFTWARE II | F403: 4 | G403: P | H403: B | I403: 0 | J403: 2 | K403: LUNES | L403: 9 | M403: 11 | N403: LAB304 | O403: 22 | P403: 0 | Q403: 2
A404: INGENIERIA INFORMATICA | C404: 181 | D404: IF619BIN | E404: ANÁLISIS DE DATOS EMPRESARIALES | F404: 3 | G404: T | H404: B | I404: 2 | J404: 0 | K404: MARTES | L404: 14 | M404: 16 | N404: IN202 | O404: 48 | P404: 2 | Q404: 0
A405: INGENIERIA INFORMATICA | C405: 182 | D405: IF619BIN | E405: ANÁLISIS DE DATOS EMPRESARIALES | F405: 3 | G405: P | H405: A | I405: 0 | J405: 2 | K405: JUEVES | L405: 14 | M405: 16 | N405: LAB303 | O405: 24 | P405: 0 | Q405: 2
G406: SUBTOTAL: | I406: 2 | J406: 6 | L406: TOTAL HRS: | M406: 8 | P406: 2 | Q406: 6
P407: 0 | Q407: 0
A408: CARRERA | D408: B3 | E408: JULIO VLADIMIR QUISPE SOTA | F408: CRED. | G408: TIPO | H408: GPO | I408: HT | J408: HP | K408: DIA | L408: HR-INICIO | M408: HR-FIN | N408: AULA | O408: MATRICULADOS | P408: HT | Q408: HP
A409: INGENIERIA INFORMATICA | C409: 54 | D409: IF455BIN | E409: ALGORITMOS PARALELOS Y DISTRIBUIDOS | F409: 4 | G409: T | H409: B | I409: 2 | J409: 0 | K409: LUNES | L409: 14 | M409: 16 | N409: IN201 | O409: 15 | P409: 2 | Q409: 0
A410: INGENIERIA INFORMATICA | C410: 55 | D410: IF455BIN | E410: ALGORITMOS PARALELOS Y DISTRIBUIDOS | F410: 4 | G410: T | H410: B | I410: 1 | J410: 0 | K410: VIERNES | L410: 15 | M410: 16 | N410: IN201 | O410: 15 | P410: 1 | Q410: 0
A411: INGENIERIA INFORMATICA | C411: 56 | D411: IF455BIN | E411: ALGORITMOS PARALELOS Y DISTRIBUIDOS | F411: 4 | G411: P | H411: A | I411: 0 | J411: 2 | K411: MIÉRCOLES | L411: 14 | M411: 16 | N411: LAB301 | O411: 15 | P411: 0 | Q411: 2
G412: SUBTOTAL: | I412: 3 | J412: 2 | L412: TOTAL HRS: | M412: 5 | P412: 3 | Q412: 2
P413: 0 | Q413: 0
A414: CARRERA | D414: B2 | E414: ÉLIDA FALCÓN HUALLPA | F414: CRED. | G414: TIPO | H414: GPO | I414: HT | J414: HP | K414: DIA | L414: HR-INICIO | M414: HR-FIN | N414: AULA | O414: MATRICULADOS | P414: HT | Q414: HP
A415: INGENIERIA ELECTRONICA | C415: 9 | D415: IF107ALI | E415: PROGRAMACION DIGITAL I | F415: 3 | G415: T | H415: A | I415: 2 | J415: 0 | K415: MARTES | L415: 11 | M415: 13 | N415: EL-206 | O415: 53 | P415: 2 | Q415: 0
A416: INGENIERIA ELECTRONICA | C416: 10 | D416: IF107ALI | E416: PROGRAMACION DIGITAL I | F416: 3 | G416: P | H416: A | I416: 0 | J416: 2 | K416: JUEVES | L416: 11 | M416: 13 | N416: EL-206 | O416: 53 | P416: 0 | Q416: 2
G417: SUBTOTAL: | I417: 2 | J417: 2 | L417: TOTAL HRS: | M417: 4 | P417: 2 | Q417: 2
P418: 0 | Q418: 0
A419: CARRERA | D419: B1 | E419: VITTALI QUISPE SURCO | F419: CRED. | G419: TIPO | H419: GPO | I419: HT | J419: HP | K419: DIA | L419: HR-INICIO | M419: HR-FIN | N419: AULA | O419: MATRICULADOS | P419: HT | Q419: HP
A420: INGENIERIA INFORMATICA | C420: 70 | D420: IF459AIN | E420: COMPUTACION GRAFICA II | F420: 4 | G420: T | H420: A | I420: 2 | J420: 0 | K420: JUEVES | L420: 7 | M420: 9 | N420: IN206 | O420: 23 | P420: 2 | Q420: 0
A421: INGENIERIA INFORMATICA | C421: 71 | D421: IF459AIN | E421: COMPUTACION GRAFICA II | F421: 4 | G421: T | H421: A | I421: 1 | J421: 0 | K421: VIERNES | L421: 8 | M421: 9 | N421: IN206 | O421: 23 | P421: 1 | Q421: 0
A422: INGENIERIA INFORMATICA | C422: 72 | D422: IF459AIN | E422: COMPUTACION GRAFICA II | F422: 4 | G422: P | H422: A | I422: 0 | J422: 2 | K422: MARTES | L422: 7 | M422: 9 | N422: LAB302 | O422: 23 | P422: 0 | Q422: 2
A423: INGENIERIA INFORMATICA | C423: 78 | D423: IF466AIN | E423: COMPILADORES | F423: 3 | G423: P | H423: A | I423: 0 | J423: 2 | K423: JUEVES | L423: 18 | M423: 20 | N423: IN202 | O423: 30 | P423: 0 | Q423: 2
A424: INGENIERIA INFORMATICA | C424: 176 | D424: IF618AIN | E424: TOPICOS AVANZADOS EN INGENIERIA DE SOFTWARE | F424: 4 | G424: T | H424: A | I424: 2 | J424: 0 | K424: LUNES | L424: 11 | M424: 13 | N424: IN101 | O424: 17 | P424: 2 | Q424: 0
A425: INGENIERIA INFORMATICA | C425: 177 | D425: IF618AIN | E425: TOPICOS AVANZADOS EN INGENIERIA DE SOFTWARE | F425: 4 | G425: T | H425: A | I425: 1 | J425: 0 | K425: VIERNES | L425: 11 | M425: 12 | N425: IN101 | O425: 17 | P425: 1 | Q425: 0
A426: INGENIERIA INFORMATICA | C426: 178 | D426: IF618AIN | E426: TOPICOS AVANZADOS EN INGENIERIA DE SOFTWARE | F426: 4 | G426: P | H426: A | I426: 0 | J426: 2 | K426: MIÉRCOLES | L426: 11 | M426: 13 | N426: LAB208 | O426: 17 | P426: 0 | Q426: 2
A427: EDUCACION | C427: 292 | D427: IF902AEU | E427: TECNOLOGIAS DE LA INFORMACION Y LA COMUNICACIÓN | F427: 3 | G427: P | H427: B | I427: 0 | J427: 2 | K427: MARTES | L427: 9 | M427: 11 | N427: VIRTUAL | O427: 33 | P427: 0 | Q427: 2
A428: EDUCACION | C428: 300 | D428: IF902DEU | E428: TECNOLOGIAS DE LA INFORMACION Y LA COMUNICACIÓN | F428: 3 | G428: P | H428: A | I428: 0 | J428: 2 | K428: MIÉRCOLES | L428: 14 | M428: 16 | N428: VIRTUAL | O428: 35 | P428: 0 | Q428: 2
G429: SUBTOTAL: | I429: 6 | J429: 10 | L429: TOTAL HRS: | M429: 16 | P429: 6 | Q429: 10
P430: 0 | Q430: 0
A431: CARRERA | D431: JP-20H | E431: VANESA LAVILLA ALVAREZ | F431: CRED. | G431: TIPO | H431: GPO | I431: HT | J431: HP | K431: DIA | L431: HR-INICIO | M431: HR-FIN | N431: AULA | O431: MATRICULADOS | P431: HT | Q431: HP
A432: INGENIERIA INFORMATICA | C432: 119 | D432: IF550AIN | E432: ORGANIZACION Y ARQUITECTURA DEL COMPUTADOR | F432: 4 | G432: P | H432: B | I432: 0 | J432: 2 | K432: MIÉRCOLES | L432: 9 | M432: 11 | N432: LAB310 | O432: 15 | P432: 0 | Q432: 2
A433: INGENIERIA INFORMATICA | C433: 135 | D433: IF553AIN | E433: LENGUAJE ENSAMBLADOR | F433: 3 | G433: P | H433: B | I433: 0 | J433: 2 | K433: LUNES | L433: 11 | M433: 13 | N433: LAB304 | O433: 19 | P433: 0 | Q433: 2
A434: INGENIERIA CIVIL | C434: 251 | D434: IF758ACI | E434: METODOS NUMERICOS | F434: 3 | G434: P | H434: A | I434: 0 | J434: 2 | K434: MARTES | L434: 7 | M434: 9 | N434: LAB312 | O434: 33 | P434: 0 | Q434: 2
A435: INGENIERIA CIVIL | C435: 252 | D435: IF758ACI | E435: METODOS NUMERICOS | F435: 3 | G435: P | H435: A | I435: 0 | J435: 2 | K435: JUEVES | L435: 7 | M435: 9 | N435: LAB312 | O435: 33 | P435: 0 | Q435: 2
A436: EDUCACION | C436: 301 | D436: IF902DEU | E436: TECNOLOGIAS DE LA INFORMACION Y LA COMUNICACIÓN | F436: 3 | G436: P | H436: B | I436: 0 | J436: 2 | K436: MIÉRCOLES | L436: 14 | M436: 16 | N436: VIRTUAL | O436: 34 | P436: 0 | Q436: 2
A437: ING. ELÉCTRICA / ING. INFORMÁTICA(B) | C437: 324 | D437: IF902AEI / IF902BIN | E437: TECNOLOGIAS DE LA INFORMACION Y LA COMUNICACIÓN | F437: 3 | G437: P | H437: B | I437: 0 | J437: 2 | K437: JUEVES | L437: 14 | M437: 16 | N437: VIRTUAL | O437: 35 | P437: 0 | Q437: 2
A438: ING. ELECTRÓNICA / ING. INFORMÁTICA(A) | C438: 327 | D438: IF902ALI / IF902AIN | E438: TECNOLOGIAS DE LA INFORMACION Y LA COMUNICACIÓN | F438: 3 | G438: P | H438: B | I438: 0 | J438: 2 | K438: JUEVES | L438: 14 | M438: 16 | N438: VIRTUAL | O438: 32 | P438: 0 | Q438: 2
A439: TURISMO | C439: 339 | D439: IF902ATU | E439: TECNOLOGIAS DE LA INFORMACION Y LA COMUNICACIÓN | F439: 3 | G439: P | H439: A | I439: 0 | J439: 2 | K439: LUNES | L439: 9 | M439: 11 | N439: VIRTUAL | O439: 55 | P439: 0 | Q439: 2
G440: SUBTOTAL: | I440: 0 | J440: 16 | L440: TOTAL HRS: | M440: 16 | P440: 0 | Q440: 16
P441: 0 | Q441: 0
A442: CARRERA | D442: JP-20H | E442: LISHA SABAH DÍAZ CACERES | F442: CRED. | G442: TIPO | H442: GPO | I442: HT | J442: HP | K442: DIA | L442: HR-INICIO | M442: HR-FIN | N442: AULA | O442: MATRICULADOS | P442: HT | Q442: HP
A443: INGENIERIA INFORMATICA | C443: 5 | D443: IF063BIN | E443: QUECHUA | F443: 2 | G443: P | H443: B | I443: 0 | J443: 2 | K443: VIERNES | L443: 14 | M443: 16 | N443: IN202 | O443: 23 | P443: 0 | Q443: 2
A444: INGENIERIA INFORMATICA | C444: 6 | D444: IF063BIN | E444: QUECHUA | F444: 2 | G444: P | H444: B | I444: 0 | J444: 2 | K444: SÁBADO | L444: 16 | M444: 18 | N444: IN202 | O444: 23 | P444: 0 | Q444: 2
A445: ARQUITECTURA | C445: 265 | D445: IF902AAT | E445: TECNOLOGIAS DE LA INFORMACION Y LA COMUNICACIÓN | F445: 3 | G445: P | H445: B | I445: 0 | J445: 2 | K445: JUEVES | L445: 14 | M445: 16 | N445: VIRTUAL | O445: 32 | P445: 0 | Q445: 2
A446: CONTABILIDAD | C446: 279 | D446: IF902ACO | E446: TECNOLOGIAS DE LA INFORMACION Y LA COMUNICACIÓN | F446: 3 | G446: P | H446: B | I446: 0 | J446: 2 | K446: LUNES | L446: 18 | M446: 20 | N446: VIRTUAL | O446: 30 | P446: 0 | Q446: 2
A447: EDUCACION | C447: 298 | D447: IF902CEU | E447: TECNOLOGIAS DE LA INFORMACION Y LA COMUNICACIÓN | F447: 3 | G447: P | H447: B | I447: 0 | J447: 2 | K447: MIÉRCOLES | L447: 14 | M447: 16 | N447: VIRTUAL | O447: 33 | P447: 0 | Q447: 2
A448: ING. AGROINDUSTRIAL (SIC) / MEDICINA VETERINARIA (SIC) | C448: 319 | D448: IF902AIA / IF902AVS | E448: TECNOLOGIAS DE LA INFORMACION Y LA COMUNICACIÓN | F448: 4 | G448: P | H448: B | I448: 0 | J448: 2 | K448: JUEVES | L448: 14 | M448: 16 | N448: VIRTUAL | O448: 35 | P448: 0 | Q448: 2
A449: ING. GEOLÓGICA / ING. PETROQUÍMICA | C449: 331 | D449: IF902AGI / IF902APQ | E449: TECNOLOGIAS DE LA INFORMACION Y LA COMUNICACIÓN | F449: 3 | G449: P | H449: A | I449: 0 | J449: 2 | K449: MARTES | L449: 16 | M449: 18 | N449: VIRTUAL | O449: 53 | P449: 0 | Q449: 2
G451: SUBTOTAL: | I451: 0 | J451: 14 | L451: TOTAL HRS: | M451: 14 | P451: 0 | Q451: 14
P452: 0 | Q452: 0
A453: CARRERA | D453: JP-10H | E453: MARCIO FERNANDO MERMA QUISPE | F453: CRED. | G453: TIPO | H453: GPO | I453: HT | J453: HP | K453: DIA | L453: HR-INICIO | M453: HR-FIN | N453: AULA | O453: MATRICULADOS | P453: HT | Q453: HP
A454: INGENIERIA ELECTRICA | C454: 82 | D454: IF467AEI | E454: PROGRAMACION DIGITAL | F454: 4 | G454: P | H454: B | I454: 0 | J454: 2 | K454: JUEVES | L454: 18 | M454: 20 | N454: LAB306 | O454: 21 | P454: 0 | Q454: 2
A455: DERECHO | C455: 284 | D455: IF902ADR | E455: TECNOLOGIAS DE LA INFORMACION Y LA COMUNICACIÓN | F455: 3 | G455: P | H455: B | I455: 0 | J455: 2 | K455: JUEVES | L455: 11 | M455: 13 | N455: VIRTUAL | O455: 30 | P455: 0 | Q455: 2
A456: HISTORIA | C456: 313 | D456: IF902AHI | E456: TECNOLOGIAS DE LA INFORMACION Y LA COMUNICACIÓN | F456: 3 | G456: P | H456: B | I456: 0 | J456: 2 | K456: JUEVES | L456: 7 | M456: 9 | N456: VIRTUAL | O456: 33 | P456: 0 | Q456: 2
A457: ING. FORESTAL (PTO MDO.) / MEDICINA VETERINARIA (ESP) | C457: 329 | D457: IF902AFO / IF902AVE | E457: TECNOLOGIAS DE LA INFORMACION Y LA COMUNICACIÓN | F457: 3 | G457: P | H457: A | I457: 0 | J457: 2 | K457: JUEVES | L457: 14 | M457: 16 | N457: VIRTUAL | O457: 42 | P457: 0 | Q457: 2
G458: SUBTOTAL: | I458: 0 | J458: 8 | L458: TOTAL HRS: | M458: 8 | P458: 0 | Q458: 8
P459: 0 | Q459: 0
A460: CARRERA | D460: JP-10H | E460: OLMER CLAUDIO VILLENA LEON | F460: CRED. | G460: TIPO | H460: GPO | I460: HT | J460: HP | K460: DIA | L460: HR-INICIO | M460: HR-FIN | N460: AULA | O460: MATRICULADOS | P460: HT | Q460: HP
A461: INGENIERIA INFORMATICA | C461: 1 | D461: IF060AIN | E461: MUSICA | F461: 2 | G461: P | H461: A | I461: 0 | J461: 2 | K461: VIERNES | L461: 11 | M461: 13 | N461: IN107 | O461: 48 | P461: 0 | Q461: 2
A462: INGENIERIA INFORMATICA | C462: 2 | D462: IF060AIN | E462: MUSICA | F462: 2 | G462: P | H462: A | I462: 0 | J462: 2 | K462: SÁBADO | L462: 9 | M462: 11 | N462: IN107 | O462: 48 | P462: 0 | Q462: 2
A463: ARQUEOLOGIA | C463: 262 | D463: IF902AAQ | E463: TECNOLOGIAS DE LA INFORMACION Y LA COMUNICACIÓN | F463: 3 | G463: P | H463: A | I463: 0 | J463: 2 | K463: JUEVES | L463: 11 | M463: 13 | N463: VIRTUAL | O463: 34 | P463: 0 | Q463: 2
A464: CIENCIAS ADMINISTRATIVAS / HISTORIA(C) | C464: 271 | D464: IF902AAE / IF902CHI | E464: TECNOLOGIAS DE LA INFORMACION Y LA COMUNICACIÓN | F464: 3 | G464: P | H464: A | I464: 0 | J464: 2 | K464: JUEVES | L464: 7 | M464: 9 | N464: VIRTUAL | O464: 33 | P464: 0 | Q464: 2
A465: EDUCACION (ESPINAR) | C465: 289 | D465: IF902AEE | E465: TECNOLOGIAS DE LA INFORMACION Y LA COMUNICACIÓN | F465: 3 | G465: P | H465: A | I465: 0 | J465: 2 | K465: JUEVES | L465: 14 | M465: 16 | N465: VIRTUAL | O465: 59 | P465: 0 | Q465: 2
G466: SUBTOTAL: | I466: 0 | J466: 10 | L466: TOTAL HRS: | M466: 10 | P466: 0 | Q466: 10
P467: 0 | Q467: 0
A468: CARRERA | D468: B3 | E468: RAIMAR ABARCA MORA | F468: CRED. | G468: TIPO | H468: GPO | I468: HT | J468: HP | K468: DIA | L468: HR-INICIO | M468: HR-FIN | N468: AULA | O468: MATRICULADOS | P468: HT | Q468: HP
A469: INGENIERIA INFORMATICA | C469: 3 | D469: IF063AIN | E469: QUECHUA | F469: 2 | G469: P | H469: A | I469: 0 | J469: 2 | K469: VIERNES | L469: 7 | M469: 9 | N469: IN202 | O469: 29 | P469: 0 | Q469: 2
A470: INGENIERIA INFORMATICA | C470: 4 | D470: IF063AIN | E470: QUECHUA | F470: 2 | G470: P | H470: A | I470: 0 | J470: 2 | K470: SÁBADO | L470: 7 | M470: 9 | N470: IN202 | O470: 29 | P470: 0 | Q470: 2
G471: SUBTOTAL: | I471: 0 | J471: 4 | L471: TOTAL HRS: | M471: 4 | P471: 0 | Q471: 4
P472: 0 | Q472: 0
A473: CARRERA | D473: B2 | E473: GERAR FRANCIS QUISPE TORRES | F473: CRED. | G473: TIPO | H473: GPO | I473: HT | J473: HP | K473: DIA | L473: HR-INICIO | M473: HR-FIN | N473: AULA | O473: MATRICULADOS | P473: HT | Q473: HP
A474: INGENIERIA INFORMATICA | C474: 57 | D474: IF456AIN | E474: ALGORITMOS AVANZADOS | F474: 4 | G474: T | H474: A | I474: 2 | J474: 0 | K474: MIÉRCOLES | L474: 11 | M474: 13 | N474: IN202 | O474: 39 | P474: 2 | Q474: 0
A475: INGENIERIA INFORMATICA | C475: 58 | D475: IF456AIN | E475: ALGORITMOS AVANZADOS | F475: 4 | G475: T | H475: A | I475: 1 | J475: 0 | K475: VIERNES | L475: 11 | M475: 12 | N475: IN202 | O475: 39 | P475: 1 | Q475: 0
A476: INGENIERIA INFORMATICA | C476: 59 | D476: IF456AIN | E476: ALGORITMOS AVANZADOS | F476: 4 | G476: P | H476: A | I476: 0 | J476: 2 | K476: LUNES | L476: 11 | M476: 13 | N476: LAB305 | O476: 39 | P476: 0 | Q476: 2
A477: INGENIERIA INFORMATICA | C477: 165 | D477: IF614AIN | E477: INGENIERIA DE SOFTWARE I | F477: 4 | G477: P | H477: B | I477: 0 | J477: 2 | K477: JUEVES | L477: 7 | M477: 9 | N477: LAB306 | O477: 15 | P477: 0 | Q477: 2
A478: EDUCACION | C478: 295 | D478: IF902BEU | E478: TECNOLOGIAS DE LA INFORMACION Y LA COMUNICACIÓN | F478: 3 | G478: P | H478: B | I478: 0 | J478: 2 | K478: MARTES | L478: 9 | M478: 11 | N478: VIRTUAL | O478: 33 | P478: 0 | Q478: 2
G479: SUBTOTAL: | I479: 3 | J479: 6 | L479: TOTAL HRS: | M479: 9 | P479: 3 | Q479: 6
P480: 0 | Q480: 0
A481: CARRERA | D481: B3 | E481: JONEL CCENTE ZUZUNAGA | F481: CRED. | G481: TIPO | H481: GPO | I481: HT | J481: HP | K481: DIA | L481: HR-INICIO | M481: HR-FIN | N481: AULA | O481: MATRICULADOS | P481: HT | Q481: HP
A482: ENFERMERÍA(B) / FARMACIA Y BIOQUIMICA | C482: 306 | D482: IF902BEN / IF902AQF | E482: TECNOLOGIAS DE LA INFORMACION Y LA COMUNICACIÓN | F482: 3 | G482: P | H482: B | I482: 0 | J482: 2 | K482: LUNES | L482: 16 | M482: 18 | N482: VIRTUAL | O482: 35 | P482: 0 | Q482: 2
A483: ING. METALÚRGICA / QUÍMICA(B) | C483: 332 | D483: IF902AMT / IF902BQM | E483: TECNOLOGIAS DE LA INFORMACION Y LA COMUNICACIÓN | F483: 3 | G483: T | H483: A | I483: 2 | J483: 0 | K483: JUEVES | L483: 16 | M483: 18 | N483: VIRTUAL | O483: 50 | P483: 2 | Q483: 0
G484: SUBTOTAL: | I484: 2 | J484: 2 | L484: TOTAL HRS: | M484: 4 | P484: 2 | Q484: 2
P485: 0 | Q485: 0
A486: CARRERA | D486: B3 | E486: STEPHAN JHOEL COSIO LOAIZA | F486: CRED. | G486: TIPO | H486: GPO | I486: HT | J486: HP | K486: DIA | L486: HR-INICIO | M486: HR-FIN | N486: AULA | O486: MATRICULADOS | P486: HT | Q486: HP
A487: INGENIERIA INFORMATICA | C487: 112 | D487: IF483BIN | E487: FORMULACION DE PROYECTOS DE TECNOLOGIAS DE LA INFORMACION | F487: 3 | G487: T | H487: B | I487: 2 | J487: 0 | K487: LUNES | L487: 14 | M487: 16 | N487: IN206 | O487: 37 | P487: 2 | Q487: 0
A488: INGENIERIA INFORMATICA | C488: 113 | D488: IF483BIN | E488: FORMULACION DE PROYECTOS DE TECNOLOGIAS DE LA INFORMACION | F488: 3 | G488: P | H488: A | I488: 0 | J488: 2 | K488: MIÉRCOLES | L488: 14 | M488: 16 | N488: IN206 | O488: 37 | P488: 0 | Q488: 2
G489: SUBTOTAL: | I489: 2 | J489: 2 | L489: TOTAL HRS: | M489: 4 | P489: 2 | Q489: 2
P490: 0 | Q490: 0
A491: CARRERA | D491: JP10H | E491: LUZ INDIRA TICONA FÉLIX | F491: CRED. | G491: TIPO | H491: GPO | I491: HT | J491: HP | K491: DIA | L491: HR-INICIO | M491: HR-FIN | N491: AULA | O491: MATRICULADOS | P491: HT | Q491: HP
A492: MATEMATICA | C492: 96 | D492: IF470AME | E492: LENGUAJE DE PROGRAMACION | F492: 4 | G492: P | H492: A | I492: 0 | J492: 2 | K492: JUEVES | L492: 7 | M492: 9 | N492: LAB309 | O492: 27 | P492: 0 | Q492: 2
A493: INGENIERIA INFORMATICA | C493: 214 | D493: IF656AIN | E493: PROCESAMIENTO DE LENGUAJE NATURAL | F493: 4 | G493: P | H493: C | I493: 0 | J493: 2 | K493: LUNES | L493: 11 | M493: 13 | N493: LAB310 | O493: 26 | P493: 0 | Q493: 2
A494: AGRONOMÍA / ZOOTÉCNIA | C494: 257 | D494: IF902AAO / IF902AZO | E494: TECNOLOGIAS DE LA INFORMACION Y LA COMUNICACIÓN | F494: 3 | G494: P | H494: A | I494: 0 | J494: 2 | K494: MIÉRCOLES | L494: 14 | M494: 16 | N494: VIRTUAL | O494: 38 | P494: 0 | Q494: 2
A495: ING. ELÉCTRICA / ING. INFORMÁTICA(B) | C495: 323 | D495: IF902AEI / IF902BIN | E495: TECNOLOGIAS DE LA INFORMACION Y LA COMUNICACIÓN | F495: 3 | G495: P | H495: A | I495: 0 | J495: 2 | K495: JUEVES | L495: 14 | M495: 16 | N495: VIRTUAL | O495: 36 | P495: 0 | Q495: 2
G496: SUBTOTAL: | I496: 0 | J496: 8 | L496: TOTAL HRS: | M496: 8 | P496: 0 | Q496: 8
P497: 0 | Q497: 0
A498: CARRERA | D498: JP10H | E498: EDELMIRA DAVILA ANDRADE | F498: CRED. | G498: TIPO | H498: GPO | I498: HT | J498: HP | K498: DIA | L498: HR-INICIO | M498: HR-FIN | N498: AULA | O498: MATRICULADOS | P498: HT | Q498: HP
A499: MATEMATICA | C499: 98 | D499: IF471AME | E499: METODOS NUMERICOS | F499: 3 | G499: P | H499: A | I499: 0 | J499: 2 | K499: JUEVES | L499: 11 | M499: 13 | N499: LAB-1 | O499: 6 | P499: 0 | Q499: 2
A500: INGENIERIA INFORMATICA | C500: 139 | D500: IF556AIN | E500: SISTEMAS EMBEBIDOS | F500: 4 | G500: P | H500: B | I500: 0 | J500: 2 | K500: JUEVES | L500: 9 | M500: 11 | N500: LAB310 | O500: 26 | P500: 0 | Q500: 2
A501: ING. AGROINDUSTRIAL (SIC) / MEDICINA VETERINARIA (SIC) | C501: 318 | D501: IF902AIA / IF902AVS | E501: TECNOLOGIAS DE LA INFORMACION Y LA COMUNICACIÓN | F501: 3 | G501: P | H501: A | I501: 0 | J501: 2 | K501: JUEVES | L501: 14 | M501: 16 | N501: VIRTUAL | O501: 36 | P501: 0 | Q501: 2
A502: ING. METALÚRGICA / QUÍMICA(B) | C502: 333 | D502: IF902AMT / IF902BQM | E502: TECNOLOGIAS DE LA INFORMACION Y LA COMUNICACIÓN | F502: 3 | G502: P | H502: A | I502: 0 | J502: 2 | K502: MARTES | L502: 16 | M502: 18 | N502: VIRTUAL | O502: 50 | P502: 0 | Q502: 2
G503: SUBTOTAL: | I503: 0 | J503: 8 | L503: TOTAL HRS: | M503: 8 | P503: 0 | Q503: 8
P504: 0 | Q504: 0
A505: CARRERA | E505: CURSO O GRUPO POR DESACTIVAR | F505: CRED. | G505: TIPO | H505: GPO | I505: HT | J505: HP | K505: DIA | L505: HR-INICIO | M505: HR-FIN | N505: AULA | O505: MATRICULADOS | P505: HT | Q505: HP
A506: INGENIERIA INFORMATICA | C506: 53 | D506: IF455AIN | E506: ALGORITMOS PARALELOS Y DISTRIBUIDOS | F506: 4 | G506: P | H506: B | I506: 0 | J506: 2 | K506: MIÉRCOLES | L506: 9 | M506: 11 | N506: 0 | O506: 0 | P506: 0 | Q506: 2
G508: SUBTOTAL: | I508: 0 | J508: 2 | L508: TOTAL HRS: | M508: 2 | P508: 0 | Q508: 2
P509: 0 | Q509: 0
A510: CARRERA | E510: CURSO DESACTIVADO | F510: CRED. | G510: TIPO | H510: GPO | I510: HT | J510: HP | K510: DIA | L510: HR-INICIO | M510: HR-FIN | N510: AULA | O510: MATRICULADOS | P510: HT | Q510: HP
A511: INGENIERIA INFORMATICA | C511: 34 | D511: IF451CIN | E511: PROGRAMACION I | F511: 2 | G511: P | H511: C | I511: 0 | J511: 2 | K511: MARTES | L511: 16 | M511: 18 | N511: 0 | O511: 1 | P511: 0 | Q511: 2
A512: INGENIERIA INFORMATICA | C512: 35 | D512: IF451CIN | E512: PROGRAMACION I | F512: 2 | G512: P | H512: C | I512: 0 | J512: 2 | K512: JUEVES | L512: 16 | M512: 18 | N512: 0 | O512: 1 | P512: 0 | Q512: 2
A513: INGENIERIA INFORMATICA | C513: 90 | D513: IF468AIN | E513: FUNDAMENTOS DE LA PROGRAMACION | F513: 4 | G513: P | H513: B | I513: 0 | J513: 2 | K513: MIÉRCOLES | L513: 9 | M513: 11 | N513: LAB302 | O513: 0 | P513: 0 | Q513: 2
A514: INGENIERIA INFORMATICA | C514: 143 | D514: IF610AIN | E514: ANALISIS Y DISEÑO DE SISTEMAS DE INFORMACION | F514: 4 | G514: P | H514: B | I514: 0 | J514: 2 | K514: JUEVES | L514: 7 | M514: 9 | N514: LAB302 | O514: 0 | P514: 0 | Q514: 2
A515: INGENIERIA INFORMATICA | C515: 215 | D515: IF656BIN | E515: PROCESAMIENTO DE LENGUAJE NATURAL | F515: 4 | G515: T | H515: B | I515: 2 | J515: 0 | K515: MIÉRCOLES | L515: 11 | M515: 13 | N515: IN102 | O515: 0 | P515: 2 | Q515: 0
A516: INGENIERIA INFORMATICA | C516: 216 | D516: IF656BIN | E516: PROCESAMIENTO DE LENGUAJE NATURAL | F516: 4 | G516: T | H516: B | I516: 1 | J516: 0 | K516: VIERNES | L516: 11 | M516: 12 | N516: IN102 | O516: 0 | P516: 1 | Q516: 0
G517: SUBTOTAL: | I517: 3 | J517: 8 | L517: TOTAL HRS: | M517: 11 | P517: 3 | Q517: 8
P518: 0 | Q518: 0
A519: CARRERA | E519: GRUPO DESACTIVADO | F519: CRED. | G519: TIPO | H519: GPO | I519: HT | J519: HP | K519: DIA | L519: HR-INICIO | M519: HR-FIN | N519: AULA | O519: MATRICULADOS | P519: HT | Q519: HP
A520: INGENIERIA INFORMATICA | C520: 65 | D520: IF457AIN | E520: METODOS NUMERICOS | F520: 3 | G520: P | H520: B | I520: 0 | J520: 2 | K520: JUEVES | L520: 18 | M520: 20 | N520: 0 | O520: 0 | P520: 0 | Q520: 2
A521: INGENIERIA INFORMATICA | C521: 69 | D521: IF458AIN | E521: COMPUTACION GRAFICA I | F521: 4 | G521: P | H521: B | I521: 0 | J521: 2 | K521: MIÉRCOLES | L521: 11 | M521: 13 | N521: LAB302 | O521: 0 | P521: 0 | Q521: 2
A522: INGENIERIA INFORMATICA | C522: 132 | D522: IF552BIN | E522: REDES DE COMPUTADORAS I | F522: 4 | G522: P | H522: B | I522: 0 | J522: 2 | K522: MARTES | L522: 16 | M522: 18 | N522: LAB310 | O522: 0 | P522: 0 | Q522: 2
A523: INGENIERIA INFORMATICA | C523: 146 | D523: IF611AIN | E523: METODOLOGIA DE DESARROLLO DE SOFTWARE | F523: 3 | G523: P | H523: B | I523: 0 | J523: 2 | K523: JUEVES | L523: 7 | M523: 9 | N523: 0 | O523: 0 | P523: 0 | Q523: 2
A524: INGENIERIA INFORMATICA | C524: 169 | D524: IF614BIN | E524: INGENIERIA DE SOFTWARE I | F524: 4 | G524: P | H524: B | I524: 0 | J524: 2 | K524: MIÉRCOLES | L524: 16 | M524: 18 | N524: LAB303 | O524: 0 | P524: 0 | Q524: 2
G525: SUBTOTAL: | I525: 0 | J525: 10 | L525: TOTAL HRS: | M525: 10 | P525: 0 | Q525: 10
P526: 0 | Q526: 0
P527: 0 | Q527: 0
P528: 0 | Q528: 0
P529: 0 | Q529: 0
P530: 0 | Q530: 0

Sheet: Hoja4
G11: CÓDIGO | I11: CRED. | J11: TIPO | K11: 1. PRESENTACIÓN DE PORTAFOLIO | O11: 2. CONTENIDO POR ASIGNATURA | T11: 3. ACTIV. DE ENSEÑANZA | U11: 4. EVALUACIONES | AN11: 5. PROYECTOS INDIVIDUALES / GRUPALES | AS11: 6. CIERRE DE PORTAFOLIO
U12: EVALUACION DE ENTRADA | W12: 4.3 ENUNCIADO Y RESOLUCIÓN DE EVALUACIÓN DE CONOCIMIENTO | AA12: 4.4 REG. DE ASISTENCIA A LA RESOLUCIÓN DEL EXAMEN (F-PD-006) | AD12: 4.5 INF. MIN, MAX, PROM DE EVALUAC. DE CONOCIMIENTO (F-PD-013) | AG12: 4.6 REGISTRO DE INGRESO DE NOTAS (F-CC) | AK12: 4.7 REG. NOTAS DE PRÁCTICA (F-PD-015)
K13: 1.1 CARATULA (F-02) | L13: 1.2 CARGA ACADÉMICA (F-PD-001) | M13: 1.3 FILOSOFÍA DEL DOCENTE (F-03) | N13: 1.4 CURRÍCULO VITAE (F-04) | O13: 2.1 SILABO (F-CC) | P13: 2.3 RELACIÓN DE ESTUDIANTES (F-CC) | Q13: 2.4 AVANCE ACADÉMICO (F-PD-012) | R13: 2.5 REG. ENTREGA DE SILABO (F-PD-002) | S13: 2.6 REG. DE ASISTENCIA (F-CC) | T13: 3.1 EVIDENCIA DE ACT. DE ENSEÑANZA (F-PD-014) | U13: 4.1 ENUN. Y RESOL. DE EVALUACIÓN DE ENTRADA | V13: 4.2 INF. DE EVALUACIÓN DE ENTRADA (F-10) | W13: PRIMERA EVALUACIÓN | X13: SEGUNDA EVALUACIÓN | Y13: TERCERA EVALUACIÓN | Z13: SUSTITUTORIO | AA13: PRIMERA EVALUACIÓN | AB13: SEGUNDA EVALUACIÓN | AC13: TERCERA EVALUACIÓN | AD13: PRIMERA EVALUACIÓN | AE13: SEGUNDA EVALUACIÓN | AF13: TERCERA EVALUACIÓN | AG13: PRIMERA EVALUACIÓN | AH13: SEGUNDA EVALUACIÓN | AI13: TERCERA EVALUACIÓN | AJ13: SUSTITUTORIO | AK13: PRIMERA EVALUACIÓN | AL13: SEGUNDA EVALUACIÓN | AM13: TERCERA EVALUACIÓN | AN13: 5.1 RÚBRICA PARA LA CALIFICA. DEL PROY. INDIVIDUAL Y GRUPAL (F-PD-007) | AO13: 5.2 DOC. DE ASIGNACION DE PROY. INDIVIDUALES Y GRUPALES (F-PD-010) | AP13: 5.3 INFORME SOBRE AVANCES DE PROYECTOS (F-PD-011) | AQ13: 5.4 INF. ENTREGA FINAL DE PROY, EVAL. Y RESULT. DE CALIFICA. | AR13: 5.5 OTRAS EVALUACIONES -SI CORESPONDE (F-PD-007)